name,main_category,sub_category,image,link,ratings,no_of_ratings,discount_price,actual_price
"WEON Metal Diode, Metal Rectifier PCB for GBJ 2510/3510, Supports 4 No.s of Big Filter Capacitor (Only 1 Plain PCB)",car & motorbike,Car Electronics,https://m.media-amazon.com/images/I/61L9dX+ivHL._AC_UL320_.jpg,https://www.amazon.in/WEON-Rectifier-Supports-Filter-Capacitor/dp/B07SFD8TFQ/ref=sr_1_4080?qid=1679222134&s=electronics&sr=1-4080,4.0,28,₹159,₹245
eHUB 10 Pieces Heat Shrink Insulated Straight Wire Butt Connector Electrical Crimp Terminals (Red),car & motorbike,Car Electronics,https://m.media-amazon.com/images/W/IMAGERENDERING_521856-T1/images/I/41qbFWq0TpL._AC_UL320_.jpg,https://www.amazon.in/eHUB-Insulated-Connector-Electrical-Terminals/dp/B07KM9G86P/ref=sr_1_4177?qid=1679222137&s=electronics&sr=1-4177,3.9,28,₹199,₹249
PROTECTRON FAST BLOW 6.35X30mm GLASS FUSE-20A (pack of 10),car & motorbike,Car Electronics,https://m.media-amazon.com/images/W/IMAGERENDERING_521856-T1/images/I/71uGdbiIoZL._AC_UL320_.jpg,https://www.amazon.in/PROTECTRON-FAST-6-35X30mm-GLASS-FUSE-20A/dp/B078XVJLYJ/ref=sr_1_4178?qid=1679222137&s=electronics&sr=1-4178,3.9,37,₹250,₹550
Autopearl Car Rear View Reverse Parking Camera for Old Swift,car & motorbike,Car Electronics,https://m.media-amazon.com/images/W/IMAGERENDERING_521856-T1/images/I/71Bk5HyG-lL._AC_UL320_.jpg,https://www.amazon.in/Autopearl-Reverse-Parking-Maruti-Suzuki/dp/B015ZJL4EG/ref=sr_1_4179?qid=1679222137&s=electronics&sr=1-4179,4.5,5,₹609,₹899
ELECTROPRIME Electrolytic Radial Capacitors Assortment Set 400V 120UF 105C for VCD Black,car & motorbike,Car Electronics,https://m.media-amazon.com/images/W/IMAGERENDERING_521856-T1/images/I/51zMHWDYUyL._AC_UL320_.jpg,https://www.amazon.in/ELECTROPRIME-Electrolytic-Radial-Capacitors-Assortment/dp/B07NWTJJYG/ref=sr_1_4180?qid=1679222137&s=electronics&sr=1-4180,,,"₹1,790","₹2,166"
CALANDIS USB Interface Ami MMI Audio Aux Mp3 Adapter Cable for Audi Q5 Q8 Q7 A4L A6L,car & motorbike,Car Electronics,https://m.media-amazon.com/images/W/IMAGERENDERING_521856-T1/images/I/51onEXmlMCL._AC_UL320_.jpg,https://www.amazon.in/CALANDIS-Interface-Audio-Adapter-Cable/dp/B0BQFD29TR/ref=sr_1_4181?qid=1679222137&s=electronics&sr=1-4181,,,"₹1,171","₹2,225"
Electronic works Soft Starter for Amplifier Board kit with NTC,car & motorbike,Car Electronics,https://m.media-amazon.com/images/W/IMAGERENDERING_521856-T1/images/I/61vZVNqEL9L._AC_UL320_.jpg,https://www.amazon.in/Electronic-works-Starter-Amplifier-Board/dp/B0B5FH7142/ref=sr_1_4182?qid=1679222137&s=electronics&sr=1-4182,1.0,1,₹520,₹860
MOOSH Handsfree Call Car Charger Wireless Bluetooth FM Transmitter Radio Receiver Mp3 Audio Music Stereo Adapter Type C Po...,car & motorbike,Car Electronics,https://m.media-amazon.com/images/W/IMAGERENDERING_521856-T1/images/I/61hdouHagoL._AC_UL320_.jpg,https://www.amazon.in/MOOSH-Handsfree-Transmitter-Compatible-Smartphones/dp/B09RB55ZVV/ref=sr_1_4183?qid=1679222137&s=electronics&sr=1-4183,,,₹899,"₹1,999"
Viofo A129 Duo G Dual Channel Car DashCam Full HD Starvis Sensor Buffered Parking Mode Motion Detectoin 256GB MicroSD Supp...,car & motorbike,Car Electronics,https://m.media-amazon.com/images/W/IMAGERENDERING_521856-T1/images/I/51pjNifJUnL._AC_UL320_.jpg,https://www.amazon.in/A129-Duo-Buffered-Detectoin-Supported/dp/B08577PXK5/ref=sr_1_4184?qid=1679222137&s=electronics&sr=1-4184,5.0,3,"₹19,999","₹23,999"
HDLiang BT-S3 Wireless Bluetooth Headphone with Mic (Black),car & motorbike,Car Electronics,https://m.media-amazon.com/images/W/IMAGERENDERING_521856-T1/images/I/51un17yTTmL._AC_UL320_.jpg,https://www.amazon.in/Motorcycle-Bluetooth-Headset-Communication-Walkie-Talkie/dp/B07ZB82Q6P/ref=sr_1_4185?qid=1679222137&s=electronics&sr=1-4185,2.8,6,,"₹4,699"
A2D Shark Fin Shape Decorative Roof Car Antenna Black for Maruti Suzuki Swift Dzire Type 1,car & motorbike,Car Electronics,https://m.media-amazon.com/images/W/IMAGERENDERING_521856-T1/images/I/31kLxpXJf5L._AC_UL320_.jpg,https://www.amazon.in/A2D-Decorative-Antenna-Black-Maruti-Suzuki/dp/B07D398J93/ref=sr_1_4186?qid=1679222137&s=electronics&sr=1-4186,1.0,2,₹199,₹419
Vasp Electronics Capacitor 4700uf 50v Aluminium Electrolytic - Pack of 4,car & motorbike,Car Electronics,https://m.media-amazon.com/images/W/IMAGERENDERING_521856-T1/images/I/61413habKOL._AC_UL320_.jpg,https://www.amazon.in/Vasp-Electronics-Capacitor-Aluminium-Electrolytic/dp/B079BFDJ16/ref=sr_1_4187?qid=1679222137&s=electronics&sr=1-4187,3.8,29,₹233,₹349
XORB Flip Covers for OnePlus 10R 5G | Inner TPU | Foldable Stand | Wallet Card Slots (Dual Tone Gold Black),car & motorbike,Car Electronics,https://m.media-amazon.com/images/W/IMAGERENDERING_521856-T1/images/I/71WVItMhmaL._AC_UL320_.jpg,https://www.amazon.in/XORB-Covers-OnePlus-Foldable-Wallet/dp/B0BSLMG6KC/ref=sr_1_4188?qid=1679222137&s=electronics&sr=1-4188,1.0,1,₹499,₹999
AUTONEST Car Audio Radio FM/AM Roof Antenna with Anti-Theft Design (Black) Compatible with Renault Duster,car & motorbike,Car Electronics,https://m.media-amazon.com/images/W/IMAGERENDERING_521856-T1/images/I/31f4n8qelWL._AC_UL320_.jpg,https://www.amazon.in/AUTONEST-Antenna-Anti-Theft-Compatible-Renault/dp/B0BDTXW76W/ref=sr_1_4189?qid=1679222137&s=electronics&sr=1-4189,,,₹449,₹749
ERH India 12v/24v dc to ac Converter Gang Box with Battery Clips with 2 in Built USB Ports. dc to 220v ac Converter 100w,car & motorbike,Car Electronics,https://m.media-amazon.com/images/W/IMAGERENDERING_521856-T1/images/I/51bvywbc3LL._AC_UL320_.jpg,https://www.amazon.in/India-12v-Gang-Battery-Clips/dp/B0B8S1D4YZ/ref=sr_1_4190?qid=1679222137&s=electronics&sr=1-4190,3.0,1,₹559,"₹1,098"
"AUSHA® Full HD Dash Cam Car Dashboard Camera Recorder with Full HD, 2.4"" LCD, 170° Wide Angle, WDR, Night Vision",car & motorbike,Car Electronics,https://m.media-amazon.com/images/W/IMAGERENDERING_521856-T1/images/I/61RsVUluJAL._AC_UL320_.jpg,https://www.amazon.in/AUSHA%C2%AE-Dashboard-Camera-Recorder-Vision/dp/B09X5QS4HF/ref=sr_1_4191?qid=1679222137&s=electronics&sr=1-4191,1.0,2,"₹2,566","₹2,999"
"Mobile Holder for Bike | Metal Bike Mount Holder | Rearview Mirror Mount Stand for Bike, Scooty, Bicycle with 360 Degree R...",car & motorbike,Car Electronics,https://m.media-amazon.com/images/W/IMAGERENDERING_521856-T1/images/I/31ZnOhNcwyL._AC_UL320_.jpg,https://www.amazon.in/Dhaani%EF%BF%BD-Rearview-Rotation-Anti-Vibration-Inch-Black/dp/B09K5TV34Z/ref=sr_1_4192?qid=1679222137&s=electronics&sr=1-4192,2.9,10,₹595,₹999
Autokaar Shark Fin Roof Antenna FM/AM Signal Receiver Car Antenna White for Hyundai Accent,car & motorbike,Car Electronics,https://m.media-amazon.com/images/W/IMAGERENDERING_521856-T1/images/I/31APeXwjHyL._AC_UL320_.jpg,https://www.amazon.in/Autokaar-Antenna-Signal-Receiver-Hyundai/dp/B09B6DNWZP/ref=sr_1_4193?qid=1679222137&s=electronics&sr=1-4193,,,₹325,₹899
"BOBO BM2 Aluminium Waterproof Bike / Motorcycle / Scooter Mobile Phone Holder Mount with 2.5A USB Charger, Ideal for Maps ...",car & motorbike,Car Electronics,https://m.media-amazon.com/images/W/IMAGERENDERING_521856-T1/images/I/61zt4cKrxVS._AC_UL320_.jpg,https://www.amazon.in/BOBO-Claw-Grip-Aluminium-Waterproof-Charger/dp/B07RWDJWN7/ref=sr_1_4194?qid=1679222137&s=electronics&sr=1-4194,4.5,"15,682","₹1,799","₹3,499"
"Hesanzol Mobile Phone Holder for Mini Cooper S Jcw One F54 F55 F56 F57 F60, Special Navigation Mobile Phone Mount for Cent...",car & motorbike,Car Electronics,https://m.media-amazon.com/images/W/IMAGERENDERING_521856-T1/images/I/61SVfEpOdZL._AC_UL320_.jpg,https://www.amazon.in/Mobile-Special-Navigation-Central-Control/dp/B09D94CB3J/ref=sr_1_4195?qid=1679222137&s=electronics&sr=1-4195,3.9,152,,"₹5,106"
MANYCAST® Wireless 3.5mm aux Version Mini Receiver 2 in 1 Transmitter Bt 5.0 Bluetooth Adapter for TV PC Computer Car Spea...,car & motorbike,Car Electronics,https://m.media-amazon.com/images/W/IMAGERENDERING_521856-T1/images/I/517YOk3hfqS._AC_UL320_.jpg,https://www.amazon.in/MANYCAST%C2%AE-Wireless-Receiver-Transmitter-Bluetooth/dp/B0BRY1KZZB/ref=sr_1_4196?qid=1679222137&s=electronics&sr=1-4196,,,₹599,₹999
FLYING INDIA Anti Shake & Fall Prevention 360 Degree Rotation Adjustable Anti Vibration Car Phone Holder for Rear View Mir...,car & motorbike,Car Electronics,https://m.media-amazon.com/images/W/IMAGERENDERING_521856-T1/images/I/41IzOmx5QsL._AC_UL320_.jpg,https://www.amazon.in/FLYING-INDIA-Prevention-Adjustable-Vibration/dp/B0B62YGRZZ/ref=sr_1_4197?qid=1679222137&s=electronics&sr=1-4197,,,₹292,₹999
"Speaker AUX Noise Isolator, Ground Loop Noise Isolator with 3.5mm Audio Cable, Noise Filter for Car Audio Home Stereo Syst...",car & motorbike,Car Electronics,https://m.media-amazon.com/images/W/IMAGERENDERING_521856-T1/images/I/51fVVukJJ5L._AC_UL320_.jpg,https://www.amazon.in/Speaker-Isolator-Compatible-Smartphone-Computer/dp/B09DP613WJ/ref=sr_1_4198?qid=1679222137&s=electronics&sr=1-4198,,,₹899,"₹1,526"
"Rhymestore® 360-Degree Rotating Mobile Car Mount Holder Stand for Windscreen, Dashboard & Table Desk with Double Grip Holder-",car & motorbike,Car Electronics,https://m.media-amazon.com/images/W/IMAGERENDERING_521856-T1/images/I/61JMQbsiThS._AC_UL320_.jpg,https://www.amazon.in/Rhymestore%C2%AE-360-Degree-Rotating-Windscreen-Dashboard/dp/B0995NCB8D/ref=sr_1_4199?qid=1679222137&s=electronics&sr=1-4199,4.0,2,₹399,₹697
ERD car Charger 1AMP,car & motorbike,Car Electronics,https://m.media-amazon.com/images/W/IMAGERENDERING_521856-T1/images/I/3167VjOyFHL._AC_UL320_.jpg,https://www.amazon.in/ERD-car-Charger-1AMP/dp/B07RNQXJC3/ref=sr_1_4200?qid=1679222137&s=electronics&sr=1-4200,,,₹190,₹799
"GO SHOPS Newly USB W26 Cable, Watch Charger Magnetic 2 pin, Watch Charger, w26 + Charger 4mm Adapter Length 45 cm for Smar...",car & motorbike,Car Electronics,https://m.media-amazon.com/images/W/IMAGERENDERING_521856-T1/images/I/51DUFsfmyGL._AC_UL320_.jpg,https://www.amazon.in/GO-SHOPS-Charger-Magnetic-Adapter/dp/B0BMQTKC5J/ref=sr_1_4609?qid=1679222143&s=electronics&sr=1-4609,Get,Only 1 left in stock.,₹149,₹999
WORRICOW Top Selling Car Jaguar Shaped Phone Holder Clip Adjustable Car Dashboard Phone Navigation Clip Stand,car & motorbike,Car Electronics,https://m.media-amazon.com/images/W/IMAGERENDERING_521856-T1/images/I/418LtY-D+0L._AC_UL320_.jpg,https://www.amazon.in/WORRICOW-Selling-Adjustable-Dashboard-Navigation/dp/B0B1QGBFW6/ref=sr_1_4610?qid=1679222143&s=electronics&sr=1-4610,3.3,3,₹275,₹500
"Golden Sand for Oppo F21 Pro 4G, Oppo F21s Pro 4G Back Cover Drop Tested Shock Proof Slim Armor Aramid Carbon Fibre Rugged...",car & motorbike,Car Electronics,https://m.media-amazon.com/images/W/IMAGERENDERING_521856-T1/images/I/71DIJrlTzVL._AC_UL320_.jpg,https://www.amazon.in/Golden-Sand-Tested-Aramid-Carbon/dp/B09Z6KPNHH/ref=sr_1_4611?qid=1679222143&s=electronics&sr=1-4611,4.3,25,₹599,"₹1,199"
MOSTOS ; Brings Superior® - Jaw Grip Waterproof Bike | Motorcycle | Scooter Mobile Phone Holder Mount with Fast USB QC 3.0...,car & motorbike,Car Electronics,https://m.media-amazon.com/images/W/IMAGERENDERING_521856-T1/images/I/617aqs4g2-L._AC_UL320_.jpg,https://www.amazon.in/MOSTOS-Brings-Superior%C2%AE-Motorcycle-Navigation/dp/B09Q84SRZ7/ref=sr_1_4612?qid=1679222143&s=electronics&sr=1-4612,3.9,5,"₹1,699","₹4,999"
Knotyy Faux Leather Flip Case Back Cover for Realme 8s 5G Foldable Stand and Inside Cards Pocket | Shockproof 360 Degree P...,car & motorbike,Car Electronics,https://m.media-amazon.com/images/W/IMAGERENDERING_521856-T1/images/I/81tupcWxsHL._AC_UL320_.jpg,https://www.amazon.in/Knotyy-Leather-Foldable-Shockproof-Magnetic/dp/B09FF8778J/ref=sr_1_4613?qid=1679222143&s=electronics&sr=1-4613,3.8,4,₹249,"₹1,299"
Scosche MP2ODVM-XTSP [4 in 1] Dash/Vent Car Magnetic Phone Mount Kit| Adjustable Swing Arm and Dash Mount Holder | Optimal...,car & motorbike,Car Electronics,https://m.media-amazon.com/images/W/IMAGERENDERING_521856-T1/images/I/61b7ibGsFNL._AC_UL320_.jpg,https://www.amazon.in/SCOSCHE-MP2ODVM-XTSP-Magnetic-Adjustable-Compatible/dp/B09BX4JVKX/ref=sr_1_4614?qid=1679222143&s=electronics&sr=1-4614,4.0,57,"₹1,749","₹4,999"
Infinizy (Today Only Offer:2 Years Warranty) Wireless Bluetooth Car Kit FM Transmitter Handsfree Car Charger MP3 Player USB,car & motorbike,Car Electronics,https://m.media-amazon.com/images/W/IMAGERENDERING_521856-T1/images/I/51EA9Zx0FNL._AC_UL320_.jpg,https://www.amazon.in/Infinizy-Today-Only-Offer-Transmitter/dp/B099WXN451/ref=sr_1_4615?qid=1679222143&s=electronics&sr=1-4615,1.0,1,₹495,"₹1,999"
"BACKET Bluetooth Car Device with Call Receiver for Music System, FM Transmitter for Hands Free Calls & Music Streaming wit...",car & motorbike,Car Electronics,https://m.media-amazon.com/images/W/IMAGERENDERING_521856-T1/images/I/41As7YYEYOS._AC_UL320_.jpg,https://www.amazon.in/BACKET-Bluetooth-Receiver-Transmitter-Streaming/dp/B098B6PRKK/ref=sr_1_4616?qid=1679222143&s=electronics&sr=1-4616,3.2,19,₹599,₹999
PANISTHA 5 Pieces 10 AMP Blade Fuse with Fuse Holder 12V Plastic Ceramic Blade Fuse Box,car & motorbike,Car Electronics,https://m.media-amazon.com/images/W/IMAGERENDERING_521856-T1/images/I/31LwBDvc1HS._AC_UL320_.jpg,https://www.amazon.in/PANISTHA-Pieces-Holder-Plastic-Ceramic/dp/B097YW49RG/ref=sr_1_4617?qid=1679222143&s=electronics&sr=1-4617,,,₹275,₹800
MODERN IN Bicycle Motorcycle Silicon Mobile Holder Bracket Stand for Adventure Tracking Travelling Navigation with Perfect...,car & motorbike,Car Electronics,https://m.media-amazon.com/images/W/IMAGERENDERING_521856-T1/images/I/61Ka6DCp+iL._AC_UL320_.jpg,https://www.amazon.in/MODERN-Motorcycle-Adventure-Travelling-Navigation/dp/B08QR5KYBT/ref=sr_1_4618?qid=1679222143&s=electronics&sr=1-4618,2.0,5,₹299,"₹1,299"
WolkomHome High performance Shark Fin Antenna RED color Car FM Radio Signal Aerials for Volkswagen Vento,car & motorbike,Car Electronics,https://m.media-amazon.com/images/W/IMAGERENDERING_521856-T1/images/I/61QouRBCKRL._AC_UL320_.jpg,https://www.amazon.in/WolkomHome-performance-Antenna-Aerials-Volkswagen/dp/B08PPMSG12/ref=sr_1_4619?qid=1679222143&s=electronics&sr=1-4619,4.0,45,₹621,₹899
WolkomHome High performance Shark Fin Antenna White color Car FM Radio Signal Aerials for Hyundai Xcent New,car & motorbike,Car Electronics,https://m.media-amazon.com/images/W/IMAGERENDERING_521856-T1/images/I/71HIjDtObXL._AC_UL320_.jpg,https://www.amazon.in/WolkomHome-performance-Antenna-Aerials-Hyundai/dp/B08DV9H27C/ref=sr_1_4620?qid=1679222143&s=electronics&sr=1-4620,3.0,1,₹569,₹749
King Shine Metal Body Car Clamp Magnetic Air Vent Mobile Holding Mount for Smartphones L Shape | Lightweight | Travel Stan...,car & motorbike,Car Electronics,https://m.media-amazon.com/images/W/IMAGERENDERING_521856-T1/images/I/31HKN7Y8UQL._AC_UL320_.jpg,https://www.amazon.in/Magnetic-Mobile-Holding-Smartphones-Lightweight/dp/B084DSPW6P/ref=sr_1_4621?qid=1679222143&s=electronics&sr=1-4621,3.7,32,₹269,"₹1,299"
"Nk Star Universal Portable Dual Usb Car Charger Adapter With 5 In 1 Multi Pin Charging Cable For All Smartphones, Cellular...",car & motorbike,Car Electronics,https://m.media-amazon.com/images/W/IMAGERENDERING_521856-T1/images/I/51f5sPzv60L._AC_UL320_.jpg,https://www.amazon.in/NK-STAR-Universal-Portable-Smartphones/dp/B07YX2PL2J/ref=sr_1_4622?qid=1679222143&s=electronics&sr=1-4622,3.3,122,₹298,₹999
Oshotto Car Shark Fin Roof Antenna Car Antenna Radio FM/AM Car Decorate Compatible with Hyundai i20 Active 2015-2020 - (Bl...,car & motorbike,Car Electronics,https://m.media-amazon.com/images/W/IMAGERENDERING_521856-T1/images/I/61Q3KGNQ4mL._AC_UL320_.jpg,https://www.amazon.in/Oshotto-Antenna-Decorate-Hyundai-Active/dp/B07PY3BVP4/ref=sr_1_4623?qid=1679222143&s=electronics&sr=1-4623,3.2,36,₹800,"₹1,000"
DULCET DC-S40 240 Watt Outdoor Speaker,car & motorbike,Car Electronics,https://m.media-amazon.com/images/W/IMAGERENDERING_521856-T1/images/I/71WLyHDElfL._AC_UL320_.jpg,https://www.amazon.in/Dulcet-DC-S40-Coaxial-Speakers-Speaker/dp/B07NNKCPXN/ref=sr_1_4624?qid=1679222143&s=electronics&sr=1-4624,3.7,77,₹948,"₹1,790"
REYAX RYLR896 Lora Module SX1276 UART 868MHz 915MHz Antenna at Command FCC NCC,car & motorbike,Car Electronics,https://m.media-amazon.com/images/W/IMAGERENDERING_521856-T1/images/I/41KYtRSkaZL._AC_UL320_.jpg,https://www.amazon.in/REYAX-RYLR896-Module-Antenna-Command/dp/B07NB3BK5H/ref=sr_1_4625?qid=1679222143&s=electronics&sr=1-4625,4.6,71,"₹5,575","₹7,969"
"Kingsway Shark Fin Antenna Roof Aerial Base AM FM Redio Signal, Replace Existing Car Antenna, Waterproof Rubber Ring with ...",car & motorbike,Car Electronics,https://m.media-amazon.com/images/W/IMAGERENDERING_521856-T1/images/I/311eTiuKMkL._AC_UL320_.jpg,https://www.amazon.in/Kingsway-Shark-Antenna-Chevrolet-Captiva/dp/B07BL2G5YP/ref=sr_1_4626?qid=1679222143&s=electronics&sr=1-4626,3.3,232,₹849,"₹1,698"
76MHz-108MHz Wireless Stereo FM Radio Kit Audio Receiver PCB FM Module Kits Learning Electronics For Diy 1.8-3.6VDC,car & motorbike,Car Electronics,https://m.media-amazon.com/images/W/IMAGERENDERING_521856-T1/images/I/71URPBdrCUL._AC_UL320_.jpg,https://www.amazon.in/Robocraze-76MHz-108MHz-Wireless-Electronics-1-8-3-6VDC/dp/B077SVHKPW/ref=sr_1_4627?qid=1679222143&s=electronics&sr=1-4627,3.2,22,₹655,"₹1,376"
"Tech-lobby 5200-1943 4 MOSFET12V DC-to 35V DC Support AMPLFIEIR with Remote USB,BLUTHOOTH,AUX,MMC,FM 1000 WATT PMPO HIGH S...",car & motorbike,Car Electronics,https://m.media-amazon.com/images/W/IMAGERENDERING_521856-T1/images/I/71ZrGmq226L._AC_UL320_.jpg,https://www.amazon.in/Tech-lobby-5200-1943-MOSFET12V-AMPLFIEIR-BLUTHOOTH/dp/B0BQR7GK21/ref=sr_1_4628?qid=1679222143&s=electronics&sr=1-4628,Get,FREE Delivery by Amazon,"₹2,899","₹4,999"
"TJOM USB Mobile Bike Charger|Motorcycle Waterproof Mobile USB Charger|Smartphone Any Season Use for Bike, Scooty,and More ...",car & motorbike,Car Electronics,https://m.media-amazon.com/images/W/IMAGERENDERING_521856-T1/images/I/615jbK2AZ1L._AC_UL320_.jpg,https://www.amazon.in/TJOM-Motorcycle-Waterproof-Smartphone-Electronic/dp/B09MJQM4Q2/ref=sr_1_4629?qid=1679222143&s=electronics&sr=1-4629,,,₹249,₹999
"3.1A Fast Charging Car Charger For Samsung Galaxy A71 5G 18W Qualcomm Quick Charge 3.0 Car Charger, Fire Resistant, Lightw...",car & motorbike,Car Electronics,https://m.media-amazon.com/images/W/IMAGERENDERING_521856-T1/images/I/51OLDgPozoL._AC_UL320_.jpg,https://www.amazon.in/Samsung-Galaxy-A71-5G-Lightweight/dp/B09CKL7K18/ref=sr_1_4630?qid=1679222143&s=electronics&sr=1-4630,,,₹490,₹999
MIZZEO Car Aluminium Fiber Car Auto AM/FM Radio Aerial Antenna with Screws (Carbon Black) for Renault Duster,car & motorbike,Car Electronics,https://m.media-amazon.com/images/W/IMAGERENDERING_521856-T1/images/I/41SuZ5xTiZS._AC_UL320_.jpg,https://www.amazon.in/MIZZEO-Aluminium-Aerial-Antenna-Renault/dp/B094ZP48PP/ref=sr_1_4631?qid=1679222143&s=electronics&sr=1-4631,5.0,1,₹549,₹799
Xester® Vintage Leather Flip Cover Case Compatible with REDMI MI A1 | Inner TPU | Foldable Stand | Magnetic Closure | Wall...,car & motorbike,Car Electronics,https://m.media-amazon.com/images/W/IMAGERENDERING_521856-T1/images/I/81zUAsEsd0L._AC_UL320_.jpg,https://www.amazon.in/Xester%C2%AE-Vintage-Compatible-Foldable-Magnetic/dp/B08RCW4GL6/ref=sr_1_4632?qid=1679222143&s=electronics&sr=1-4632,3.6,7,₹282,₹999
Mahindra Scorpio Car Charger Dual Port USB Car Charger | High Speed Rapid Fast Turbo Metal Android & Tablets Car Mobile Ch...,car & motorbike,Car Electronics,https://m.media-amazon.com/images/I/41wti6O4ipL._AC_UL320_.jpg,https://www.amazon.in/Mahindra-Scorpio-Charging-Universal-Multicolor/dp/B08HDCR1HK/ref=sr_1_4657?qid=1679222145&s=electronics&sr=1-4657,,,₹365,"₹1,199"
"FLAWISH 10W DIY Qi Wireless Charger Module PCBA Circuit Board + 2 Coil Charging for Samsung S6, S6 Edge, S6 Edge+, S7, S7 ...",car & motorbike,Car Electronics,https://m.media-amazon.com/images/I/61kC4GBZscL._AC_UL320_.jpg,https://www.amazon.in/NF-Wireless-Charger-Circuit-Charging/dp/B07L898R9F/ref=sr_1_4658?qid=1679222145&s=electronics&sr=1-4658,5.0,1,"₹1,067","₹2,178"
"Pudini® Car Mount Adjustable Car Phone Holder Universal Long Arm, Windshield Premium Air Vent Universal Car Mount Holder f...",car & motorbike,Car Electronics,https://m.media-amazon.com/images/I/51rD77wQCVL._AC_UL320_.jpg,https://www.amazon.in/Car-Adjustable-Phone-Holder-Windshield/dp/B07GDND1RD/ref=sr_1_4659?qid=1679222145&s=electronics&sr=1-4659,,,₹799,"₹2,999"
"Fuse Block, Huazu 12V Fuse Box with LED Indicator Waterproof Cover 6 Circuits with Negative Bus Fuse Panel for DC 12V/24V ...",car & motorbike,Car Electronics,https://m.media-amazon.com/images/I/71Ull7oY+jL._AC_UL320_.jpg,https://www.amazon.in/Huazu-Indicator-Waterproof-Circuits-Negative/dp/B09VGCCD9R/ref=sr_1_4660?qid=1679222145&s=electronics&sr=1-4660,4.0,77,,"₹3,146"
Hikig Car headrest Mount for 7 to 11 inch Swivel & Flip Style Portable DVD Player - Black,car & motorbike,Car Electronics,https://m.media-amazon.com/images/I/61GAYuXDOHL._AC_UL320_.jpg,https://www.amazon.in/Hikig-headrest-Swivel-Portable-Player/dp/B07G766YFB/ref=sr_1_4661?qid=1679222145&s=electronics&sr=1-4661,4.5,"1,264","₹2,852","₹3,999"
B11-Bluetooth Wireless in Ear Earphones with Mic Sport Stereo S -Free for All Smartphones & Tablets,car & motorbike,Car Electronics,https://m.media-amazon.com/images/I/31mePXM5F9L._AC_UL320_.jpg,https://www.amazon.in/B11-Bluetooth-Wireless-Earphones-Smartphones-Tablets/dp/B0BY1DLG28/ref=sr_1_4662?qid=1679222145&s=electronics&sr=1-4662,,,₹149,₹999
"Ultra Fast Dual port Car Charger For OnePlus Nord 2T, OnePlus Nord 2 T Car Charger | High Speed Rapid Fast Turbo Metal And...",car & motorbike,Car Electronics,https://m.media-amazon.com/images/I/41CQjW6P1UL._AC_UL320_.jpg,https://www.amazon.in/Charger-OnePlus-Android-Tablets-Charging/dp/B0BXLJDFHS/ref=sr_1_4663?qid=1679222145&s=electronics&sr=1-4663,,,₹440,₹999
XORB Flip Covers for Poco M4 Pro 4G | Inner TPU | Foldable Stand | Wallet Card Slots (Dual Slash Gold Black),car & motorbike,Car Electronics,https://m.media-amazon.com/images/I/61s94UyIgSL._AC_UL320_.jpg,https://www.amazon.in/XORB-Covers-Inner-Foldable-Wallet/dp/B0BSKNZQBH/ref=sr_1_4664?qid=1679222145&s=electronics&sr=1-4664,,,₹299,₹999
SPREADX Car Dashboard Mobile Phone Stand Bracket Holder Strong Magnetic for Maruti Suzuki Nexa Baleno 2022,car & motorbike,Car Electronics,https://m.media-amazon.com/images/I/518zGzBHEXL._AC_UL320_.jpg,https://www.amazon.in/SPREADX-Dashboard-Mobile-Bracket-Magnetic/dp/B0BR5NZPPK/ref=sr_1_4665?qid=1679222145&s=electronics&sr=1-4665,,,₹299,₹499
COVERNEW Samsung Galaxy A04-5G Flip Cover | Full Body Protection | Inside Pockets & Stand | Wallet Stylish Button Magnetic...,car & motorbike,Car Electronics,https://m.media-amazon.com/images/I/51W+EoDGvTL._AC_UL320_.jpg,https://www.amazon.in/COVERNEW-Samsung-Galaxy-Protection-Magnetic/dp/B0BMZJP5VK/ref=sr_1_4666?qid=1679222145&s=electronics&sr=1-4666,,,₹237,₹799
ERH India 12v/24v DC to AC Converter Gang Box with Data Cable with 2 in Built USB Ports. 12v dc to 220v ac Converter,car & motorbike,Car Electronics,https://m.media-amazon.com/images/I/61190XVzx4L._AC_UL320_.jpg,https://www.amazon.in/India-12v-24v-Gang-Box/dp/B0B8P3RVHC/ref=sr_1_4667?qid=1679222145&s=electronics&sr=1-4667,3.0,3,₹558,"₹1,098"
"SKADIOO Car Mobile Holder, Mobile Holder for Car, Mobile Stand for Car, Phone Holder for Car, Car Phone Holder, Car Mobile...",car & motorbike,Car Electronics,https://m.media-amazon.com/images/I/71qMKjOpysL._AC_UL320_.jpg,https://www.amazon.in/SKADIOO-Mobile-Dashboard-Adjustable-Universal/dp/B0B5L7CW2J/ref=sr_1_4668?qid=1679222145&s=electronics&sr=1-4668,3.4,28,₹284,₹399
SEVAM Universal Clip On Car HUD GPS Dashboard Mount Cell Phone Holder Non-Slip Stand Compatible for 4.7-6.5 inch Smartphon...,car & motorbike,Car Electronics,https://m.media-amazon.com/images/I/41w1wzBu8bL._AC_UL320_.jpg,https://www.amazon.in/SEVAM-Universal-Dashboard-Compatible-Smartphones/dp/B09ZYRPSZ2/ref=sr_1_4669?qid=1679222145&s=electronics&sr=1-4669,2.4,39,₹389,"₹1,299"
XUEBIN Car Phone Mount 360 Degree Rotation Dashboard Phone Holder for Car Clip Mount Stand Suitable for 4 to 7 inch All Sm...,car & motorbike,Car Electronics,https://m.media-amazon.com/images/I/71EoIPmLgeL._AC_UL320_.jpg,https://www.amazon.in/XUEBIN-Rotation-Dashboard-Suitable-Smartphone/dp/B09DS8Y2ZZ/ref=sr_1_4670?qid=1679222145&s=electronics&sr=1-4670,3.0,8,₹449,₹999
AUTO SNAP 9 Inches 22cm Touch Screen Android 12 Gorilla Glass IPS Display Car Stereo with 2GB RAM/16 GB ROM GPS/Wi-Fi/Navi...,car & motorbike,Car Electronics,https://m.media-amazon.com/images/I/61N+rzUlloL._AC_UL320_.jpg,https://www.amazon.in/Screen-Android-Display-Flashing-Navigation/dp/B08JC7W83B/ref=sr_1_4671?qid=1679222145&s=electronics&sr=1-4671,3.6,706,"₹8,649","₹35,000"
AllExtreme EXBM1PH Universal Mobile Mount Cell Phone Holder 360 Rotation Bike Mobile Charger for Motorcycles & Bikes (Black),car & motorbike,Car Electronics,https://m.media-amazon.com/images/I/51lI0PnG5mL._AC_UL320_.jpg,https://www.amazon.in/AllExtreme-Waterproof-Universal-Motorcycle-Smartphone/dp/B0716G2WV4/ref=sr_1_4672?qid=1679222145&s=electronics&sr=1-4672,3.1,"1,978",,₹419
Generic Wireless 3. 5mm Car Music Audio FM Transmitter for iPod Mobile iPhone,car & motorbike,Car Electronics,https://m.media-amazon.com/images/I/41RqbVrSe5L._AC_UL320_.jpg,https://www.amazon.in/Generic-Wireless-Transmitter-Mobile-iPhone/dp/B06XHM22G4/ref=sr_1_4673?qid=1679222145&s=electronics&sr=1-4673,4.1,34,"₹1,689","₹3,378"
"AC to DC 12V Wall Power Converter, Car Power Supply Plug Adapter Charging Indicator 100‑240V Safe Stable with Cigarette Li...",car & motorbike,Car Electronics,https://m.media-amazon.com/images/I/51c5CM60foL._AC_UL320_.jpg,https://www.amazon.in/Converter-Charging-Indicator-Cigarette-Electronics/dp/B0BSBRFPJK/ref=sr_1_4674?qid=1679222145&s=electronics&sr=1-4674,,,₹822,"₹1,938"
