name,main_category,sub_category,image,link,ratings,no_of_ratings,discount_price,actual_price
Belfin JRC 4558 IC Dual Audio Op Amp - Pack of 6 Pic,car & motorbike,Car Electronics,https://m.media-amazon.com/images/W/IMAGERENDERING_521856-T1/images/I/41xl4i82rlL._AC_UL320_.jpg,https://www.amazon.in/Belfin-JRC-4558-Dual-Audio/dp/B08297XVFD/ref=sr_1_3014?qid=1679222112&s=electronics&sr=1-3014,3.8,10,₹128,₹399
Auto Pearl Shark Fin Antenna Universal Replacement Car Antenna Roof Aerial ABS Material Waterproof Rubber Ring AM FM Radio...,car & motorbike,Car Electronics,https://m.media-amazon.com/images/W/IMAGERENDERING_521856-T1/images/I/61HRNGpZCnL._AC_UL320_.jpg,https://www.amazon.in/Auto-Pearl-Replacement-Volkswagen-Polo/dp/B0126JMN8Y/ref=sr_1_3015?qid=1679222112&s=electronics&sr=1-3015,3.6,"1,894",₹499,"₹1,499"
"Amazonbasics 5V 2.4A 12W Straight Cable Lightning USB Car Charger Compatible with Mp 3 Players (3', Black)",car & motorbike,Car Electronics,https://m.media-amazon.com/images/W/IMAGERENDERING_521856-T1/images/I/71vh5KgMAaL._AC_UL320_.jpg,https://www.amazon.in/AmazonBasics-Straight-Cable-Lightning-Charger/dp/B071GQXN34/ref=sr_1_3016?qid=1679222112&s=electronics&sr=1-3016,4.5,"1,896",,"₹1,999"
"MODERN IN Motorcycle Phone Mount with USB Charger Port,Bike Motorcycle Cell Phone Holder Mount Stand Bracket for Most Mobi...",car & motorbike,Car Electronics,https://m.media-amazon.com/images/W/IMAGERENDERING_521856-T1/images/I/417Tw+dspoL._AC_UL320_.jpg,https://www.amazon.in/MODERN-Motorcycle-Smartphones-Adjustable-Handlebar/dp/B08QRWYL3P/ref=sr_1_3017?qid=1679222112&s=electronics&sr=1-3017,3.1,64,₹449,"₹1,299"
SEVAM Mobile Phone Holder Car Model Anti Shake Fall Prevention | Full Rotation | Anti-Vibration Pads Stand | Adjustable Ca...,car & motorbike,Car Electronics,https://m.media-amazon.com/images/W/IMAGERENDERING_521856-T1/images/I/51fKxLLT1lL._AC_UL320_.jpg,https://www.amazon.in/SEVAM-Prevention-Rotation-Anti-Vibration-Adjustable/dp/B09MH7RCL2/ref=sr_1_3018?qid=1679222112&s=electronics&sr=1-3018,3.2,10,₹299,"₹1,299"
FLAWISH Truck Scanner Code Reader Device OBD2 16 to 9 Pin Adapter Connector Cable,car & motorbike,Car Electronics,https://m.media-amazon.com/images/W/IMAGERENDERING_521856-T1/images/I/51KbEKhRUTL._AC_UL320_.jpg,https://www.amazon.in/FLAWISH-Scanner-Reader-Adapter-Connector/dp/B07MCRL1XY/ref=sr_1_3019?qid=1679222112&s=electronics&sr=1-3019,,,"₹1,926","₹4,138"
"BROLAVIYA 360° Rotation Heavy Duty Aluminum Alloy Mirror Mount Mobile Phone Holder Stand for Motorcycle Bike, Scooty, Elec...",car & motorbike,Car Electronics,https://m.media-amazon.com/images/W/IMAGERENDERING_521856-T1/images/I/61pb7OyiXxL._AC_UL320_.jpg,https://www.amazon.in/BROLAVIYA-Rotation-Aluminum-Motorcycle-Electric/dp/B0B7B46H3T/ref=sr_1_3020?qid=1679222112&s=electronics&sr=1-3020,4.3,825,"₹1,295","₹1,499"
Kimloo Car G7 Universal Bluetooth USB Car Charger with FM Transmitter in-Car FM Adapter | Car Kit with Hand-Free Call & St...,car & motorbike,Car Electronics,https://m.media-amazon.com/images/W/IMAGERENDERING_521856-T1/images/I/419-OfZSzES._AC_UL320_.jpg,https://www.amazon.in/Universal-Bluetooth-Transmitter-Compatible-Smartphones/dp/B094FWG27H/ref=sr_1_3021?qid=1679222112&s=electronics&sr=1-3021,3.0,20,₹349,₹999
Pinaaki Enterprises Redmi A1 2022 Flip Case | Premium Leather Finish Flip Cover | with Card Pockets | Wallet Stand |Comple...,car & motorbike,Car Electronics,https://m.media-amazon.com/images/W/IMAGERENDERING_521856-T1/images/I/61GzRN-TyFL._AC_UL320_.jpg,https://www.amazon.in/Pinaaki-Enterprises-Premium-Complete-Protection/dp/B0BFX7T774/ref=sr_1_3022?qid=1679222112&s=electronics&sr=1-3022,4.0,124,₹169,₹999
"Verilux® 2-in-1 Bluetooth 5.0 Receiver and Transmitter for Home Theatre, TV, Car, Music System, Bluetooth Adapter for TV, ...",car & motorbike,Car Electronics,https://m.media-amazon.com/images/W/IMAGERENDERING_521856-T1/images/I/71xIrgI-rmL._AC_UL320_.jpg,https://www.amazon.in/Verilux%C2%AE-Bluetooth-Receiver-Transmitter-Converter/dp/B09TDGCXJ6/ref=sr_1_3023?qid=1679222112&s=electronics&sr=1-3023,3.0,15,"₹1,006","₹1,262"
VKSUN MP3 Player Speakers Audio Sound System FM Radio Security Alarm Wireless Remote with USB SD Slot For Bajaj Discover 1...,car & motorbike,Car Electronics,https://m.media-amazon.com/images/W/IMAGERENDERING_521856-T1/images/I/61KYm-lnCSL._AC_UL320_.jpg,https://www.amazon.in/Player-Speakers-Security-Wireless-Discover/dp/B0BM9MJP12/ref=sr_1_3024?qid=1679222112&s=electronics&sr=1-3024,,,₹899,"₹1,999"
Maruti Gypsy Car FM Antenna Compatible for Maruti Gypsy | Omni Van | Maruti Eco,car & motorbike,Car Electronics,https://m.media-amazon.com/images/I/612AJ+mMG1L._AC_UL320_.jpg,https://www.amazon.in/Maruti-Gypsy-Antenna-Compatible-Omni/dp/B0BS6G8J5L/ref=sr_1_3049?qid=1679222114&s=electronics&sr=1-3049,,,₹489,₹899
SD CASS® Premium- Car Phone Holder for Rear View Mirror Mount Stand | Anti Shake & Fall Prevention | Adjustable Anti-Vibra...,car & motorbike,Car Electronics,https://m.media-amazon.com/images/I/51K-uLRRzUL._AC_UL320_.jpg,https://www.amazon.in/SD-Holder-Phone-Universal-Smartphone/dp/B09MJPW487/ref=sr_1_3050?qid=1679222114&s=electronics&sr=1-3050,5.0,2,₹299,₹999
Jkobi Flip Cover Case for Redmi Note 12 5G (Professional Dual Leather Finish | Magnetic Closure | 360 Degree Camera Protec...,car & motorbike,Car Electronics,https://m.media-amazon.com/images/I/71W6-eX3o1L._AC_UL320_.jpg,https://www.amazon.in/Jkobi-Redmi-Note-12-Professional/dp/B0BYDWTJLX/ref=sr_1_3051?qid=1679222114&s=electronics&sr=1-3051,4.6,3,₹256,₹999
Steko (Pack of 20 Pieces) 4700uF 25v Electrolytic Capacitors | Electronic Circuits Repair | Electronic Component | DIY Sci...,car & motorbike,Car Electronics,https://m.media-amazon.com/images/I/61Ts-EuUlyL._AC_UL320_.jpg,https://www.amazon.in/Steko-Electrolytic-Capacitors-Electronic-Component/dp/B0BLJZGTKR/ref=sr_1_3052?qid=1679222114&s=electronics&sr=1-3052,,,₹299,₹599
"PowerBass PB-650C-EI 600W 2-Way 6.5"" Component Speakers",car & motorbike,Car Electronics,https://m.media-amazon.com/images/I/714bF1TNVyL._AC_UL320_.jpg,https://www.amazon.in/PowerBass-PB-650C-EI-2-Way-Component-Speakers/dp/B0B6SXSNCY/ref=sr_1_3053?qid=1679222114&s=electronics&sr=1-3053,5.0,4,"₹6,890","₹11,990"
"BROLAVIYA Car Back seat Headrest Hook Hanger 2 in 1 Design, Universal Backseat Hook for Phone, Purse, Grocery Bag & Handbag",car & motorbike,Car Electronics,https://m.media-amazon.com/images/I/41jYl5dQbfL._AC_UL320_.jpg,https://www.amazon.in/BROLAVIYA-Headrest-Universal-Backseat-Grocery/dp/B09NHTQWHQ/ref=sr_1_3054?qid=1679222114&s=electronics&sr=1-3054,3.5,15,₹284,₹999
ULTRAPROLINK UM1073 Adjustable Holder Universal Dash Mount|Compact One Touch one Hand Operated|Car Holder Dashboard & Wind...,car & motorbike,Car Electronics,https://m.media-amazon.com/images/I/51EMvKHDXkL._AC_UL320_.jpg,https://www.amazon.in/UltraProlink-Adjustable-Universal-Windscreen-Smartphones/dp/B09W9F65SC/ref=sr_1_3055?qid=1679222114&s=electronics&sr=1-3055,3.2,60,₹549,₹699
"Portronics AUTO 10 POR-320, Bluetooth - FM Transmitter in-Car Radio Adapter (Black) & AUTO 12 in-Car Bluetooth Receiver(Bl...",car & motorbike,Car Electronics,https://m.media-amazon.com/images/I/51ujoB22VFL._AC_UL320_.jpg,https://www.amazon.in/Portronics-AUTO-POR-320-Bluetooth-Car/dp/B0BR54F9K4/ref=sr_1_3056?qid=1679222114&s=electronics&sr=1-3056,3.9,294,"₹1,420","₹3,397"
VKSUN Waterproof Heavy Duty Bike/Scooty USB Mobile Charger (Fast Charging Output: 5V-1.5A) Silicon Cover with On/Off Switc...,car & motorbike,Car Electronics,https://m.media-amazon.com/images/I/31q6IuWxu4L._AC_UL320_.jpg,https://www.amazon.in/Waterproof-Scooty-Mobile-Charger-Charging/dp/B0B53PB7R5/ref=sr_1_3057?qid=1679222114&s=electronics&sr=1-3057,2.0,1,₹249,"₹1,299"
"Rambot Digital Bluetooth Audio Transmitter for TV Smart Phone, PC, MP3, MP4, and DVD Car Player Wireless Transmitter 3.5mm...",car & motorbike,Car Electronics,https://m.media-amazon.com/images/I/51EQKsBUvpL._AC_UL320_.jpg,https://www.amazon.in/Rambot-Digital-Bluetooth-Transmitter-Wireless/dp/B08WCX42NW/ref=sr_1_3058?qid=1679222114&s=electronics&sr=1-3058,5.0,1,₹799,"₹2,999"
"iOttie Easy One Touch 5 Cup Holder Car Mount Phone Holder for iPhone, Samsung, Moto, Huawei, Nokia, LG, Smartphones",car & motorbike,Car Electronics,https://m.media-amazon.com/images/I/61IKwuO5jpL._AC_UL320_.jpg,https://www.amazon.in/iOttie-Holder-iPhone-Samsung-Smartphones/dp/B089J28SHP/ref=sr_1_3059?qid=1679222114&s=electronics&sr=1-3059,4.5,"3,883","₹3,490","₹4,999"
"HUMSER Electric Scooter/Motorcycle DC-DC Convertor, Input: 36V to 72V, Output: 12VDC 20A (Size:30X65X41MM)",car & motorbike,Car Electronics,https://m.media-amazon.com/images/I/41aAfXf4pyL._AC_UL320_.jpg,https://www.amazon.in/HUMSER-Electric-Scooter-Motorcycle-Convertor/dp/B0BR7FNZGX/ref=sr_1_3060?qid=1679222114&s=electronics&sr=1-3060,,,"₹1,499","₹2,199"
Semaphore® Adjustable Mobile Phone Holder for Car Driving Center Console Dashboard Mount Storage Bracket Adhesive (Compati...,car & motorbike,Car Electronics,https://m.media-amazon.com/images/I/51onL6WZ-FL._AC_UL320_.jpg,https://www.amazon.in/Semaphore%C2%AE-Adjustable-Dashboard-Adhesive-Compatible/dp/B0BPD77KX5/ref=sr_1_3061?qid=1679222114&s=electronics&sr=1-3061,,,₹375,₹699
"RidersCart Premium Universal Fit Bluetooth Mini Car Stereo, MP3 Player with FM, AUX & USB",car & motorbike,Car Electronics,https://m.media-amazon.com/images/I/61WjtQMnwcL._AC_UL320_.jpg,https://www.amazon.in/RidersCart-Premium-Universal-Bluetooth-Stereo/dp/B0BJTWKP6P/ref=sr_1_3062?qid=1679222114&s=electronics&sr=1-3062,1.0,1,"₹1,398","₹2,999"
"GoSale 3.1 Amp Dual USB Port Car Charger for Maruti Suzuki Celerio X, Eeco, Alto 800, Alto K10 / K 10, Alto Lxi, Alto STD,...",car & motorbike,Car Electronics,https://m.media-amazon.com/images/I/61bLBifjNnL._AC_UL320_.jpg,https://www.amazon.in/GoSale-Car-Charger-Celerio-Android/dp/B08L8BX6DG/ref=sr_1_3063?qid=1679222114&s=electronics&sr=1-3063,5.0,2,₹479,₹999
King Shine Car Dashboard Phone Holder Mount Mobile Clip Stand for All Smartphones,car & motorbike,Car Electronics,https://m.media-amazon.com/images/I/61f5wfH+dBL._AC_UL320_.jpg,https://www.amazon.in/Shine-Dashboard-Holder-Mobile-Smartphones/dp/B07YB4QNT9/ref=sr_1_3064?qid=1679222114&s=electronics&sr=1-3064,2.8,739,₹299,₹499
"SKYSTAR Zinc Dashboard Magnetic Mobile Holder for Car, Bike, Office, Home (7cm, Black)",car & motorbike,Car Electronics,https://m.media-amazon.com/images/I/41DQ9qKPgiL._AC_UL320_.jpg,https://www.amazon.in/SKYSTAR-Magnetic-Mobile-Holder-Office/dp/B09HPTRSKH/ref=sr_1_3065?qid=1679222114&s=electronics&sr=1-3065,4.0,7,₹599,"₹1,199"
Salcon Electronics Hi-Fi 5.1 Prologic Decoder PreAmp Kit Audio Board Home Theatre,car & motorbike,Car Electronics,https://m.media-amazon.com/images/I/81GoaWD4lvL._AC_UL320_.jpg,https://www.amazon.in/Salcon-Electronics-Prologic-Decoder-Theatre/dp/B07KX3J5L4/ref=sr_1_3066?qid=1679222114&s=electronics&sr=1-3066,3.5,113,₹700,₹800
WorldCare® Power 1000W Peak Modified Sine Wave Converter DC 12V/24V To AC 220V USB Plug Port310573 | Pack of 1,car & motorbike,Car Electronics,https://m.media-amazon.com/images/I/61zqYAxge6L._AC_UL320_.jpg,https://www.amazon.in/WorldCare%C2%AE-Power-Modified-Converter-Port310573/dp/B09M956NSH/ref=sr_1_3067?qid=1679222114&s=electronics&sr=1-3067,3.7,3,"₹4,699","₹9,592"
kimloo Wireless Car Bluetooth FM Transmitter Radio Adapter Calling/Music Control/USB Charging Port,car & motorbike,Car Electronics,https://m.media-amazon.com/images/I/41vHrxaWCZL._AC_UL320_.jpg,https://www.amazon.in/kimloo-Wireless-Bluetooth-Transmitter-Charging/dp/B0B4DCTBWD/ref=sr_1_3068?qid=1679222114&s=electronics&sr=1-3068,3.7,4,₹549,"₹1,299"
Pinaaki Enterprises Oppo A16K Flip Case | Premium Leather Finish Flip Cover | with Card Pockets | Wallet Stand |Complete P...,car & motorbike,Car Electronics,https://m.media-amazon.com/images/I/61FrhK0R+RL._AC_UL320_.jpg,https://www.amazon.in/Pinaaki-Enterprises-Premium-Complete-Protection/dp/B09Q242ZGJ/ref=sr_1_3069?qid=1679222114&s=electronics&sr=1-3069,3.6,14,₹169,₹179
HOJI Universal Metal Plate 1 Pack for Magnetic Phone Car Mount Holder Cradle with Adhesive (Compatible with Magnetic Mount...,car & motorbike,Car Electronics,https://m.media-amazon.com/images/I/31nIB5Hb2kL._AC_UL320_.jpg,https://www.amazon.in/HOJI-Universal-Magnetic-Adhesive-Compatible/dp/B09CBCKKYN/ref=sr_1_3070?qid=1679222114&s=electronics&sr=1-3070,,,₹199,₹999
BeingStylish Flip Cover for Xiaomi MI A1 Mobile Phone (Executive Brown) | Premium Leather Finish | Foldable Stand Case | W...,car & motorbike,Car Electronics,https://m.media-amazon.com/images/I/41QhXOHLd1L._AC_UL320_.jpg,https://www.amazon.in/BeingStylish-Flip-Cover-Leather-Wallet/dp/B096WD41Y4/ref=sr_1_3071?qid=1679222114&s=electronics&sr=1-3071,5.0,1,₹299,₹999
Foxin FCC-002 Dual USB Car Charger with 2.4 Amp Power Supply 12 Watt with Micro USB Cable (Black),car & motorbike,Car Electronics,https://m.media-amazon.com/images/I/515T4tIJDcL._AC_UL320_.jpg,https://www.amazon.in/Foxin-FCC-002-Charger-Power-Supply/dp/B07W6PHVXG/ref=sr_1_3072?qid=1679222114&s=electronics&sr=1-3072,3.4,30,₹332,₹850
Shelfkey.com ELECTROLYTIC CAPACITOR 470uF 10V RADIAL (355-B) SK-470uF/10V (Pack of 10),car & motorbike,Car Electronics,https://m.media-amazon.com/images/W/IMAGERENDERING_521856-T2/images/I/11p9G+4VxqL._AC_UL320_.jpg,https://www.amazon.in/Shelfkey-com-ELECTROLYTIC-CAPACITOR-RADIAL-SK-470uF/dp/B09MG31WJT/ref=sr_1_3121?qid=1679222115&s=electronics&sr=1-3121,3.8,5,₹71,₹210
GO OFFER Wireless with Dynamic K1 Single In-Ear Wireless Bluetooth Earphone Headphone for Calling & Music with mic & 2 War...,car & motorbike,Car Electronics,https://m.media-amazon.com/images/W/IMAGERENDERING_521856-T2/images/I/31ZnSUtDMfL._AC_UL320_.jpg,https://www.amazon.in/GO-OFFER-Bluetooth-Headphone-Smartphones/dp/B08SJSVMD9/ref=sr_1_3122?qid=1679222115&s=electronics&sr=1-3122,2.6,22,₹149,₹999
Xester® Vintage Leather Flip Cover Case Compatible with Oppo F7 | Inner TPU | Foldable Stand | Magnetic Closure | Wallet C...,car & motorbike,Car Electronics,https://m.media-amazon.com/images/W/IMAGERENDERING_521856-T2/images/I/81D989UYjXL._AC_UL320_.jpg,https://www.amazon.in/Xester%C2%AE-Vintage-Compatible-Foldable-Magnetic/dp/B08RCTH9L6/ref=sr_1_3123?qid=1679222115&s=electronics&sr=1-3123,4.3,3,₹282,₹999
"LAMROD Supreme - Hidden GPS Tracker for Car,Bike, Truck with 12 Month Sim Data",car & motorbike,Car Electronics,https://m.media-amazon.com/images/W/IMAGERENDERING_521856-T2/images/I/61-yEhgaynL._AC_UL320_.jpg,https://www.amazon.in/LAMROD-Supreme-GT02A-Lifetime-Subscription/dp/B07Q3FQZZG/ref=sr_1_3124?qid=1679222115&s=electronics&sr=1-3124,4.0,521,"₹3,299","₹4,999"
Kandid Black Waterproof Bike USB Mobile Battery Charger for Honda Cd Dawn,car & motorbike,Car Electronics,https://m.media-amazon.com/images/W/IMAGERENDERING_521856-T2/images/I/51gZ0b7xATL._AC_UL320_.jpg,https://www.amazon.in/Kandid-Waterproof-Mobile-Battery-Charger/dp/B07PLWW7TY/ref=sr_1_3125?qid=1679222115&s=electronics&sr=1-3125,2.9,4,₹517,₹599
ORLOV® Jaguar HUD Car Phone Holder Leopard Design Cellphone GPS Stand 360 Degree Mount Adjustable Clip Holder Accessories ...,car & motorbike,Car Electronics,https://m.media-amazon.com/images/W/IMAGERENDERING_521856-T2/images/I/41DAWGHBbQL._AC_UL320_.jpg,https://www.amazon.in/Leopard-Cellphone-Adjustable-Accessories-Support/dp/B09WF6DF5D/ref=sr_1_3126?qid=1679222115&s=electronics&sr=1-3126,3.8,4,₹499,₹999
"6.8uF 400V Aluminum Electrolytic Capacitor Radial, Pack of 20 No's",car & motorbike,Car Electronics,https://m.media-amazon.com/images/W/IMAGERENDERING_521856-T2/images/I/31JWTxoijwL._AC_UL320_.jpg,https://www.amazon.in/400V-Aluminum-Electrolytic-Capacitor-Radial/dp/B08NTR222X/ref=sr_1_3127?qid=1679222115&s=electronics&sr=1-3127,3.8,6,₹170,₹499
Guance Universal Working Shark fin car Antenna AM FM Radio Signal reciver ABS Plastic Antenna Black Color Decorative Anten...,car & motorbike,Car Electronics,https://m.media-amazon.com/images/W/IMAGERENDERING_521856-T2/images/I/51Y6V+cdjKL._AC_UL320_.jpg,https://www.amazon.in/Guance-Shark-Fin-Accessories-Decorate/dp/B07X2Y6DBM/ref=sr_1_3128?qid=1679222115&s=electronics&sr=1-3128,3.6,32,₹325,₹545
"JXL 9 Inch Car Andriod Double Din Player 2GB/32GB/Quad Core Processor1280P HD Screen, Latest Android Version 12 BT 5.0, W...",car & motorbike,Car Electronics,https://m.media-amazon.com/images/W/IMAGERENDERING_521856-T2/images/I/71tTH4fWHYL._AC_UL320_.jpg,https://www.amazon.in/JXL-Andriod-Processor1280P-Android-Navigation/dp/B0B4P67YH7/ref=sr_1_3129?qid=1679222115&s=electronics&sr=1-3129,3.8,559,"₹11,998","₹28,000"
"King Shine Car Mobile Holder, Windshield Dashboard Mount Cradle for All Mobile 360° Degree Adjustable New (Black) [ crocod...",car & motorbike,Car Electronics,https://m.media-amazon.com/images/W/IMAGERENDERING_521856-T2/images/I/61JrlzXukbL._AC_UL320_.jpg,https://www.amazon.in/Mobile-Holder-Windshield-Dashboard-Adjustable/dp/B07TGJ6962/ref=sr_1_3130?qid=1679222115&s=electronics&sr=1-3130,3.1,24,₹349,₹999
MapOut24 V Connect Plus Cable for Tata Motors OBDII 16 pin Male Connector to The DB 15 Male Connector Diagnosis Cable,car & motorbike,Car Electronics,https://m.media-amazon.com/images/W/IMAGERENDERING_521856-T2/images/I/3171-4SbFyL._AC_UL320_.jpg,https://www.amazon.in/MapOut24-Connect-Plus-Cable-Motors/dp/B0B82RJ1SX/ref=sr_1_3131?qid=1679222115&s=electronics&sr=1-3131,,,"₹2,059","₹3,990"
Whitleys Audio Car Stereos Wiring Harness Radio Antenna fit Honda/Suzuki/Haima/Mazda Easy Installation,car & motorbike,Car Electronics,https://m.media-amazon.com/images/W/IMAGERENDERING_521856-T2/images/I/51fMQlrQYUL._AC_UL320_.jpg,https://www.amazon.in/Whitleys-Stereos-Harness-Antenna-Installation/dp/B07MYLRN1X/ref=sr_1_3132?qid=1679222115&s=electronics&sr=1-3132,3.7,16,₹744,"₹1,414"
Generic 10PCS IRF9540PBF IRF9540 IOR MOSFET P-CH 100V 19A TO-220 NEW,car & motorbike,Car Electronics,https://m.media-amazon.com/images/W/IMAGERENDERING_521856-T2/images/I/413jrzXMDuL._AC_UL320_.jpg,https://www.amazon.in/Generic-10PCS-IRF9540PBF-IRF9540-MOSFET/dp/B06ZZBV384/ref=sr_1_3133?qid=1679222115&s=electronics&sr=1-3133,,,₹540,₹799
Auto Beast Shark Fin Roof top Signal Receiver Antenna for Fiat Linea New | White Color Car Antenna_1Pcs,car & motorbike,Car Electronics,https://m.media-amazon.com/images/W/IMAGERENDERING_521856-T2/images/I/51xeezBxuRL._AC_UL320_.jpg,https://www.amazon.in/Fiat-Linea-New-White-Antenna_1Pcs/dp/B0BRNJWKCP/ref=sr_1_3134?qid=1679222115&s=electronics&sr=1-3134,4.0,2,₹499,₹999
AOW Attractive Offer World Motorcycle Bike Mobile Phone USB Charger Power Adapter 12v Waterproof Universal for All Scooter...,car & motorbike,Car Electronics,https://m.media-amazon.com/images/W/IMAGERENDERING_521856-T2/images/I/41HEkrY4cGL._AC_UL320_.jpg,https://www.amazon.in/AOW-Attractive-Motorcycle-Waterproof-Universal/dp/B07BJ7FGVT/ref=sr_1_3135?qid=1679222115&s=electronics&sr=1-3135,3.8,25,₹355,₹499
EMPOISON Spiral Triple Colour Cable Protector 1.5M- 2pcs | Super Long Size Cable Cord Protectors Winders For All Mobile Ph...,car & motorbike,Car Electronics,https://m.media-amazon.com/images/W/IMAGERENDERING_521856-T2/images/I/71Ew8OKdXhL._AC_UL320_.jpg,https://www.amazon.in/Spiral-Cable-Protector-Protectors-Charging/dp/B0BLLL14YR/ref=sr_1_3136?qid=1679222115&s=electronics&sr=1-3136,4.3,6,,₹199
NRS AUDIO 2Pcs 2 inch Home Theater Tweeter,car & motorbike,Car Electronics,https://m.media-amazon.com/images/W/IMAGERENDERING_521856-T2/images/I/71e4UnMWXVL._AC_UL320_.jpg,https://www.amazon.in/NRS-AUDIO-2Pcs-Theater-Tweeter/dp/B0BF9MK1FW/ref=sr_1_3137?qid=1679222115&s=electronics&sr=1-3137,2.0,1,₹499,₹999
"GRAND PITSTOP Grandpitstop - Claw Grip Aluminium Waterproof Bike / Motorcycle / Scooter Mobile Phone Holder Mount, Ideal f...",car & motorbike,Car Electronics,https://m.media-amazon.com/images/W/IMAGERENDERING_521856-T2/images/I/71DvoTR+XaL._AC_UL320_.jpg,https://www.amazon.in/Grandpitstop-Aluminium-Waterproof-Motorcycle-Navigation/dp/B09X5Q95BP/ref=sr_1_3138?qid=1679222115&s=electronics&sr=1-3138,5.0,2,"₹1,377","₹2,699"
"TJOM Waterproof Smartphone Mobile Phone Holder Stand Bike Bicycle Motorcycle GPS. (Handle Mounted, Black)",car & motorbike,Car Electronics,https://m.media-amazon.com/images/W/IMAGERENDERING_521856-T2/images/I/51zzoc6OXzL._AC_UL320_.jpg,https://www.amazon.in/TJOM-Waterproof-Smartphone-Bicycle-Motorcycle/dp/B09WSVPMTQ/ref=sr_1_3139?qid=1679222115&s=electronics&sr=1-3139,3.2,38,₹599,"₹1,299"
Auto Oprema Car Shark Fin Style Roof Mount FM/AM Radio Antenna Aerial with Wiring Waterproof Signal Decorative Models (Bla...,car & motorbike,Car Electronics,https://m.media-amazon.com/images/W/IMAGERENDERING_521856-T2/images/I/51Qg3ofY3NL._AC_UL320_.jpg,https://www.amazon.in/Auto-Oprema-Antenna-Waterproof-Decorative/dp/B08RB55L4M/ref=sr_1_3140?qid=1679222115&s=electronics&sr=1-3140,3.0,176,₹368,₹599
"HOJI Dashboard Phone Holder for Car [ Vertical Horizontal 360 Rotate ] Car Phone Mount,Dashboard Cell Phone Holder Compati...",car & motorbike,Car Electronics,https://m.media-amazon.com/images/W/IMAGERENDERING_521856-T2/images/I/41FM1W-GXuL._AC_UL320_.jpg,https://www.amazon.in/HOJI-Holder-Car-Horizontal-Smartphones/dp/B0B6GK3P8P/ref=sr_1_3141?qid=1679222115&s=electronics&sr=1-3141,3.0,10,₹279,"₹1,299"
BROGBUS Car Mount Adjustable Universal Car Mobile Holder with Long Arm and Windshield for Smartphones (Black),car & motorbike,Car Electronics,https://m.media-amazon.com/images/W/IMAGERENDERING_521856-T2/images/I/41OUfWcdyZL._AC_UL320_.jpg,https://www.amazon.in/BROGBUS-Adjustable-Universal-Windshield-Smartphones/dp/B09SB7T8R3/ref=sr_1_3142?qid=1679222115&s=electronics&sr=1-3142,3.5,74,₹389,₹899
EJEAS V6 Pro Motorcycle Helmet Bluetooth Intercom Headset 1200M 2 People Full Duplex Wireless Motorbike Interphone Connect...,car & motorbike,Car Electronics,https://m.media-amazon.com/images/W/IMAGERENDERING_521856-T2/images/I/6159Lr7DbML._AC_UL320_.jpg,https://www.amazon.in/EJEAS-Motorcycle-Bluetooth-Interphone-Motorcycling/dp/B07BQW3BFV/ref=sr_1_3143?qid=1679222115&s=electronics&sr=1-3143,,,"₹5,899","₹7,999"
GoSale 3.1A Dual USB Port Car Charger for BMW X1 Car Charger | High Speed Rapid Fast Turbo Metal Android & Tablets Car Mob...,car & motorbike,Car Electronics,https://m.media-amazon.com/images/W/IMAGERENDERING_521856-T2/images/I/61bLBifjNnL._AC_UL320_.jpg,https://www.amazon.in/GoSale-Car-Charger-Android-Multi-Colour/dp/B07YLS3TYD/ref=sr_1_3144?qid=1679222115&s=electronics&sr=1-3144,3.4,2,₹479,₹699
"Infinity Primus 603F 6-1/2"" (160mm) Two-Way Car Coaxial Speaker || 150W Peak, 50W RMS || New 2022 Model",car & motorbike,Car Electronics,https://m.media-amazon.com/images/I/41kQuXwz4AL._AC_UL320_.jpg,https://www.amazon.in/Infinity-Primus-603F-Two-Way-Coaxial/dp/B0BBXZGC73/ref=sr_1_3217?qid=1679222118&s=electronics&sr=1-3217,3.6,3,"₹4,400","₹7,490"
SP 3 inch 10 watt sub woofer 3 Inch subwoofer Speaker 4 ohm 10 Watt HiFi Woofer Deep Bass Coaxial Car Speaker,car & motorbike,Car Electronics,https://m.media-amazon.com/images/I/41cY3C4LbRL._AC_UL320_.jpg,https://www.amazon.in/woofer-subwoofer-Speaker-Woofer-Coaxial/dp/B0B9HPWFQB/ref=sr_1_3218?qid=1679222118&s=electronics&sr=1-3218,2.5,2,₹149,₹399
M - Trax Driven by Inspiration MT-1000TA 10 Inch Active Bass Tube Subwoofer with Inbuilt Amplifier 5400W,car & motorbike,Car Electronics,https://m.media-amazon.com/images/I/51BsnTYw1iL._AC_UL320_.jpg,https://www.amazon.in/MT-1000TA-Active-Subwoofer-Inbuilt-Amplifier/dp/B0B3SP4HQ7/ref=sr_1_3219?qid=1679222118&s=electronics&sr=1-3219,4.7,5,"₹4,290","₹9,990"
Knotyy Faux Leather Flip Case Back Cover for Vivo Y21T Foldable Stand and Inside Cards Pocket | Shockproof 360 Degree Prot...,car & motorbike,Car Electronics,https://m.media-amazon.com/images/I/81zUr3rYbVL._AC_UL320_.jpg,https://www.amazon.in/Knotyy-Leather-Foldable-Shockproof-Magnetic/dp/B09PV6HZX7/ref=sr_1_3220?qid=1679222118&s=electronics&sr=1-3220,4.1,19,₹249,"₹1,299"
Ceuta Retails HOJI Car Mobile Phone Holder - Telescopic One Touch Long Neck Arm 360 Degree Rotation | Anti Shake & Fall Pr...,car & motorbike,Car Electronics,https://m.media-amazon.com/images/I/61CIcmlt3mL._AC_UL320_.jpg,https://www.amazon.in/Ceuta-Retails%C2%AE-Mobile-Phone-Holder/dp/B081NVFR8J/ref=sr_1_3221?qid=1679222118&s=electronics&sr=1-3221,3.7,460,₹440,"₹1,599"
SR VISION Car Bluetooth 4.0 USB Music Audio Receiver Wireless Bluetooth Car Wireless Hands-Free Dongle Kit Audio Music Ada...,car & motorbike,Car Electronics,https://m.media-amazon.com/images/I/31DnPz+onLL._AC_UL320_.jpg,https://www.amazon.in/VISION-Car-Bluetooth-USB-Dongle/dp/B0B2PMFP1V/ref=sr_1_3222?qid=1679222118&s=electronics&sr=1-3222,,,₹249,₹999
Trony 9 Inches Advanced Android 10 System for Hyundai Old Santro Xing with 2GB/32GB RAM & ROM with SWC,car & motorbike,Car Electronics,https://m.media-amazon.com/images/I/71M9ztlnoGL._AC_UL320_.jpg,https://www.amazon.in/Trony-Inches-Advanced-Android-Hyundai/dp/B09X5DKWPP/ref=sr_1_3223?qid=1679222118&s=electronics&sr=1-3223,3.7,70,"₹10,990","₹17,990"
Pinaaki Enterprises Nokia 5.3 Case | Premium Leather Finish | with Card Pockets | Wallet Stand |Complete Protection Cover ...,car & motorbike,Car Electronics,https://m.media-amazon.com/images/I/51FRGFRpJ3L._AC_UL320_.jpg,https://www.amazon.in/Pinaaki-Enterprises-Premium-Complete-Protection/dp/B0918KGVBB/ref=sr_1_3224?qid=1679222118&s=electronics&sr=1-3224,3.9,63,₹169,₹499
HIKER Mini Magnetic Car Dashboard Mount Mobile Phone Holder with Metal Body (Made in India) (Red),car & motorbike,Car Electronics,https://m.media-amazon.com/images/I/61B-iRu5HZL._AC_UL320_.jpg,https://www.amazon.in/HIKER-Magnetic-Dashboard-Mobile-Holder/dp/B07KYS1G9Q/ref=sr_1_3225?qid=1679222118&s=electronics&sr=1-3225,4.0,193,₹349,₹499
