name,main_category,sub_category,image,link,ratings,no_of_ratings,discount_price,actual_price
Allure Auto® (Grey) Car Shark Fin Antenna Cover Universal Waterproof Car Radio Base Replacement Accessories Car Decoration...,car & motorbike,Car Electronics,https://m.media-amazon.com/images/I/710pk5hwS5S._AC_UL320_.jpg,https://www.amazon.in/Allure-Waterproof-Replacement-Accessories-Decoration/dp/B0B635X1XC/ref=sr_1_5943?qid=1679222168&s=electronics&sr=1-5943,3.2,9,₹599,₹799
"NEODRIFT 'CrystalTech' All Weather Protection Car Cover for BMW X5 - Dust, Waterproof, Durable Cover - Triple Stitched Ela...",car & motorbike,Car Electronics,https://m.media-amazon.com/images/I/71c-bVmU+sL._AC_UL320_.jpg,https://www.amazon.in/NEODRIFT-CrystalTech-Protection-BMW-X5/dp/B0B3NJY3DJ/ref=sr_1_5944?qid=1679222168&s=electronics&sr=1-5944,4.3,31,"₹4,049","₹5,100"
Pinaaki Enterprises Oppo A96 Flip Case | Premium Leather Finish Flip Cover | with Card Pockets | Wallet Stand |Complete Pr...,car & motorbike,Car Electronics,https://m.media-amazon.com/images/I/51DyRjSoX9L._AC_UL320_.jpg,https://www.amazon.in/Pinaaki-Enterprises-Premium-Complete-Protection/dp/B09XHZT5XS/ref=sr_1_5945?qid=1679222168&s=electronics&sr=1-5945,2.8,15,₹169,₹499
Belity HUD Head Up Display Mobile Phone Holder GPS Navigation Car Speed Projector Car Phone Stand HUD Car Phone Navigation...,car & motorbike,Car Electronics,https://m.media-amazon.com/images/I/514G2L436lS._AC_UL320_.jpg,https://www.amazon.in/Belity-Display-Navigation-Projector-Bracket/dp/B09H2X75KB/ref=sr_1_5946?qid=1679222168&s=electronics&sr=1-5946,,,,
SSMART Mobile Phone Holder for Car Rear View Mirror Generation Car Model Anti Shake Fall Prevention | Full Rotation | Ant...,car & motorbike,Car Electronics,https://m.media-amazon.com/images/I/41siKgHAEcL._AC_UL320_.jpg,https://www.amazon.in/SSMART-Generation-Prevention-Anti-Vibration-Adjustable/dp/B09F69FLGG/ref=sr_1_5947?qid=1679222168&s=electronics&sr=1-5947,3.0,2,₹299,"₹1,299"
AUTONEST Car Aluminium Fiber Car Auto AM/FM Radio Aerial Antenna and Screw (Carbon Red) for Hyundai i10 Grand,car & motorbike,Car Electronics,https://m.media-amazon.com/images/I/31k2rGyw-ZL._AC_UL320_.jpg,https://www.amazon.in/AUTONEST-Aluminium-Aerial-Antenna-Hyundai/dp/B08XNZ54GF/ref=sr_1_5948?qid=1679222168&s=electronics&sr=1-5948,1.0,1,₹369,₹499
1000uF/16V Electrolytic Capacitor - Pack Of 2,car & motorbike,Car Electronics,https://m.media-amazon.com/images/I/31Qv-o-hEwL._AC_UL320_.jpg,https://www.amazon.in/1000uF-16V-Electrolytic-Capacitor-Pack/dp/B08X2PGPPV/ref=sr_1_5949?qid=1679222168&s=electronics&sr=1-5949,5.0,3,₹49,₹99
Selifaur Car Replacement OE Audio FM/AM Roof Signal Receiver Antenna for New Baleno,car & motorbike,Car Electronics,https://m.media-amazon.com/images/I/41lee0bTBAL._AC_UL320_.jpg,https://www.amazon.in/Selifaur-Replacement-Signal-Receiver-Antenna/dp/B08VWF65Z1/ref=sr_1_5950?qid=1679222168&s=electronics&sr=1-5950,,,₹399,₹799
Auto Addict Car Reverse Parking Camera 8 LED Night Vision Vehicle Camera System for Tata Zest,car & motorbike,Car Electronics,https://m.media-amazon.com/images/I/51bKzlSyw8L._AC_UL320_.jpg,https://www.amazon.in/Auto-Addict-Reverse-Parking-Vehicle/dp/B08S6Q48WC/ref=sr_1_5951?qid=1679222168&s=electronics&sr=1-5951,,,₹449,₹499
Auto Oprema Car Shark Fin Style Roof Mount FM/AM Radio Antenna Aerial with Wiring Waterproof Signal Decorative Models (Bla...,car & motorbike,Car Electronics,https://m.media-amazon.com/images/I/51Qg3ofY3NL._AC_UL320_.jpg,https://www.amazon.in/Auto-Oprema-Antenna-Waterproof-Decorative/dp/B08RB3FTFQ/ref=sr_1_5952?qid=1679222168&s=electronics&sr=1-5952,3.0,176,₹368,₹599
"TANTRA S1A Mobile Holder for Bikes One Touch Technology Bike Mobile Holder for Maps and GPS Navigation, 360° Rotation, Fir...",car & motorbike,Car Electronics,https://m.media-amazon.com/images/W/IMAGERENDERING_521856-T2/images/I/51DihJvAxYL._AC_UL320_.jpg,https://www.amazon.in/TANTRA-S1A-Technology-Navigation-Accessories/dp/B0BGCLZF1D/ref=sr_1_6241?qid=1679222173&s=electronics&sr=1-6241,4.2,5,₹649,"₹1,499"
WORRICOW Best Buy Jaguar Car Holder Form Dashboard Phone Holder 360 Degree Cell Mount Stand,car & motorbike,Car Electronics,https://m.media-amazon.com/images/W/IMAGERENDERING_521856-T2/images/I/510uqhZSoxL._AC_UL320_.jpg,https://www.amazon.in/WORRICOW-Jaguar-Holder-Dashboard-Degree/dp/B0B1Q581TK/ref=sr_1_6242?qid=1679222173&s=electronics&sr=1-6242,,,₹275,₹500
Poonamcars Toyota Corolla ALTIS 2008-2012 Car Stereo Frame (9 inch) with Power Cable,car & motorbike,Car Electronics,https://m.media-amazon.com/images/W/IMAGERENDERING_521856-T2/images/I/31+3+k4ZzWL._AC_UL320_.jpg,https://www.amazon.in/Poonamcars-Toyota-Corolla-2008-2012-Stereo/dp/B0B1F3FDQZ/ref=sr_1_6243?qid=1679222173&s=electronics&sr=1-6243,5.0,2,,
Bassoholic 9 Inches Advanced Android 10 System for Honda BRV with 2GB/16GB RAM & ROM with Apple Carplay & Android Auto,car & motorbike,Car Electronics,https://m.media-amazon.com/images/W/IMAGERENDERING_521856-T2/images/I/61x8nMZbvOL._AC_UL320_.jpg,https://www.amazon.in/Bassoholic-Inches-Advanced-Android-Carplay/dp/B0B15B8LDL/ref=sr_1_6244?qid=1679222173&s=electronics&sr=1-6244,4.0,"1,079","₹12,990","₹21,990"
Haibing 4000W Peak Power Modified Sine Wave Inverter LED Display 300W Rated Power Inverter DC 12V to AC 220V Converter Hig...,car & motorbike,Car Electronics,https://m.media-amazon.com/images/W/IMAGERENDERING_521856-T2/images/I/71cVDwrPK5S._AC_UL320_.jpg,https://www.amazon.in/Haibing-Modified-Inverter-Converter-Frequency/dp/B09P8C61VY/ref=sr_1_6245?qid=1679222173&s=electronics&sr=1-6245,2.6,7,,
"Frixen Car Shark fin Car Solar Shark fin Antenna Decoration Lights, LED Tail Lights Modified Lights, Anti-Static Warning L...",car & motorbike,Car Electronics,https://m.media-amazon.com/images/W/IMAGERENDERING_521856-T2/images/I/61m9HhdMCfL._AC_UL320_.jpg,https://www.amazon.in/Frixen-Antenna-Decoration-Modified-Anti-Static/dp/B09MS81WT8/ref=sr_1_6246?qid=1679222173&s=electronics&sr=1-6246,3.0,9,₹499,₹999
Autokaar Shark Fin Roof Antenna FM/AM Signal Receiver Car Antenna White for Toyota Etios,car & motorbike,Car Electronics,https://m.media-amazon.com/images/W/IMAGERENDERING_521856-T2/images/I/31lRekIxceL._AC_UL320_.jpg,https://www.amazon.in/Autokaar-Antenna-Signal-Receiver-Toyota/dp/B09B6CTK91/ref=sr_1_6247?qid=1679222173&s=electronics&sr=1-6247,2.9,4,₹325,₹899
Autokaar Shark Fin Roof Antenna FM/AM Signal Receiver Car Antenna Black for Hyundai Elite I20,car & motorbike,Car Electronics,https://m.media-amazon.com/images/W/IMAGERENDERING_521856-T2/images/I/41Gys8Ps6-L._AC_UL320_.jpg,https://www.amazon.in/Autokaar-Antenna-Signal-Receiver-Hyundai/dp/B09B6C5F6Q/ref=sr_1_6248?qid=1679222173&s=electronics&sr=1-6248,2.1,4,₹325,₹899
Evett - One Name One Legend OnePlus 6 Premium Vintage Leather Flip Cover Shock Proof Magnetic Clip | Inner TPU| Foldable S...,car & motorbike,Car Electronics,https://m.media-amazon.com/images/W/IMAGERENDERING_521856-T2/images/I/81bh3vjQq6L._AC_UL320_.jpg,https://www.amazon.in/Evett-Magnetic-Foldable-Protection-6-Caramel/dp/B099S4JL4W/ref=sr_1_6249?qid=1679222173&s=electronics&sr=1-6249,3.7,10,₹275,₹999
"GRR Unisex Arm Band Mobile Arm Bands for Running Compatible up to 6.2"" [Black]",car & motorbike,Car Electronics,https://m.media-amazon.com/images/W/IMAGERENDERING_521856-T2/images/I/514DyNn+a0L._AC_UL320_.jpg,https://www.amazon.in/Universal-Armband-Running-Carrier-Waterproof-Black/dp/B097S4MGTP/ref=sr_1_6250?qid=1679222173&s=electronics&sr=1-6250,3.0,33,₹299,₹999
SHELFKEY ALUMINIUM ELECTROLYTIC CAPACITOR 47uF 100V SK-47uF/100V (PACK OF 5),car & motorbike,Car Electronics,https://m.media-amazon.com/images/W/IMAGERENDERING_521856-T2/images/I/21TbDmTzzYL._AC_UL320_.jpg,https://www.amazon.in/SHELFKEY-ALUMINIUM-ELECTROLYTIC-CAPACITOR-SK-47uF/dp/B08PK1YQMJ/ref=sr_1_6251?qid=1679222173&s=electronics&sr=1-6251,,,₹61,₹129
MISTRONICS Universal 360 Degree Rotating Mobile Phone Mount Stand for Bikes (Black),car & motorbike,Car Electronics,https://m.media-amazon.com/images/W/IMAGERENDERING_521856-T2/images/I/61yt6qmSeuL._AC_UL320_.jpg,https://www.amazon.in/Mistique-Universal-Degree-Rotating-Mobile/dp/B0845ZBK2V/ref=sr_1_6252?qid=1679222173&s=electronics&sr=1-6252,2.1,3,₹179,₹499
House of Gifts (Combo Pack of 2) Power Plus Wall and CAR Charger- Dual USB + Voice Controlled LED Light Charging Cable (Mu...,car & motorbike,Car Electronics,https://m.media-amazon.com/images/W/IMAGERENDERING_521856-T2/images/I/41GOABpFFNL._AC_UL320_.jpg,https://www.amazon.in/House-Gifts-CHARGER-controlled-Multicolor/dp/B082WCTHW5/ref=sr_1_6253?qid=1679222173&s=electronics&sr=1-6253,3.4,3,₹785,"₹1,299"
Hyundai Grand i10 Car Charger Dual Port USB Metal Car Charger | High Speed Rapid Fast Turbo Metal Android & Tablets Car Mo...,car & motorbike,Car Electronics,https://m.media-amazon.com/images/W/IMAGERENDERING_521856-T2/images/I/41183oJHT9L._AC_UL320_.jpg,https://www.amazon.in/Hyundai-Charger-Charging-Universal-Multi-Colour/dp/B081LKH6WG/ref=sr_1_6254?qid=1679222173&s=electronics&sr=1-6254,1.9,3,₹399,"₹1,199"
AUTOXYGEN Car 8 LED Reserve Parking Camera For Maruti Spresso,car & motorbike,Car Electronics,https://m.media-amazon.com/images/W/IMAGERENDERING_521856-T2/images/I/51MgzY14NHL._AC_UL320_.jpg,https://www.amazon.in/AUTOXYGEN-Reserve-Maruti-Suzuki-Spresso/dp/B081F7K7QN/ref=sr_1_6255?qid=1679222173&s=electronics&sr=1-6255,4.0,2,₹549,₹999
VASP Electronics High Gain Stereo Bass Treble PCB board for Audio Amplifiers using NE5532 op amp ic DIY project - PCB onl...,car & motorbike,Car Electronics,https://m.media-amazon.com/images/W/IMAGERENDERING_521856-T2/images/I/613EQL2KzoL._AC_UL320_.jpg,https://www.amazon.in/Vasp-Electronics-DIY-Stereo-Amplifiers/dp/B07SS2TP73/ref=sr_1_6256?qid=1679222173&s=electronics&sr=1-6256,3.9,68,₹179,₹300
"Wellbuy Anti-Slip Car Dashboard Sticky Gel Pad Mount Holder 8.1"" x4.8"" Washable Foldable Universal Mat Compatible with Cel...",car & motorbike,Car Electronics,https://m.media-amazon.com/images/W/IMAGERENDERING_521856-T2/images/I/71VsTRFKyKL._AC_UL320_.jpg,https://www.amazon.in/Wellbuy-Anti-Slip-Dashboard-Universal-Compatible/dp/B07SPK5VDZ/ref=sr_1_6257?qid=1679222173&s=electronics&sr=1-6257,3.4,30,₹599,"₹1,499"
BeFunky Magnet Mobile Finger Ring Holder Mobile Stand Magnetic Phone Mount Holder [360° Rotation] for All Smartphones & Ta...,car & motorbike,Car Electronics,https://m.media-amazon.com/images/W/IMAGERENDERING_521856-T2/images/I/41-nFtmkmdL._AC_UL320_.jpg,https://www.amazon.in/BeFunky-Magnetic-Rotation-Smartphones-Tablets/dp/B07PWZYJHZ/ref=sr_1_6258?qid=1679222173&s=electronics&sr=1-6258,3.0,22,₹549,₹999
AOW Attractive Offer World Bike Mobile Phone USB Charger Universal for All Bikes T-20,car & motorbike,Car Electronics,https://m.media-amazon.com/images/W/IMAGERENDERING_521856-T2/images/I/41+B6SmdUaL._AC_UL320_.jpg,https://www.amazon.in/AOW-Attractive-Mobile-Charger-Universal/dp/B07KJ9DTHY/ref=sr_1_6259_mod_primary_new?qid=1679222173&s=electronics&sbo=RZvfv%2F%2FHxDF%2BO5021pAnSA%3D%3D&sr=1-6259,2.3,4,₹289,₹499
PRIKNIK Car Mobile Holder Car Design GPS Size Up to 5.5 Inches UniV-ersal Fit -Compatible with T-ata T-Iago,car & motorbike,Car Electronics,https://m.media-amazon.com/images/W/IMAGERENDERING_521856-T2/images/I/51UfPhqXy6L._AC_UL320_.jpg,https://www.amazon.in/PR-Mobile-Holder-Design-Universal/dp/B07FBBNNBS/ref=sr_1_6260?qid=1679222173&s=electronics&sr=1-6260,,,₹623,"₹1,050"
ELECTROPRIME Car Truck 10 Amp Amplifier Speaker Noise Filter Suppressor Isolator E2L4,car & motorbike,Car Electronics,https://m.media-amazon.com/images/W/IMAGERENDERING_521856-T2/images/I/41+PfCEsvML._AC_UL320_.jpg,https://www.amazon.in/ELECTROPRIME-Amplifier-Speaker-Suppressor-Isolator/dp/B07WSWVZ2L/ref=sr_1_6261?qid=1679222173&s=electronics&sr=1-6261,,,"₹1,790","₹2,166"
Generation X Plus Smartphone Antenna,car & motorbike,Car Electronics,https://m.media-amazon.com/images/W/IMAGERENDERING_521856-T2/images/I/619NNsGD-qL._AC_UL320_.jpg,https://www.amazon.in/Generation-X-Plus-Smartphone-Antenna/dp/B01DEBEM5A/ref=sr_1_6262?qid=1679222173&s=electronics&sr=1-6262,,,,"₹1,974"
STYLEGEEKS- smart accessories Full Body 3-in-1 Slim Fit (Full Black) Full 360 Protection Back Case Cover for Vivo Y51 / Y31,car & motorbike,Car Electronics,https://m.media-amazon.com/images/W/IMAGERENDERING_521856-T2/images/I/41xfrZJHEQL._AC_UL320_.jpg,https://www.amazon.in/STYLEGEEKS-smart-accessories-Vivo-Y51/dp/B0BR5X4TCT/ref=sr_1_6263?qid=1679222173&s=electronics&sr=1-6263,,,₹499,₹999
Psonix Maruti Suzuki Wagon-R (2010-2018) Car Stereo Frame (9 inch) with Power Cable,car & motorbike,Car Electronics,https://m.media-amazon.com/images/W/IMAGERENDERING_521856-T2/images/I/216kk1klfDL._AC_UL320_.jpg,https://www.amazon.in/Psonix-Maruti-Suzuki-Wagon-R-2010-2018/dp/B0BQNH5KDL/ref=sr_1_6264?qid=1679222173&s=electronics&sr=1-6264,,,"₹1,099","₹1,399"
"TALKAHEAD New(2022) Smart Watch Magnetic Suction Charger for 2 Pin (Noise Colorfit Pro 2,3, Boat Strom,Nexfit Run) Smart W...",car & motorbike,Car Electronics,https://m.media-amazon.com/images/I/51-Y0TE4lTL._AC_UL320_.jpg,https://www.amazon.in/TALKAHEAD-Magnetic-Suction-Colorfit-Charging/dp/B0B5TRTLZL/ref=sr_1_6385?qid=1679222176&s=electronics&sr=1-6385,,,₹99,₹599
V88R®X8 Hands-Free Wireless Bluetooth FM Transmitter 2.1 A Dual USB Port which Supports TF Card and U Disk Car Charger and...,car & motorbike,Car Electronics,https://m.media-amazon.com/images/I/41eVL--vceL._AC_UL320_.jpg,https://www.amazon.in/Hands-Free-Bluetooth-Transmitter-Car-Charger/dp/B0B2KGFTKB/ref=sr_1_6386?qid=1679222176&s=electronics&sr=1-6386,,,₹749,"₹1,499"
"foxly Car Bluetooth Device with Call Receiver, FM Transmitter for Music System & Dual USB Fast Charger Inbuilt Mic with Un...",car & motorbike,Car Electronics,https://m.media-amazon.com/images/I/41G+mgGSxUL._AC_UL320_.jpg,https://www.amazon.in/Bluetooth-Transmitter-Unmatched-Cancellation-Equalizer/dp/B09PFD8NV3/ref=sr_1_6387?qid=1679222176&s=electronics&sr=1-6387,,,₹530,"₹1,499"
HOJI Magnetic Mobile Phone Holder Car Dashboard Mobile Bracket Cell Phone Mount Holder Stand Universal Magnet Wall Sticker...,car & motorbike,Car Electronics,https://m.media-amazon.com/images/I/41L5JI8DVPL._AC_UL320_.jpg,https://www.amazon.in/HOJI-Magnetic-Dashboard-Bracket-Universal/dp/B09P4CDLWM/ref=sr_1_6388?qid=1679222176&s=electronics&sr=1-6388,4.3,2,₹230,₹999
"Lamture 3.0A 3 in 1 Cable Nylon Blue Denim Braided Fast,Rapid, Super charging cable for Micro USB, iphone & Type C Device...",car & motorbike,Car Electronics,https://m.media-amazon.com/images/I/51EYwTK3JcL._AC_UL320_.jpg,https://www.amazon.in/Lamture-Braided-charging-Devices-charger/dp/B09MKGP1KM/ref=sr_1_6389?qid=1679222176&s=electronics&sr=1-6389,,,₹599,"₹1,299"
"saleshop365 QC-10 Bluetooth Earphone Wireless Headphones for Mobile Phone Sports Stereo Jogger, Running, Gyming Bluetooth ...",car & motorbike,Car Electronics,https://m.media-amazon.com/images/I/31gdb3LLU9L._AC_UL320_.jpg,https://www.amazon.in/Saleshop365-QC-10-Wireless-Bluetooth-Earphone/dp/B0958RP369/ref=sr_1_6390?qid=1679222176&s=electronics&sr=1-6390,1.8,7,₹349,₹850
Belfin 4700uf 50V Aluminum Electrolytic Capacitor - (Pack of 2),car & motorbike,Car Electronics,https://m.media-amazon.com/images/I/71+fMtkOR5L._AC_UL320_.jpg,https://www.amazon.in/Belfin-4700uf-Aluminum-Electrolytic-Capacitor/dp/B094H4JK1G/ref=sr_1_6391?qid=1679222176&s=electronics&sr=1-6391,5.0,1,₹149,₹399
"BLAXSTO K1FDS Wireless Bluetooth Headphones, Headset with Mic and Sound Button Earphone for Vivo,Oppo,Nokia,Samsung,REALME...",car & motorbike,Car Electronics,https://m.media-amazon.com/images/I/41ku6LJq7nL._AC_UL320_.jpg,https://www.amazon.in/BLAXSTOC-Bluetooth-Vibration-Cancellation-Smartphone/dp/B0929553GH/ref=sr_1_6392?qid=1679222176&s=electronics&sr=1-6392,4.6,5,₹149,₹799
QiisX X-Grip Mobile Phone Holder with USB Charger Bike Mobile Holder for Bajaj Avenger 220 Cruise,car & motorbike,Car Electronics,https://m.media-amazon.com/images/I/5122gIuYAbL._AC_UL320_.jpg,https://www.amazon.in/QiisX-X-Grip-Mobile-Charger-Avenger/dp/B08XY4DC48/ref=sr_1_6393?qid=1679222176&s=electronics&sr=1-6393,,,₹369,"₹1,299"
Aow Attractive Offer World Universal Black Sporty Antenna for Royal Enfield Classic 350,car & motorbike,Car Electronics,https://m.media-amazon.com/images/I/31EFRCXIFmL._AC_UL320_.jpg,https://www.amazon.in/Attractive-Universal-Antenna-Enfield-Classic/dp/B08XMPLMTS/ref=sr_1_6394?qid=1679222176&s=electronics&sr=1-6394,3.2,18,₹423,₹499
"Auto Oprema®1 Piece Nano Gel Pad Magic Sticker,Washable Multi-Functional Universal Sticky Car Phone Holder,Application for...",car & motorbike,Car Electronics,https://m.media-amazon.com/images/I/61Gi8t+6w+L._AC_UL320_.jpg,https://www.amazon.in/Auto-Oprema%C2%AE1-Multi-Functional-Universal-Application/dp/B08WC9119M/ref=sr_1_6395?qid=1679222176&s=electronics&sr=1-6395,3.8,5,₹231,₹399
Semaphore Mobile Holder Car Dashboard Mobile Phone Alligator Clip Holder Mobile Scaffold Mount Holder(Assorted Colours) Co...,car & motorbike,Car Electronics,https://m.media-amazon.com/images/I/412jqLSkZsL._AC_UL320_.jpg,https://www.amazon.in/SEMAPHORE-Dashboard-Alligator-Scaffold-Compatible/dp/B08THZHFX7/ref=sr_1_6396?qid=1679222176&s=electronics&sr=1-6396,3.3,70,₹499,₹699
CQLEK® Ultimate Long Neck Mobile Holder Mount with 360 Degree Rotation and Ultimate Reusable Suction Cup for Car Dashboar...,car & motorbike,Car Electronics,https://m.media-amazon.com/images/I/51IMRKftYdL._AC_UL320_.jpg,https://www.amazon.in/Ultimate-Rotation-Reusable-Dashboard-Windshield/dp/B08R5K449V/ref=sr_1_6397?qid=1679222176&s=electronics&sr=1-6397,4.1,18,₹425,"₹1,899"
Semaphore Car Auto Wind Power LED Light Shark Fin Antenna Flash Lamp - Black Compatible with Chevrolet Beat,car & motorbike,Car Electronics,https://m.media-amazon.com/images/I/511lXEsWucL._AC_UL320_.jpg,https://www.amazon.in/Semaphore-Power-Light-Shark-Antenna/dp/B08M5TFP7Z/ref=sr_1_6398?qid=1679222176&s=electronics&sr=1-6398,3.0,93,₹399,₹799
"CEUTA® Mouse Shaped Mobile Holder for Car Dashboard & Windshield - One Touch Flip Mount 360 Degrees Rotation for Android, ...",car & motorbike,Car Electronics,https://m.media-amazon.com/images/I/613BObzQuRL._AC_UL320_.jpg,https://www.amazon.in/CEUTA%C2%AE-Shaped-Mobile-Dashboard-Windshield/dp/B081LL2NX9/ref=sr_1_6399?qid=1679222176&s=electronics&sr=1-6399,3.5,44,₹382,₹799
GRAND PITSTOP Claw-Grip Mobile Holder Mount with Charger for Bajaj Dominar,car & motorbike,Car Electronics,https://m.media-amazon.com/images/I/712IkwLWDgL._AC_UL320_.jpg,https://www.amazon.in/GrandPitstop-Claw-Grip-Mobile-Charger-Dominar/dp/B07X3325FY/ref=sr_1_6400?qid=1679222176&s=electronics&sr=1-6400,4.5,7,"₹1,849","₹3,499"
"Hamaan Suzuki Brezza 9"" Full HD Double Din Player Android 10 Car Stereo Media Player with 2GB RAM/ 16GB ROM/Bluetooth/USB/...",car & motorbike,Car Electronics,https://m.media-amazon.com/images/I/61qXrWmo16L._AC_UL320_.jpg,https://www.amazon.in/Hamaan-Suzuki-Brezza-Android-Bluetooth/dp/B07X1SGPW2/ref=sr_1_6401?qid=1679222176&s=electronics&sr=1-6401,3.2,6,"₹10,599","₹25,999"
"Unifree Mobile Car Holder Stand Mount Cradle for Windscreen, Glass Surface, Dashboard & Table Desk with Double Grip Holder",car & motorbike,Car Electronics,https://m.media-amazon.com/images/I/51Zh8BGfZzL._AC_UL320_.jpg,https://www.amazon.in/Unifree-Mobile-Windscreen-Surface-Dashboard/dp/B07QQPT7RP/ref=sr_1_6402?qid=1679222176&s=electronics&sr=1-6402,2.9,7,₹349,₹999
Car Bluetooth for Hyundai Eon Car Bluetooth Music Receiver Adapter with Built-in Mic and 3.5mm Aux Audio Stereo | Music Wi...,car & motorbike,Car Electronics,https://m.media-amazon.com/images/I/61iCqMNvW2L._AC_UL320_.jpg,https://www.amazon.in/Bluetooth-Hyundai-Receiver-Wireless-Transmitter/dp/B079D8D6MY/ref=sr_1_6403?qid=1679222176&s=electronics&sr=1-6403,2.4,3,₹339,₹699
ShopMagics Bluetooth Wireless Music Receiver Adapter with Built-in Mic and 3.5 mm Aux Audio Hands-free Car Kit for Maruti ...,car & motorbike,Car Electronics,https://m.media-amazon.com/images/I/71U6Sw7kETL._AC_UL320_.jpg,https://www.amazon.in/ShopMagics-Car-Bluetooth-Receiver-Transmitter/dp/B075C9JVRS/ref=sr_1_6404?qid=1679222176&s=electronics&sr=1-6404,2.8,20,₹349,₹799
"JL Audio C2-650 450W 6.5"" 2-Way Evolution C2 Series Component Car Speakers System and Coaxial Car Speakers with Woofer (Bl...",car & motorbike,Car Electronics,https://m.media-amazon.com/images/I/71sTQQnEJYL._AC_UL320_.jpg,https://www.amazon.in/JL-Audio-Evolution-Component-Speakers/dp/B072L1F14M/ref=sr_1_6405?qid=1679222176&s=electronics&sr=1-6405,1.0,1,,
Motoway Wireless Bluetooth Music Receiver with inbuild mic for Skoda Fabia,car & motorbike,Car Electronics,https://m.media-amazon.com/images/I/51OXjUcUlPL._AC_UL320_.jpg,https://www.amazon.in/Motoway-Wireless-Bluetooth-Receiver-inbuild/dp/B01N6HP1JT/ref=sr_1_6406?qid=1679222176&s=electronics&sr=1-6406,2.5,12,₹299,₹599
Kozdiko White Shark Fin Signal Receiver Antenna for - Chevrolet Sail,car & motorbike,Car Electronics,https://m.media-amazon.com/images/I/61ac7GpeLbL._AC_UL320_.jpg,https://www.amazon.in/Kozdiko-Premium-Replacement-Receiver-Chevrolet/dp/B01675VFPU/ref=sr_1_6407?qid=1679222176&s=electronics&sr=1-6407,2.7,7,₹576,₹749
Power Acoustik NB-1 2-Way Tweeters,car & motorbike,Car Electronics,https://m.media-amazon.com/images/I/31NAA158BVL._AC_UL320_.jpg,https://www.amazon.in/Power-Acoustik-NB-1-2-Way-Tweeters/dp/B00009W5KJ/ref=sr_1_6408?qid=1679222176&s=electronics&sr=1-6408,4.4,793,"₹2,159","₹5,500"
Inktree® Oppo A52 Flip Case | Premium Leather Finish | with Card Pockets | Wallet Stand |Complete Protection Flip Cover fo...,car & motorbike,Car Electronics,https://m.media-amazon.com/images/W/IMAGERENDERING_521856-T1/images/I/61noEADOYfL._AC_UL320_.jpg,https://www.amazon.in/Inktree%C2%AE-Premium-Leather-Complete-Protection/dp/B08PS6HS4T/ref=sr_1_6505?qid=1679222178&s=electronics&sr=1-6505,4.5,2,₹168,₹169
"Lowfe Mini K1 Universal Wireless Bluetooth Earpiece, Smart Call Answering Earphone Support All Android Device for Running ...",car & motorbike,Car Electronics,https://m.media-amazon.com/images/W/IMAGERENDERING_521856-T1/images/I/519zhk7v3DL._AC_UL320_.jpg,https://www.amazon.in/Lowfe-Universal-Bluetooth-All-Cancelling/dp/B08MXBRWPH/ref=sr_1_6506?qid=1679222178&s=electronics&sr=1-6506,3.4,3,₹249,₹899
Fast Type-C Car Charger for Samsung Galaxy A50s Original Charger Dual Port USB High Speed Rapid Fast Turbo Metal Android C...,car & motorbike,Car Electronics,https://m.media-amazon.com/images/W/IMAGERENDERING_521856-T1/images/I/61EM8C+nneL._AC_UL320_.jpg,https://www.amazon.in/Samsung-Galaxy-A50s-Original-Charging/dp/B08L4V57S9/ref=sr_1_6507?qid=1679222178&s=electronics&sr=1-6507,3.5,17,₹499,₹999
BLUELEX HOPEPE 360 Degree Adjustable Universal Car Mobile Phone Holder (Car Mobile Holder),car & motorbike,Car Electronics,https://m.media-amazon.com/images/W/IMAGERENDERING_521856-T1/images/I/61J25FG4SnL._AC_UL320_.jpg,https://www.amazon.in/BLUELEX-HOPEPE-Degree-Adjustable-Universal/dp/B08J3RL581/ref=sr_1_6508?qid=1679222178&s=electronics&sr=1-6508,3.3,44,₹349,"₹1,899"
WolkomHome High performance Shark Fin Antenna Silver color Car FM Radio Signal Aerials for Maruti Suzuki Ignis 2020,car & motorbike,Car Electronics,https://m.media-amazon.com/images/W/IMAGERENDERING_521856-T1/images/I/713SDBh68dL._AC_UL320_.jpg,https://www.amazon.in/WolkomHome-performance-Antenna-Silver-Aerials/dp/B08DXJCG4T/ref=sr_1_6509?qid=1679222178&s=electronics&sr=1-6509,1.0,1,₹619,₹749
Auto Kite - Black Car Shark Fin Replacement Signal (AM/FM) Receiver Antenna for Xl6,car & motorbike,Car Electronics,https://m.media-amazon.com/images/W/IMAGERENDERING_521856-T1/images/I/61DVsds1OhL._AC_UL320_.jpg,https://www.amazon.in/Auto-Kite-Replacement-Receiver-Antenna/dp/B08CVNT4D1/ref=sr_1_6510?qid=1679222178&s=electronics&sr=1-6510,Get,FREE Delivery by Amazon,₹599,"₹1,199"
SESS XUSIVE Leather Case Wallet Slim Book Cover with Card Slots Cash Pocket Stand Holder Magnetic Flip Cover for Honor 9i...,car & motorbike,Car Electronics,https://m.media-amazon.com/images/W/IMAGERENDERING_521856-T1/images/I/71kMcicADHL._AC_UL320_.jpg,https://www.amazon.in/SESS-XUSIVE-Leather-Wallet-Magnetic/dp/B0849MHJFY/ref=sr_1_6511?qid=1679222178&s=electronics&sr=1-6511,4.0,728,₹399,₹999
SPYKART Tablet Stand for Car Car Holder Stands for Both Mobile Phones and All Tablets Use Size 4'-10.1' inch-Black,car & motorbike,Car Electronics,https://m.media-amazon.com/images/W/IMAGERENDERING_521856-T1/images/I/81Rw1H-4+dL._AC_UL320_.jpg,https://www.amazon.in/SPYKART-Tablet-Holder-Tablets-inch-Black/dp/B082YHDHVX/ref=sr_1_6512?qid=1679222178&s=electronics&sr=1-6512,3.3,20,₹449,"₹1,199"
King Shine Universal 360° Rotation Silicone Sucker Long Neck Car Mount Mobile Holder with Aluminium Alloy Metal Body Mini ...,car & motorbike,Car Electronics,https://m.media-amazon.com/images/W/IMAGERENDERING_521856-T1/images/I/51zy-9l01bL._AC_UL320_.jpg,https://www.amazon.in/Universal-Rotation-Silicone-Aluminium-Magnetic/dp/B082R1RPP1/ref=sr_1_6513?qid=1679222178&s=electronics&sr=1-6513,2.9,20,₹389,"₹1,299"
Dealfreez LDNIO Fast Car Charger DL-C12 5V 2.1A Single USB Charger Compatible with iPhone USB Charging Cable,car & motorbike,Car Electronics,https://m.media-amazon.com/images/W/IMAGERENDERING_521856-T1/images/I/61wL5XVzIvL._AC_UL320_.jpg,https://www.amazon.in/Dealfreez-Charger-DL-C12-Compatible-Charging/dp/B081K1JWNN/ref=sr_1_6514?qid=1679222178&s=electronics&sr=1-6514,Get,FREE Delivery by Amazon,₹699,₹999
