name,main_category,sub_category,image,link,ratings,no_of_ratings,discount_price,actual_price
Electronic Spices 2.75 Inch 4ω (Ohm) 400w Max Power Dome Tweeter Speaker,car & motorbike,Car Electronics,https://m.media-amazon.com/images/I/61G5k3T0ffL._AC_UL320_.jpg,https://www.amazon.in/Electronic-Spices-Power-Tweeter-Speaker/dp/B0BN42M4H1/ref=sr_1_1153?qid=1679222070&s=electronics&sr=1-1153,,,₹129,₹199
"ZQWINT Bluetooth Car Adapter, Mini USB Bluetooth 5.0 Transmitter Receiver Wireless 3.5mm Aux Jack Adapter Hands-Free Car K...",car & motorbike,Car Electronics,https://m.media-amazon.com/images/I/51NLOKwNsLS._AC_UL320_.jpg,https://www.amazon.in/ZQWINT-Bluetooth-Transmitter-Receiver-Hands-Free/dp/B0BWV1FDKS/ref=sr_1_1154?qid=1679222070&s=electronics&sr=1-1154,,,₹219,₹999
PROTECTRON 6.35X32mm GLASS FUSE/INVERTER FUSE - 1A (Pack of 10),car & motorbike,Car Electronics,https://m.media-amazon.com/images/I/71St2ruv+NL._AC_UL320_.jpg,https://www.amazon.in/PROTECTRON-6-35X32mm-GLASS-FUSE-INVERTER/dp/B078XV4KGF/ref=sr_1_1155?qid=1679222070&s=electronics&sr=1-1155,3.8,32,,₹105
Cave Maruti Suzuki Male-Female Stereo Coupler Harness For All Suzuki Cars.,car & motorbike,Car Electronics,https://m.media-amazon.com/images/I/31npb8UF2yL._AC_UL320_.jpg,https://www.amazon.in/Maruti-Suzuki-Stereo-Coupler-Harness/dp/B09TRC11VH/ref=sr_1_1156?qid=1679222070&s=electronics&sr=1-1156,4.1,7,₹582,₹873
COVERBLACK Rubber Back Cover for Infinix X6815B / Zero 5G 2021 - Transparent,car & motorbike,Car Electronics,https://m.media-amazon.com/images/I/611zXbVxbNL._AC_UL320_.jpg,https://www.amazon.in/COVERBLACK-Infinix-X6815B-Zero-2021/dp/B0BXBJVVFQ/ref=sr_1_1157?qid=1679222070&s=electronics&sr=1-1157,,,₹148,₹799
"Die Hard Dual Purpose 360-Degree Rotating Mobile Car Mount Holder Stand for Windscreen, Dashboard & Table Desk with Double...",car & motorbike,Car Electronics,https://m.media-amazon.com/images/I/61lS3DsWxUL._AC_UL320_.jpg,https://www.amazon.in/Die-Hard-360-Degree-Windscreen-Dashboard/dp/B07XBCTSHV/ref=sr_1_1158?qid=1679222070&s=electronics&sr=1-1158,5.0,2,₹335,"₹1,299"
ESPtronics 4.1 Amplifier Board 12v DC Home Theater Kit Board Amplifier Circuit with Bass Boost and Treble Support TDA2030 ...,car & motorbike,Car Electronics,https://m.media-amazon.com/images/I/51fyQT38DJL._AC_UL320_.jpg,https://www.amazon.in/ESPtronics-Amplifier-Theater-Kit-Bluetooth/dp/B0BN3Z8S92/ref=sr_1_1159?qid=1679222070&s=electronics&sr=1-1159,,,₹540,₹998
WEON® Tiny Subwoofer Preamp kit with Volume Control for Tight Bass | Low Pass Filter | Bass Board | Inbuilt Gain | DC Sing...,car & motorbike,Car Electronics,https://m.media-amazon.com/images/I/71xLX6DuYKL._AC_UL320_.jpg,https://www.amazon.in/Subwoofer-Preamp-Control-Filter-Inbuilt/dp/B0BR558CX6/ref=sr_1_1160?qid=1679222070&s=electronics&sr=1-1160,3.1,4,₹313,₹396
"jiaruixin 6 Volt Kids Ride On Car Charger, 6V Battery Charger for Kid Trax Toddler Quad Hello Kitty SUV Battery Supply Pow...",car & motorbike,Car Electronics,https://m.media-amazon.com/images/I/61CoaaZnhsL._AC_UL320_.jpg,https://www.amazon.in/Universal-Mercedes-Benz-Childrens-Electric-Indicator/dp/B07BPBBNHQ/ref=sr_1_1161?qid=1679222070&s=electronics&sr=1-1161,4.2,131,₹593,₹999
Ceuta Retails Motorcycle Phone Holder with USB Charger 360 Rotation Bike Mobile Charger Fast Charging Bike Mobile Holder (...,car & motorbike,Car Electronics,https://m.media-amazon.com/images/I/41p7LZlyhNS._AC_UL320_.jpg,https://www.amazon.in/Ceuta-Retails-Degree-Rotating-Charger/dp/B07HXNR54J/ref=sr_1_1162?qid=1679222070&s=electronics&sr=1-1162,3.1,389,₹440,"₹1,599"
"DHRUV-PRO CA-188 Multifunction LED Inverter for Backlight, DC LED Controller Board Controller Board, 12 Connectors, LED St...",car & motorbike,Car Electronics,https://m.media-amazon.com/images/I/41TqbsqeBnL._AC_UL320_.jpg,https://www.amazon.in/DHRUV-PRO-Universal-Multifunction-Backlight-connecters/dp/B07QP6K7M4/ref=sr_1_1163_mod_primary_new?qid=1679222070&s=electronics&sbo=RZvfv%2F%2FHxDF%2BO5021pAnSA%3D%3D&sr=1-1163,3.7,52,₹328,₹599
xcluma M38 BLT 20M 4.2 5.0 MP3 Lossless Decoder Stereo Wireless Bluetooth Audio Receiver Board Module,car & motorbike,Car Electronics,https://m.media-amazon.com/images/I/61RqEenexIL._AC_UL320_.jpg,https://www.amazon.in/xcluma-Lossless-Wireless-Bluetooth-Receiver/dp/B09N17P3J5/ref=sr_1_1164?qid=1679222070&s=electronics&sr=1-1164,3.8,22,₹349,₹469
"R.J.VON - Mount,Mobile Phone Mount Bar for RE Himalayan BS4 2017-2021 Model",car & motorbike,Car Electronics,https://m.media-amazon.com/images/I/61gF3XVTvvL._AC_UL320_.jpg,https://www.amazon.in/R-J-VON-Mount-Mobile-Himalayan-2017-2021/dp/B0BQF3LGZM/ref=sr_1_1165?qid=1679222070&s=electronics&sr=1-1165,3.6,4,₹664,"₹1,599"
A2D Shark Fin Shape Decorative Roof Car Antenna Black For Tata Indigo Ecs,car & motorbike,Car Electronics,https://m.media-amazon.com/images/I/31kLxpXJf5L._AC_UL320_.jpg,https://www.amazon.in/A2D-Decorative-Antenna-Black-Tata-Indigo/dp/B07D39W186/ref=sr_1_1166?qid=1679222070&s=electronics&sr=1-1166,,,₹199,₹419
"Bumble Rainguard PVC Speakers Adapters for 6-6.5"" Car Speaker (Pair)",car & motorbike,Car Electronics,https://m.media-amazon.com/images/I/51SUHdSSFGL._AC_UL320_.jpg,https://www.amazon.in/Bumble-Rainguard-Speakers-Adapters-Speaker/dp/B0BDZZZ6YW/ref=sr_1_1167?qid=1679222070&s=electronics&sr=1-1167,3.5,2,₹299,₹999
Auto Pearl White Shark Fin Signal Receiver (AM/FM) Antenna Compatiable with - Verna Fluidic 4S,car & motorbike,Car Electronics,https://m.media-amazon.com/images/I/51kxKKo6f5L._AC_UL320_.jpg,https://www.amazon.in/Auto-Pearl-Premium-Replacement-Receiver/dp/B07FVYW2KG/ref=sr_1_1168?qid=1679222070&s=electronics&sr=1-1168,3.6,"1,894",₹499,"₹1,499"
BOCXN Universal Magnet Phone Car Mount Holder for Windshield/Dashboard | Portable Pocket Sized | Lightweight | Travel Stan...,car & motorbike,Car Electronics,https://m.media-amazon.com/images/I/31zYcpkXE4L._AC_UL320_.jpg,https://www.amazon.in/BOCXN-Universal-Windshield-Dashboard-Lightweight/dp/B0BC8HR8WJ/ref=sr_1_1169?qid=1679222070&s=electronics&sr=1-1169,5.0,1,₹199,₹899
JXL -T110 High Efficiency Dome Car Tweeter for Coaxial Car Speaker 360W MAX (Pair) Black,car & motorbike,Car Electronics,https://m.media-amazon.com/images/I/71+eWq0UKeL._AC_UL320_.jpg,https://www.amazon.in/JXL-Efficiency-Tweeter-Coaxial-Speaker/dp/B08K394NJY/ref=sr_1_1170?qid=1679222070&s=electronics&sr=1-1170,3.6,182,₹699,"₹1,299"
"SPYKART Car Rearview Mirror Phone Holder 360 Degree Extendable and Retractable, Universal 360° Car Rearview Mirror Mobile ...",car & motorbike,Car Electronics,https://m.media-amazon.com/images/I/51Yj2WwLbDL._AC_UL320_.jpg,https://www.amazon.in/SPYKART-Extendable-Retractable-Universal-Compatible/dp/B0BJNT5X4N/ref=sr_1_1171?qid=1679222070&s=electronics&sr=1-1171,3.2,16,₹399,"₹1,299"
CAROMATIC® Replacement Antenna Rod (Light Quality) for Maruti Suzuki Swift with Two Types of Thread Screws,car & motorbike,Car Electronics,https://m.media-amazon.com/images/I/51Uo0MSeA9L._AC_UL320_.jpg,https://www.amazon.in/Replacement-Antenna-Quality-Maruti-Suzuki/dp/B09C2NML6R/ref=sr_1_1172?qid=1679222070&s=electronics&sr=1-1172,3.6,45,₹245,₹799
POWERUP by Fuel Dual USB Port Car Charger Compatible for All Smartphones and Tablets 3.1Amp High Speed - Black,car & motorbike,Car Electronics,https://m.media-amazon.com/images/I/51LF-xIbpES._AC_UL320_.jpg,https://www.amazon.in/Fuel-Charger-Compatible-Smartphones-Tablets/dp/B0743BX1ND/ref=sr_1_1173?qid=1679222070&s=electronics&sr=1-1173,,,₹616,₹790
Guance Universal Working Shark fin car Antenna AM FM Radio Signal reciver ABS Plastic Antenna Black Color Decorative Anten...,car & motorbike,Car Electronics,https://m.media-amazon.com/images/I/51Y6V+cdjKL._AC_UL320_.jpg,https://www.amazon.in/Guance-Shark-Fin-Accessories-Decorate/dp/B07HGHWFZL/ref=sr_1_1174?qid=1679222070&s=electronics&sr=1-1174,2.9,31,₹378,₹899
"CELLMASTER Universal Mobile Holder for Car with One Touch Technology or Windshield/Dashboard Phone Stand for Car, Extendab...",car & motorbike,Car Electronics,https://m.media-amazon.com/images/I/71Ux6uW-TVL._AC_UL320_.jpg,https://www.amazon.in/CELLMASTER-Universal-Technology-Windshield-Extendable/dp/B0BCL3YJ7V/ref=sr_1_1175?qid=1679222070&s=electronics&sr=1-1175,,,₹375,₹999
A2D Shark Fin Shape Decorative Roof Car Antenna White For Maruti Suzuki Ciaz,car & motorbike,Car Electronics,https://m.media-amazon.com/images/I/215DjkL18fL._AC_UL320_.jpg,https://www.amazon.in/A2D-Decorative-Antenna-White-Maruti-Suzuki/dp/B07D39PYJK/ref=sr_1_1176?qid=1679222070&s=electronics&sr=1-1176,,,₹209,₹419
"Swiss Military UAM16 Car Extention 12V USB Charger for Cellular Phones, Black",car & motorbike,Car Electronics,https://m.media-amazon.com/images/I/51FlMP22OlL._AC_UL320_.jpg,https://www.amazon.in/Swiss-Military-UAM16-Extention-Charger/dp/B07WT23BHZ/ref=sr_1_1345?qid=1679222073&s=electronics&sr=1-1345,4.3,120,₹929,"₹1,390"
"TUSITA Charger for Garmin Forerunner 35 230 235 630 645 Music 735XT, Approach G10 S20, Vivomove HR - USB Charging Cable 10...",car & motorbike,Car Electronics,https://m.media-amazon.com/images/I/51+kcGuT5lL._AC_UL320_.jpg,https://www.amazon.in/Garmin-Forerunner-Charger-Replacement-Charging/dp/B01GO18ZIC/ref=sr_1_1346?qid=1679222073&s=electronics&sr=1-1346,4.4,894,₹790,"₹3,999"
ShopMagics Car Charger for OPPO Reno7 Pro / Reno 7 Pro Car Charger Dual USB Port | High Speed Rapid Fast Turbo QC 3.0 Andr...,car & motorbike,Car Electronics,https://m.media-amazon.com/images/I/61M6pYy-uRL._AC_UL320_.jpg,https://www.amazon.in/ShopMagics-Charger-OPPO-Reno7-Pro/dp/B0B15C3SQ9/ref=sr_1_1347?qid=1679222073&s=electronics&sr=1-1347,,,₹499,₹999
PROTECTRON FAST BLOW 6.35X25mm GLASS FUSE- 7A (Pack of 10),car & motorbike,Car Electronics,https://m.media-amazon.com/images/I/71uGdbiIoZL._AC_UL320_.jpg,https://www.amazon.in/PROTECTRON-FAST-6-35X25mm-GLASS-FUSE/dp/B078XVXJGD/ref=sr_1_1348?qid=1679222073&s=electronics&sr=1-1348,3.7,8,,₹105
Auto Pearl Shark Fin Antenna Universal Replacement Car Antenna Roof Aerial ABS Material Waterproof Rubber Ring AM FM Radio...,car & motorbike,Car Electronics,https://m.media-amazon.com/images/I/61OhK8wjyeL._AC_UL320_.jpg,https://www.amazon.in/Autopearl-Signal-Receiver-Antenna-Maruti/dp/B079Z51FCC/ref=sr_1_1349?qid=1679222073&s=electronics&sr=1-1349,3.6,"1,894",₹499,"₹1,499"
CELLMASTER Metal Mobile Phone Holder for Bike Motorcycle Phone Holder Handlebar Phone Mount for Bike Cell Phone Stand,car & motorbike,Car Electronics,https://m.media-amazon.com/images/I/61wk57eXO7L._AC_UL320_.jpg,https://www.amazon.in/CELLMASTER-Mobile-Holder-Motorcycle-Handlebar/dp/B0BCZCN8NJ/ref=sr_1_1350?qid=1679222073&s=electronics&sr=1-1350,5.0,4,₹395,₹999
Transcend DrivePro 250 Dash Camera |2K QHD 1440P | 2 Yrs Warranty| Made in Taiwan | Sony STARVIS™ | WiFi | GPS |TS-DP250A-32G,car & motorbike,Car Electronics,https://m.media-amazon.com/images/I/51XJjPlGtDL._AC_UL320_.jpg,https://www.amazon.in/Transcend-DrivePro-Camera-microSD-TS-DP250A-32G/dp/B08VFH2VSP/ref=sr_1_1351?qid=1679222073&s=electronics&sr=1-1351,4.5,79,"₹9,118","₹10,999"
"BETUU Enterprises New 360� Rearview Mirror Phone Holder, Multifunctional Car Phone Mount GPS Holder, Universal Rotating Ca...",car & motorbike,Car Electronics,https://m.media-amazon.com/images/I/212dM5+kdGL._AC_UL320_.jpg,https://www.amazon.in/BETUU-Enterprises-Multifunctional-Universal-Automobile/dp/B0BV6TPPJB/ref=sr_1_1352?qid=1679222073&s=electronics&sr=1-1352,Get,Only 2 left in stock.,₹449,₹999
WHEETOYKART GPS Mount for Himalayan BS3 and BS4,car & motorbike,Car Electronics,https://m.media-amazon.com/images/I/71IWSAfJ5XL._AC_UL320_.jpg,https://www.amazon.in/WHEETOYKART-GPS-Mount-Himalayan-BS3/dp/B09XFJY4P5/ref=sr_1_1353?qid=1679222073&s=electronics&sr=1-1353,1.9,4,₹899,"₹1,699"
HIKER Aluminium Super Powerful Mini Magnetic Mobile Holder for Car Dashboard & Windshield (Grey),car & motorbike,Car Electronics,https://m.media-amazon.com/images/I/51Fw8ZSZXuL._AC_UL320_.jpg,https://www.amazon.in/HIKER-Aluminium-Powerful-Dashboard-Windshield/dp/B08FBDZ9DG/ref=sr_1_1354?qid=1679222073&s=electronics&sr=1-1354,3.5,122,₹299,₹599
WROPZO Universal Clip Cell Phone Holder Multi-Joint Flexible Adjustment for Car Rear View Mirror Back Seat Video Stand Kit...,car & motorbike,Car Electronics,https://m.media-amazon.com/images/I/51suwEA4aGL._AC_UL320_.jpg,https://www.amazon.in/WROPZO-Universal-Multi-Joint-Flexible-Adjustment/dp/B0BQWK5GYK/ref=sr_1_1355?qid=1679222073&s=electronics&sr=1-1355,2.4,5,₹369,₹999
HOJI� Premium- Car Phone Holder for Rear View Mirror Mount Stand | Anti Shake & Fall Prevention | 360 Degree Rotation | Ad...,car & motorbike,Car Electronics,https://m.media-amazon.com/images/I/51PUMWc-KsL._AC_UL320_.jpg,https://www.amazon.in/Ceuta-Retails-Universally-Adjustable-Anti-Vibration/dp/B07R43T85P/ref=sr_1_1356?qid=1679222073&s=electronics&sr=1-1356,3.2,71,₹273,₹999
XGMO Car Dashboard Phone Holder Mount Stand for All Smartphones,car & motorbike,Car Electronics,https://m.media-amazon.com/images/I/51GEa8uEXFL._AC_UL320_.jpg,https://www.amazon.in/XGMO-Dashboard-Phone-Mount-Smartphones/dp/B09WLSF2D7/ref=sr_1_1357?qid=1679222073&s=electronics&sr=1-1357,3.8,12,₹275,₹799
"Waterproof Case Bike Motorcycle Handlebar Magnetic 3 to 6.7"" Cellphone Mount Bag,Navigation Stand,Mobile Phone Case Holde...",car & motorbike,Car Electronics,https://m.media-amazon.com/images/I/61qEuLKzhZL._AC_UL320_.jpg,https://www.amazon.in/Waterproof-Motorcycle-Handlebar-Navigation-Holder_B63/dp/B0BN4PJ9DW/ref=sr_1_1358?qid=1679222073&s=electronics&sr=1-1358,2.0,1,₹595,"₹1,980"
"Electronicspices 2"" 4Ohm 3W Full Range Audio Speaker Stereo Woofer Loudspeaker with Bluetooth FM USB AUX Card MP3 Stereo A...",car & motorbike,Car Electronics,https://m.media-amazon.com/images/I/71YK5139ZrL._AC_UL320_.jpg,https://www.amazon.in/Electronicspices-Speaker-Loudspeaker-Bluetooth-Decoder/dp/B08VGTCQ62/ref=sr_1_1359?qid=1679222073&s=electronics&sr=1-1359,2.9,3,,₹600
ESPtonics 5 Pcs 9V Battery Adapter Snapper Connector Clip Lead Wires Holder DC 5.5x2.1 mm Jack Clip Power Cable for DIY 9V...,car & motorbike,Car Electronics,https://m.media-amazon.com/images/I/51P0y1Jx7GL._AC_UL320_.jpg,https://www.amazon.in/ESPtonics-Battery-Adapter-Snapper-Connector/dp/B0BN42PJF1/ref=sr_1_1360?qid=1679222073&s=electronics&sr=1-1360,,,₹230,₹499
Kozdiko 4 Port USB Car Charger with 3 in 1 Cable for Renault Kwid,car & motorbike,Car Electronics,https://m.media-amazon.com/images/I/51ybjVEIJ7L._AC_UL320_.jpg,https://www.amazon.in/Kozdiko-Port-Charger-Cable-Renault/dp/B09V4FSJCZ/ref=sr_1_1361?qid=1679222073&s=electronics&sr=1-1361,,,₹399,₹499
e-INFINITY Wire Cable Connectors Terminals Crimp Scotch Lock Quick Splice Electrical Car Audio 22-10AWG 0.5mm-6mm Kit Tool...,car & motorbike,Car Electronics,https://m.media-amazon.com/images/I/510IMzLAoOL._AC_UL320_.jpg,https://www.amazon.in/INFINITY-Connectors-Terminals-Electrical-0-5mm-6mm/dp/B07T2VDR9W/ref=sr_1_1362?qid=1679222073&s=electronics&sr=1-1362,3.3,110,₹109,₹499
WEON ™ Loudness Hi Filter Kit for Bass Treble Boards (Boost The Music with Increased Effect),car & motorbike,Car Electronics,https://m.media-amazon.com/images/I/71-ErH8augL._AC_UL320_.jpg,https://www.amazon.in/WEON-Loudness-Filter-Treble-Increased/dp/B08R6F8WKM/ref=sr_1_1363?qid=1679222073&s=electronics&sr=1-1363,3.6,17,₹297,₹425
AUTO-EX 5pcs 12V Plastic Ceramic Blade Fuse Holder Fuse Box Car Motorcycle,car & motorbike,Car Electronics,https://m.media-amazon.com/images/I/51cz5KdDaBL._AC_UL320_.jpg,https://www.amazon.in/AUTO-EX-Plastic-Ceramic-Holder-Motorcycle/dp/B084WPBNQQ/ref=sr_1_1364?qid=1679222073&s=electronics&sr=1-1364,4.0,17,₹199,₹399
ONCRO® TYPEC 40cm Oneplus Short 3 in 1 Charging Cable Dash Warp 65w car Multi Charger Power Bank Cord Type c Micro USB i-P...,car & motorbike,Car Electronics,https://m.media-amazon.com/images/I/51aHbRrxPWL._AC_UL320_.jpg,https://www.amazon.in/40cm-Oneplus-Charging-Charger-Transfer/dp/B0BJVK3XBM/ref=sr_1_1365?qid=1679222073&s=electronics&sr=1-1365,,,₹385,₹899
MOTO X-SPEED New Multi-Function Motorcycle USB Mobile Phone Charger Handle Switch Assembly 5V 2A,car & motorbike,Car Electronics,https://m.media-amazon.com/images/I/312rYDfzk2L._AC_UL320_.jpg,https://www.amazon.in/MOTO-X-SPEED-Multi-Function-Motorcycle-Assembly/dp/B0BRV5TPQ2/ref=sr_1_1366?qid=1679222073&s=electronics&sr=1-1366,,,₹299,₹999
GCIYAEN Car Waterproof Electrical Connector Plug Socket with Wire AWG (5 Kit 2 Pin),car & motorbike,Car Electronics,https://m.media-amazon.com/images/I/51j4ic4epDL._AC_UL320_.jpg,https://www.amazon.in/GCIYAEN-Waterproof-Electrical-Connector-Socket/dp/B0B9XH3D5C/ref=sr_1_1367?qid=1679222073&s=electronics&sr=1-1367,Get,FREE Delivery by Amazon,"₹1,099","₹2,198"
"BOBO BM1 Jaw-Grip Waterproof Bike / Motorcycle / Scooter Mobile Phone Holder Mount with Fast USB 3.0 Charger, Ideal for Ma...",car & motorbike,Car Electronics,https://m.media-amazon.com/images/I/61DFaH8gXLL._AC_UL320_.jpg,https://www.amazon.in/BOBO-Jaw-Grip-Waterproof-Motorcycle-Navigation/dp/B09LVKL1CN/ref=sr_1_1368?qid=1679222073&s=electronics&sr=1-1368,4.5,"15,682","₹1,799","₹3,499"
"DeoDap 360°Rotatable Multi-Purpose Magic Sucker Phone Holder, Double-Sided Suction Cup Mobile Phone Holder, Long Arm Phone...",car & motorbike,Car Electronics,https://m.media-amazon.com/images/I/41YM49uNxyL._AC_UL320_.jpg,https://www.amazon.in/DeoDap-360%C2%B0Rotatable-Multi-Purpose-Double-Sided-Compatible/dp/B0BT1QMSHK/ref=sr_1_1489?qid=1679222077&s=electronics&sr=1-1489,,,₹136,₹208
DIY Crafts 100pcs/lot Set Kit 5x20mm Fuse Assorted Kits DIY Quick Blow Glass Tube Fast-blow Glass Fuses 0.2A-20A Cartridge...,car & motorbike,Car Electronics,https://m.media-amazon.com/images/I/71pBAYPcTlL._AC_UL320_.jpg,https://www.amazon.in/DIY-Crafts-Fast-Blow-Cartridge-Transparent/dp/B0875SLDPY/ref=sr_1_1490?qid=1679222077&s=electronics&sr=1-1490,1.2,5,₹549,"₹3,628.90"
"SPYKART Dashboard Phone Holder for Car [ Vertical Horizontal 360 Rotate ] Car Phone Mount,Dashboard Cell Phone Holder Comp...",car & motorbike,Car Electronics,https://m.media-amazon.com/images/I/5198GaO5wQL._AC_UL320_.jpg,https://www.amazon.in/SPYKART-Dashboard-Horizontal-Compatible-Smartphones/dp/B0BFLX9NXW/ref=sr_1_1491?qid=1679222077&s=electronics&sr=1-1491,3.0,34,₹299,"₹1,199"
Red Cahmpion Plastic Black Motorbike Activa Mobile Holder with Rearview Mirror Mount Stand,car & motorbike,Car Electronics,https://m.media-amazon.com/images/I/41rPM3uA7iL._AC_UL320_.jpg,https://www.amazon.in/Red-Cahmpion-Motorbike-Mobile-Holder/dp/B0BX4HMRRB/ref=sr_1_1492?qid=1679222077&s=electronics&sr=1-1492,,,₹299,₹999
ERH India 4440 IC Board Amplifier Kit DIY Audio Dual Channel 40 + 40W with Bluetooth FM USB Aux Card MP3 Stereo Audio Play...,car & motorbike,Car Electronics,https://m.media-amazon.com/images/I/61k0fpQMI3L._AC_UL320_.jpg,https://www.amazon.in/ERH-India-Amplifier-Channel-Bluetooth/dp/B08VJCBVWR/ref=sr_1_1493?qid=1679222077&s=electronics&sr=1-1493,3.9,28,₹510,₹698
"CLOUDSALE ; Your Store. Your Place 7 Inch Bluetooth Rear View LED Monitor Dashboard Screen MP3,MP5,Bluetooth, FM/Hi-Fi Amp...",car & motorbike,Car Electronics,https://m.media-amazon.com/images/I/31bJKMoLB+L._AC_UL320_.jpg,https://www.amazon.in/CLOUDSALE-Your-Store-Place-Bluetooth/dp/B098JYQCZQ/ref=sr_1_1494?qid=1679222077&s=electronics&sr=1-1494,4.0,3,"₹3,199","₹6,999"
Semaphore® Adjustable Mobile Phone Holder for Car Driving Center Console Dashboard Mount Storage Bracket Adhesive (Compati...,car & motorbike,Car Electronics,https://m.media-amazon.com/images/I/51onL6WZ-FL._AC_UL320_.jpg,https://www.amazon.in/Semaphore%C2%AE-Adjustable-Dashboard-Adhesive-Compatible/dp/B0BPCD6KVJ/ref=sr_1_1495?qid=1679222077&s=electronics&sr=1-1495,,,₹375,₹699
"AmazonBasics 4.8 Amp/24W Dual USB Car Charger for Apple & Android Devices, White",car & motorbike,Car Electronics,https://m.media-amazon.com/images/I/51afBY72okL._AC_UL320_.jpg,https://www.amazon.in/AmazonBasics-Charger-Apple-Android-Devices/dp/B071SKHZX4/ref=sr_1_1496?qid=1679222077&s=electronics&sr=1-1496,4.2,"4,148",,"₹1,300"
"Cave Car Rear View Night vison Camera,car Reverse Camera Set (Black, White & Silver, Cave20)",car & motorbike,Car Electronics,https://m.media-amazon.com/images/I/716z9qdoViL._AC_UL320_.jpg,https://www.amazon.in/Cave-Camera-Reverse-Silver-Cave20/dp/B07DC5YTC7/ref=sr_1_1497?qid=1679222077&s=electronics&sr=1-1497,3.0,2,₹584,₹876
ULTRAWAY USB Mobile Charger for Bikes and Cars. (Fast Charging Output : 5V-1.5A) (Waterproof Sillicon Cover with on/Off Sw...,car & motorbike,Car Electronics,https://m.media-amazon.com/images/I/51MO80dmdSL._AC_UL320_.jpg,https://www.amazon.in/ULTRAWAY-USB-Mobile-Charger-Charging/dp/B0B6RLZHLB/ref=sr_1_1498?qid=1679222077&s=electronics&sr=1-1498,,,₹249,₹899
ERH India 2.1 Home Theater Kit Board Amplifier Circuit with Bass Boost and Treble Support TDA2030 Based with Bluetooth FM ...,car & motorbike,Car Electronics,https://m.media-amazon.com/images/I/41C2KC29G-L._AC_UL320_.jpg,https://www.amazon.in/ERH-India-Theater-Amplifier-Bluetooth/dp/B08VJB9JYT/ref=sr_1_1499?qid=1679222077&s=electronics&sr=1-1499,3.3,133,₹599,₹799
"AUSHA® Three Way Car Dashboard Cam (Front + Inside+ Rear) ;1080P Full HD Dash Camera for Cars with G-Sensor, Loop-Recordin...",car & motorbike,Car Electronics,https://m.media-amazon.com/images/I/61NlH1rnnzS._AC_UL320_.jpg,https://www.amazon.in/Three-Way-Dash-Camera-Loop-Recording/dp/B09ZHWQ2VX/ref=sr_1_1500?qid=1679222077&s=electronics&sr=1-1500,3.7,3,"₹3,999","₹4,999"
SJCAM SJDASH+ Dash Camera | 1080P Full HD | 140° Wide Angle | G-Sensor | Motion Detector | Loop Recorder | Car Dashboard C...,car & motorbike,Car Electronics,https://m.media-amazon.com/images/I/5145o6qD11L._AC_UL320_.jpg,https://www.amazon.in/SJCAM-SJDASH-Dash-Camera-Black/dp/B07FCMZ5R2/ref=sr_1_1501?qid=1679222077&s=electronics&sr=1-1501,3.2,18,"₹8,590","₹13,800"
RASHRI ; One For All 12/24V Mini USB Fast Charger for CAR and Bike USE for Mobile Charger with Twin USB Socket,car & motorbike,Car Electronics,https://m.media-amazon.com/images/I/51EHN+-CqiL._AC_UL320_.jpg,https://www.amazon.in/RASHRI-One-All-Charger-Mobile/dp/B09P7JZN5F/ref=sr_1_1502?qid=1679222077&s=electronics&sr=1-1502,3.4,39,₹259,₹799
EJEAS V6 Bluetooth Motorcycle Helmet Intercom Headset Wireless 1000M Walkie-Talkie Headphone 6 Riders Communicator System ...,car & motorbike,Car Electronics,https://m.media-amazon.com/images/I/61xHGkkB5tL._AC_UL320_.jpg,https://www.amazon.in/EJEAS-Bluetooth-Motorcycle-Walkie-Talkie-Communicator/dp/B078S6LWB2/ref=sr_1_1503?qid=1679222077&s=electronics&sr=1-1503,4.2,47,"₹5,899","₹8,999"
Universal Hub Shark Fin Antenna Universal Replacement Car Antenna Roof Aerial Waterproof Rubber Ring AM/FM Radio Signal Co...,car & motorbike,Car Electronics,https://m.media-amazon.com/images/I/51+1B7fT8tL._AC_UL320_.jpg,https://www.amazon.in/Universal-Hub-Replacement-Ford-Ecosport/dp/B09FH3K2QB/ref=sr_1_1504?qid=1679222077&s=electronics&sr=1-1504,,,₹499,₹799
Noymi Wireless Car Holder-141B 15 W Single Port Phone Charger For Cellular Phones With Usb Cable - Black,car & motorbike,Car Electronics,https://m.media-amazon.com/images/I/61gXpji7E+L._AC_UL320_.jpg,https://www.amazon.in/NOYMI-Wireless-Auto-Clamping-Charging-Compatible/dp/B08223J4CS/ref=sr_1_1505?qid=1679222077&s=electronics&sr=1-1505,3.8,202,"₹1,234","₹4,999"
"Toreto Multi Function Car Mobile Holder Grasp 3""-TOR 157",car & motorbike,Car Electronics,https://m.media-amazon.com/images/I/71sghhEY5LL._AC_UL320_.jpg,https://www.amazon.in/Toreto-Function-Mobile-Holder-157/dp/B07CYFL4X6/ref=sr_1_1506?qid=1679222077&s=electronics&sr=1-1506,3.9,83,₹499,₹599
"Wavva® Bottle Holder with Adjustable Clamp Black and Wavva Rubber Bike Bag with Phone Holder for Mountain Bike, Bike Handl...",car & motorbike,Car Electronics,https://m.media-amazon.com/images/I/41c7qDwMBBL._AC_UL320_.jpg,https://www.amazon.in/Wavva-Adjustable-Handlebar-Waterproof-Touchscreen/dp/B09FGNC5KX/ref=sr_1_1507?qid=1679222077&s=electronics&sr=1-1507,3.8,72,₹349,"₹1,399"
Kozdiko Black Shark Fin Signal Antenna for All Cars,car & motorbike,Car Electronics,https://m.media-amazon.com/images/I/211kCYU-o+L._AC_UL320_.jpg,https://www.amazon.in/Kozdiko-Black-Signal-Replacement-Antenna/dp/B0162GW468/ref=sr_1_1508?qid=1679222077&s=electronics&sr=1-1508,3.3,56,₹509,₹728
Hello Magic Super Doom Tweeter Hi-Fi Components System DJ Sound Model-104 (1),car & motorbike,Car Electronics,https://m.media-amazon.com/images/I/51V3MLzYqWL._AC_UL320_.jpg,https://www.amazon.in/Hello-Magic-Tweeter-Components-Model-104/dp/B09TRK8Y1C/ref=sr_1_1509?qid=1679222077&s=electronics&sr=1-1509,4.1,5,₹199,₹399
ERH India (1 Pair) Male Female Connector Socket 2 Pin Electric Jointer Cable Terminal Plug 2.8 mm with Crimp Pins for E-Bi...,car & motorbike,Car Electronics,https://m.media-amazon.com/images/I/41Afh3-5vcL._AC_UL320_.jpg,https://www.amazon.in/India-Connector-Electric-Jointer-Terminal/dp/B09VDM9SCK/ref=sr_1_1510_mod_primary_new?qid=1679222077&s=electronics&sbo=RZvfv%2F%2FHxDF%2BO5021pAnSA%3D%3D&sr=1-1510,3.8,16,₹202,₹349
SCOSCHE FMT4R TuneIn Battery Powered Universal Wireless FM Transmitter - Black,car & motorbike,Car Electronics,https://m.media-amazon.com/images/I/61pYc5GcThL._AC_UL320_.jpg,https://www.amazon.in/SCOSCHE-Battery-Universal-Wireless-Transmitter/dp/B004NEUK86/ref=sr_1_1511?qid=1679222077&s=electronics&sr=1-1511,4.4,"2,300",,"₹3,570"
BuySasta Car Audio FM/AM Roof Antenna for Toyota Innova 2005-2012,car & motorbike,Car Electronics,https://m.media-amazon.com/images/I/61mU0ITvbCL._AC_UL320_.jpg,https://www.amazon.in/BuySasta-Antenna-Toyota-Innova-2005-2012/dp/B0BD2CKV8V/ref=sr_1_1512?qid=1679222077&s=electronics&sr=1-1512,,,₹250,₹999
