name,main_category,sub_category,image,link,ratings,no_of_ratings,discount_price,actual_price
"100pcs Poke+Moon Assorted Playing Card Game for Kids V, Vmax, Gx, Ex Rainbow Cards (Rainbow) (100 Cards)",toys & baby products,Toys & Games,https://m.media-amazon.com/images/I/71hyTMRsmpL._AC_UL320_.jpg,https://www.amazon.in/100pcs-Assorted-Playing-Rainbow-Cards/dp/B0BSDGXSZN/ref=sr_1_5213?qid=1679219498&s=toys&sr=1-5213,4.2,8,₹699,"₹1,999"
"FunBlast Tool Kit Toys for Kids - Little Engineer Pretend Play Tool Set with Portable Briefcase, Role Play Toys for 3+ Yea...",toys & baby products,Toys & Games,https://m.media-amazon.com/images/I/614Kn1CXpmL._AC_UL320_.jpg,https://www.amazon.in/FunBlast-Tool-Kit-Toys-Kids/dp/B0BRQ1D7YL/ref=sr_1_5214?qid=1679219498&s=toys&sr=1-5214,,,₹349,₹999
HARIBAS Madrasi Mukhwas (White Madrasi Saunf) 200GX2 in Tin Can| Pure and Premium Mukhwas Mouth Freshener | Thandai Mint S...,toys & baby products,Toys & Games,https://m.media-amazon.com/images/I/71TXrlbFDaL._AC_UL320_.jpg,https://www.amazon.in/HARIBAS-Madrasi-Mukhwas-Freshener-Digestion/dp/B08KY8L2KQ/ref=sr_1_5215?qid=1679219498&s=toys&sr=1-5215,4.2,232,₹249,₹300
"AYREST Upgraded Dancing Cactus Toy for Baby. Funny Mimicking tiktok Dancing Cactus Toys for girls, Dancing Singing & Recor...",toys & baby products,Toys & Games,https://m.media-amazon.com/images/I/71pBdPglJRL._AC_UL320_.jpg,https://www.amazon.in/Charging-Mimicking-Recording-Entertaining-Education/dp/B09R84ZL4L/ref=sr_1_5216?qid=1679219498&s=toys&sr=1-5216,4.0,80,₹549,₹799
IMTION ® 20 Sheet Cartoon Puffy 3D Cute Stickers Cartoon Sticker (20 Sheet) - Multicolor,toys & baby products,Toys & Games,https://m.media-amazon.com/images/I/81amh+w763L._AC_UL320_.jpg,https://www.amazon.in/IMTION-Sheet-Cartoon-Stickers-Sticker/dp/B0BM54Y6LK/ref=sr_1_5217?qid=1679219498&s=toys&sr=1-5217,4.4,10,₹98,₹300
"Party Propz Happy Birthday Decoration Kit Combo - 53Pcs Black Golden Silver Items Set with 2Pcs Silver Foil Curtain,50 Pcs",toys & baby products,Toys & Games,https://m.media-amazon.com/images/I/81ohlP0VtFL._AC_UL320_.jpg,https://www.amazon.in/Party-Propz-Birthday-Balloons-Metallic/dp/B07QBCKWSD/ref=sr_1_5218?qid=1679219498&s=toys&sr=1-5218,4.2,"4,610",₹419,₹899
"Miniature Mart Baby Toy Cars for 1 Year Old Boys Girls, Toy Scooter Set of 1 Press & Go Animal Cartoon Vehicles Car Toys f...",toys & baby products,Toys & Games,https://m.media-amazon.com/images/I/61JJfgvqArL._AC_UL320_.jpg,https://www.amazon.in/Miniature-Mart-Toy-Press-Go/dp/B0BQFBDFVF/ref=sr_1_5219?qid=1679219498&s=toys&sr=1-5219,5.0,2,₹330.60,₹398
"EQIQ Think Labs Big Wooden Doll House for Girls | Foldable, Easy to Carry | Colorful Dollhouse with Furniture, Playground ...",toys & baby products,Toys & Games,https://m.media-amazon.com/images/I/61X5CFuDGAL._AC_UL320_.jpg,https://www.amazon.in/EQIQ-Think-Labs-Miniature-Dollhouse/dp/B0B18P2998/ref=sr_1_5220?qid=1679219498&s=toys&sr=1-5220,4.2,69,"₹1,881","₹2,800"
Sarvda Convocation Gown for Kids | Graduation Gown and Cap for Boys and Girls | Degree Gown Color Costume For Convocation...,toys & baby products,Toys & Games,https://m.media-amazon.com/images/I/61TorisAh7L._AC_UL320_.jpg,https://www.amazon.in/Sarvda-Convocation-Graduation-Degree-Costume/dp/B0BY2YQ69N/ref=sr_1_5221?qid=1679219498&s=toys&sr=1-5221,4.1,4,₹479,"₹1,299"
ARTLABEL Early Education Electronic Talking Flash Cards Toy Device with Music Sound English Words for Preschool Kids Toddl...,toys & baby products,Toys & Games,https://m.media-amazon.com/images/I/714Qp8qamCL._AC_UL320_.jpg,https://www.amazon.in/ARTLABEL-Electronic-Montessori-Educational-Rechargeable/dp/B0BP2TQGDX/ref=sr_1_5222?qid=1679219498&s=toys&sr=1-5222,4.0,2,₹399,₹999
"Wobbox Birthday Bunting Banner""Its My Half Birthday"" Jute Style Pink Heart, Birthday Decoration Item",toys & baby products,Toys & Games,https://m.media-amazon.com/images/I/81SOm3UifWL._AC_UL320_.jpg,https://www.amazon.in/Wobbox-Birthday-Bunting-Banner-Decoration/dp/B08XK149FP/ref=sr_1_5223?qid=1679219498&s=toys&sr=1-5223,4.5,195,₹145,₹499
"FunBlast Color Markers Twin Tip - Double Tip Markers for Artist, Sketch Alcohol Markers Set, Drawing Colouring Markers for...",toys & baby products,Toys & Games,https://m.media-amazon.com/images/I/61nWLO1YZ2L._AC_UL320_.jpg,https://www.amazon.in/FunBlast-Color-Markers-Twin-Tip/dp/B09Q5LRLCB/ref=sr_1_5224?qid=1679219498&s=toys&sr=1-5224,4.1,74,₹569,"₹1,499"
HIGHROOF® Body Part Puzzle Kids Wooden Toys for Kids 3 + Jigsaw Puzzles for Adults Baby Learning Toys Educational Toys for...,toys & baby products,Toys & Games,https://m.media-amazon.com/images/I/81lw8kP9YLL._AC_UL320_.jpg,https://www.amazon.in/HIGHROOF%C2%AE-Puzzle-Puzzles-Learning-Educational/dp/B09PDDXZ4X/ref=sr_1_5225?qid=1679219498&s=toys&sr=1-5225,4.0,215,₹249,₹499
Tanman Toys Hula Hoop Hoopa Hula Hoopla Ring Exercise Ring for Fitness with 30 Inch Diameter for Boys Girls Kids and Adult...,toys & baby products,Toys & Games,https://m.media-amazon.com/images/I/61US+MkRdIL._AC_UL320_.jpg,https://www.amazon.in/TanMan-Exercise-Fitness-Diameter-Adults/dp/B07NBSBYF7/ref=sr_1_5226?qid=1679219498&s=toys&sr=1-5226,3.8,"1,159",₹276,₹355
"Toyzoy Maple Pro Max Kids|Baby Trike|Tricycle with Canopy for Kids|Boys|Girls Age Group 2 to 5 Years, TZ-532 (Red)",toys & baby products,Toys & Games,https://m.media-amazon.com/images/I/71fk2fK9LyL._AC_UL320_.jpg,https://www.amazon.in/Toyzoy-Maple-Tricycle-Canopy-TZ-532/dp/B0B2S2SST5/ref=sr_1_5227?qid=1679219498&s=toys&sr=1-5227,3.8,849,"₹3,199","₹5,599"
"Play Panda Brain Booster Set 2 (Junior) - 56 Puzzles Designed to Boost Intelligence - with Magnetic Shapes, Magnetic Boar...",toys & baby products,Toys & Games,https://m.media-amazon.com/images/I/51s+PRc2BeL._AC_UL320_.jpg,https://www.amazon.in/Play-Panda-Brain-Booster-Junior/dp/B07QD61CQB/ref=sr_1_5228?qid=1679219498&s=toys&sr=1-5228,4.0,276,₹254,₹299
PATPAT ® Pull Back Dinosaur Car Toys for Dino Toys Kids 3 Year Old Boys and Toddlers for Birthday Christmas Gift Dinosaur ...,toys & baby products,Toys & Games,https://m.media-amazon.com/images/I/71rL44V-GRL._AC_UL320_.jpg,https://www.amazon.in/PATPAT-Dinosaur-Toddlers-Birthday-Christmas/dp/B09SD7THBX/ref=sr_1_5229?qid=1679219498&s=toys&sr=1-5229,3.9,53,"₹1,355","₹1,695"
KARP Children Deluxe Art Drawing Set for Kids Case Studio Art and Craft Supplies Drawing and Painting Set Great Gift (150 ...,toys & baby products,Toys & Games,https://m.media-amazon.com/images/I/71BPPHAKz7S._AC_UL320_.jpg,https://www.amazon.in/KARP-Art-Kit-Portable-Cardboard/dp/B097P7CGT8/ref=sr_1_5230?qid=1679219498&s=toys&sr=1-5230,3.8,535,₹999,"₹1,299"
"FancyDressWale Convocation Cap for Kids, Black",toys & baby products,Toys & Games,https://m.media-amazon.com/images/I/71X4iD7jgIL._AC_UL320_.jpg,https://www.amazon.in/FancyDressWale-Convocation-Kids-Black-Pack/dp/B0852633MF/ref=sr_1_5231?qid=1679219498&s=toys&sr=1-5231,4.0,247,"₹1,099","₹2,199"
Generic Aluminium Alloy Kazoo with Diaphragm Silver-15013494MG,toys & baby products,Toys & Games,https://m.media-amazon.com/images/I/51dasyUgLTL._AC_UL320_.jpg,https://www.amazon.in/Generic-Aluminium-Alloy-Diaphragm-Silver-15013494MG/dp/B019H1HR6C/ref=sr_1_5232_mod_primary_new?qid=1679219498&s=toys&sbo=RZvfv%2F%2FHxDF%2BO5021pAnSA%3D%3D&sr=1-5232,3.6,"1,139",₹239,₹499
Asian Hobby Crafts Dream Catcher Wall Hanging (Pastel Vibe) - Clear,toys & baby products,Toys & Games,https://m.media-amazon.com/images/I/61iAKND2oQL._AC_UL320_.jpg,https://www.amazon.in/Asian-Hobby-Crafts-Catcher-Hanging/dp/B09B3Z28MR/ref=sr_1_5281?qid=1679219500&s=toys&sr=1-5281,4.2,42,₹315,₹525
"Passion for Fashion Spiderman Dress for Boys and Girls Kids Set of 4 (Top,Bottom,Mask,Globes)",toys & baby products,Toys & Games,https://m.media-amazon.com/images/I/71iUrYs7xwL._AC_UL320_.jpg,https://www.amazon.in/Passion-Fashion-Spiderman-Bottom-Globes/dp/B09SXYK2QP/ref=sr_1_5282?qid=1679219500&s=toys&sr=1-5282,4.3,14,₹299,₹799
"Brustro Artists Sketch Book Wiro Bound A4 Size, Landscape, 116 Pages, 160 GSM (Acid Free)",toys & baby products,Toys & Games,https://m.media-amazon.com/images/I/81MZj8LIO1L._AC_UL320_.jpg,https://www.amazon.in/Brustro-Artists-Sketch-Bound-Landscape/dp/B07RSRYTGC/ref=sr_1_5283?qid=1679219500&s=toys&sr=1-5283,4.6,155,,₹597
DIVUE Bugatti Toys Car Metal For Kids With Openable Doors Flashing Light and Musical Sound Die Cast Metal Car Collection B...,toys & baby products,Toys & Games,https://m.media-amazon.com/images/I/61SR2UNyZwL._AC_UL320_.jpg,https://www.amazon.in/DIVUE-Openable-Flashing-Collection-Exclusive/dp/B0BMQRPLRT/ref=sr_1_5284?qid=1679219500&s=toys&sr=1-5284,3.7,7,₹899,"₹3,999"
"Party Propz Anniversary Decoration Items - Happy Anniversary Decoration Set with Lights, Golden Foil Balloon, Red & Golden...",toys & baby products,Toys & Games,https://m.media-amazon.com/images/I/81PBdBzV+SL._AC_UL320_.jpg,https://www.amazon.in/Party-Propz-Anniversary-Decoration-Items/dp/B0BRNFDLXV/ref=sr_1_5285?qid=1679219500&s=toys&sr=1-5285,4.6,3,₹499,₹999
Pulse-Wave Mark-1 Single Tube Stethoscope - Dual Head (Pink),toys & baby products,Toys & Games,https://m.media-amazon.com/images/I/61dvOjCXwhL._AC_UL320_.jpg,https://www.amazon.in/Pulse-Wave-Mark-1-Stethoscope-Working-Nursing/dp/B091GRMG58/ref=sr_1_5286?qid=1679219500&s=toys&sr=1-5286,3.9,66,₹288,₹999
Ratna's Big Business Board Game Jumbo Size with Plastic Money Coins,toys & baby products,Toys & Games,https://m.media-amazon.com/images/I/91XSf386gHL._AC_UL320_.jpg,https://www.amazon.in/Ratnas-Business-Monopoly-Board-Plastic/dp/B01IYXJAFU/ref=sr_1_5287?qid=1679219500&s=toys&sr=1-5287,4.2,672,,₹595
Aston Andia Pencil Pouch for Girls Double Layer Large Capacity Soft Pencil Case for Kids(Blue),toys & baby products,Toys & Games,https://m.media-amazon.com/images/I/61GyeoK5TKL._AC_UL320_.jpg,https://www.amazon.in/Pencil-Capacity-School-College-Supplies/dp/B09M86HKNG/ref=sr_1_5288?qid=1679219500&s=toys&sr=1-5288,3.3,19,₹199,₹999
Shopoflux® Swing for Kids | Baby Swing Hanging Indoor Outdoor | Kids Swing | Jhula for Baby | Baby Garden Swing | Jhula fo...,toys & baby products,Toys & Games,https://m.media-amazon.com/images/I/814aXFxZsKS._AC_UL320_.jpg,https://www.amazon.in/Shopoflux%C2%AE-Hanging-Indoor-Outdoor-Garden/dp/B093W7QFS2/ref=sr_1_5289?qid=1679219500&s=toys&sr=1-5289,4.3,99,₹797,"₹1,500"
"Toyshine Aquatic Sea Animals Toy Figure Playing Set for Kids (Pack of 7, 4 Animals, 3 Grass)",toys & baby products,Toys & Games,https://m.media-amazon.com/images/I/71iXQVULBNL._AC_UL320_.jpg,https://www.amazon.in/Toyshine-Aquatic-Animals-Figure-Playing/dp/B0BCWSJ5LY/ref=sr_1_5290?qid=1679219500&s=toys&sr=1-5290,4.6,6,₹599,₹999
"Storescent Reversible Octopus Soft Toys for Kids, Octopus Stuffed Animal Plush Soft Toys for Boys and Girls | Octopus Plus...",toys & baby products,Toys & Games,https://m.media-amazon.com/images/I/612U8xqYDlL._AC_UL320_.jpg,https://www.amazon.in/Storescent-Reversible-Octopus-Stuffed-Plushie/dp/B0BVZ1CQ9Y/ref=sr_1_5291?qid=1679219500&s=toys&sr=1-5291,4.0,49,₹187,₹999
"PATPAT® Poke-mon Binder, Big Size Cards Collector Album for 720 Poke-mon Cards Cartoon Prints Zipper Bag Trading Card Bind...",toys & baby products,Toys & Games,https://m.media-amazon.com/images/I/71I9N1UHqNL._AC_UL320_.jpg,https://www.amazon.in/PATPAT%C2%AE-Poke-mon-Collector-Cartoon-Collection/dp/B0BNX34JQN/ref=sr_1_5292?qid=1679219500&s=toys&sr=1-5292,4.6,3,"₹1,416","₹2,099"
"Toyshine Wooden ABC Animal Alphabet Wooden Puzzles Pairing Board Toy for Kids, Non-Toxic, Shape, Color, Letters, Learning ...",toys & baby products,Toys & Games,https://m.media-amazon.com/images/I/71KJwuOcliL._AC_UL320_.jpg,https://www.amazon.in/Toyshine-Alphabet-Non-Toxic-Learning-Educational/dp/B08MW5BMJ9/ref=sr_1_5293?qid=1679219500&s=toys&sr=1-5293,3.9,82,₹379,₹999
"Blink Toys Peppa Pig Family Set George, Daddy Pig, Mommy Pig Pretend Play Set for Kids",toys & baby products,Toys & Games,https://m.media-amazon.com/images/I/71Q2EeKiGxL._AC_UL320_.jpg,https://www.amazon.in/Blink-Peppa-Family-George-Pretend/dp/B0BT6NLK3V/ref=sr_1_5294?qid=1679219500&s=toys&sr=1-5294,5.0,1,₹268,₹599
"EKTA Jump Rocket Stomp Launcher and 3 Foam Tipped Rockets with Whistling Sound Outdoor Toy for Kids (Flies Upto 150ft, No...",toys & baby products,Toys & Games,https://m.media-amazon.com/images/I/71cNPLpGecL._AC_UL320_.jpg,https://www.amazon.in/Launcher-Rockets-Whistling-Battery-Outdoor/dp/B08GYNSPL9/ref=sr_1_5295?qid=1679219500&s=toys&sr=1-5295,4.1,300,₹580,₹840
Pikipo Stuffed Soft Ball with Rattle Sound,toys & baby products,Toys & Games,https://m.media-amazon.com/images/I/81kTc0r6StL._AC_UL320_.jpg,https://www.amazon.in/Pikipo-Stuffed-Rattle-Sound-Medium/dp/B08NDK8TGX/ref=sr_1_5296?qid=1679219500&s=toys&sr=1-5296,4.1,562,₹185,₹331
AFH Government of India Long Fabric ID tag Lanyard Key Chain - Blue,toys & baby products,Toys & Games,https://m.media-amazon.com/images/I/51uJYBdkO+L._AC_UL320_.jpg,https://www.amazon.in/AFH-Government-India-Fabric-Lanyard/dp/B09B5D7TQ3/ref=sr_1_5297?qid=1679219500&s=toys&sr=1-5297,4.3,168,₹249,₹599
"Jack Royal Friction Powered Toy Police Bike for 2 3 4 5 Year Old boy, 1 Pieces Friction Powered Kids Toddler Scooter Toy (...",toys & baby products,Toys & Games,https://m.media-amazon.com/images/I/31HsBzkg5aL._AC_UL320_.jpg,https://www.amazon.in/Jack-Royal-Friction-Powered-Toddler/dp/B0BJDCK43D/ref=sr_1_5298?qid=1679219500&s=toys&sr=1-5298,3.6,6,₹182,₹499
Storio Flash Cards for Kids Early Learning | Easy & Fun Way of Learning 1 Year to 6 Years Babies (Colors & Shapes),toys & baby products,Toys & Games,https://m.media-amazon.com/images/I/71LhOva6tcL._AC_UL320_.jpg,https://www.amazon.in/Storio-Learning-Babies-Colors-Shapes/dp/B0BP25ZYCX/ref=sr_1_5299?qid=1679219500&s=toys&sr=1-5299,4.6,71,,₹99
KPK's MART Big Sized Portable Suitcase Shape| Kids Pack of Kitchen Playset| Musical & Light Kitchen Set Toy for Kids with ...,toys & baby products,Toys & Games,https://m.media-amazon.com/images/I/41twR8-D3UL._AC_UL320_.jpg,https://www.amazon.in/KPKs-MART-Portable-Accessories-Multicolor/dp/B0BW6XCSXK/ref=sr_1_5300?qid=1679219500&s=toys&sr=1-5300,5.0,3,"₹1,799","₹7,999"
"Passion for Fashion Spiderman Dress for Boys and Girls Kids Set of 4 (Top,Bottom,Mask,Globes)",toys & baby products,Toys & Games,https://m.media-amazon.com/images/I/71iUrYs7xwL._AC_UL320_.jpg,https://www.amazon.in/Passion-Fashion-Spiderman-Bottom-Globes/dp/B09SXYXG8S/ref=sr_1_5301?qid=1679219500&s=toys&sr=1-5301,4.3,14,₹299,₹799
"Nerf Plastic Alpha Strike Fang Qs-4 Blaster, 4-Dart Blasting, Fire 4 Darts in A Row, 10 Darts, Multicolour",toys & baby products,Toys & Games,https://m.media-amazon.com/images/I/71vR6Y+kFeL._AC_UL320_.jpg,https://www.amazon.in/Hasbro-Alpha-Strike-Blaster-Darts/dp/B07SXDF6J9/ref=sr_1_5302?qid=1679219500&s=toys&sr=1-5302,4.2,364,₹490,₹499
"Symphony Surround-i High Speed Bladeless Technology Tower Fan for Home With Touchscreen Control Panel, Remote, and Swivel ...",toys & baby products,Toys & Games,https://m.media-amazon.com/images/I/51-8a20r7qL._AC_UL320_.jpg,https://www.amazon.in/Symphony-Surround-i-Bladeless-Technology-Touchscreen/dp/B0B6J9PF91/ref=sr_1_5303?qid=1679219500&s=toys&sr=1-5303,4.2,95,"₹7,890","₹7,999"
Party Propz® 12 Pcs/Lot 5mm x 10M Balloon Curling Ribbon Roll DIY Gifts Crafts Foil Curling for Wedding Birthday Gift Wrap...,toys & baby products,Toys & Games,https://m.media-amazon.com/images/I/71sK7cltqUS._AC_UL320_.jpg,https://www.amazon.in/Party-Balloon-Birthday-Wrapping-Decoration/dp/B07DKQC8X2/ref=sr_1_5304?qid=1679219500&s=toys&sr=1-5304,3.9,214,₹199,₹599
"GRAPHENE® Jumping and Walking Rabbit/Bunny, Sweet Sounds and Blinks Colored Lights, Move Tail and Ears Like Real Rabbits, ...",toys & baby products,Toys & Games,https://m.media-amazon.com/images/W/IMAGERENDERING_521856-T2/images/I/41gFnFLjqlL._AC_UL320_.jpg,https://www.amazon.in/GRAPHENE%C2%AE-Jumping-Walking-Colored-Birthday/dp/B0BKT8H6G3/ref=sr_1_6001?qid=1679219509&s=toys&sr=1-6001,3.7,7,₹599,"₹1,499"
"FunBlast Building Blocks for Kids - 46 Pcs Including Wheels, Bag Packing, Best Gift Toy, Multicolour (Set of 46 Pieces) (4...",toys & baby products,Toys & Games,https://m.media-amazon.com/images/W/IMAGERENDERING_521856-T2/images/I/81VYiofFFyL._AC_UL320_.jpg,https://www.amazon.in/FunBlast-Building-Blocks-Kids-Multicolour/dp/B08P1KS269/ref=sr_1_6002?qid=1679219509&s=toys&sr=1-6002,3.9,"12,988",₹339,₹699
"Skillmatics Outdoor Game - Strike 7, Strategic Game of Knocking Down & Building Up, Family Friendly Game for Ages 6 and Up",toys & baby products,Toys & Games,https://m.media-amazon.com/images/W/IMAGERENDERING_521856-T2/images/I/71JJvJ5rMjL._AC_UL320_.jpg,https://www.amazon.in/Skillmatics-Outdoor-Game-Strategic-Knocking/dp/B0BRD2NN5V/ref=sr_1_6003?qid=1679219509&s=toys&sr=1-6003,5.0,2,₹664,₹699
BLUE TEA - Organic Blue Matcha - Butterfly Pea Powder - 50g - 100 Cups | Superfood | Blue Latte | Caffeine Free,toys & baby products,Toys & Games,https://m.media-amazon.com/images/W/IMAGERENDERING_521856-T2/images/I/61QI3FYkRzL._AC_UL320_.jpg,https://www.amazon.in/BLUE-TEA-Butterfly-Superfood-Caffeine/dp/B08WKC8PG1/ref=sr_1_6004?qid=1679219509&s=toys&sr=1-6004,4.0,32,₹494,₹699
MONKEYTAIL Invisible Ink Magic Pen (12 Pieces) with UV-Light Birthday Return Gifts for All Age Group Bulk Buy Abracadabra ...,toys & baby products,Toys & Games,https://m.media-amazon.com/images/W/IMAGERENDERING_521856-T2/images/I/7163TXaGbSL._AC_UL320_.jpg,https://www.amazon.in/MONKEYTAIL-Invisible-UV-Light-Abracadabra-Collection/dp/B08TX617KM/ref=sr_1_6005?qid=1679219509&s=toys&sr=1-6005,3.6,126,₹429,₹999
"Super Hero Adventures Playskool Heroes Marvel Mega Mighties Black Panther Collectible Action Figure, Toys for Kids Ages 3 ...",toys & baby products,Toys & Games,https://m.media-amazon.com/images/W/IMAGERENDERING_521856-T2/images/I/71JQKqW4RdL._AC_UL320_.jpg,https://www.amazon.in/Super-Hero-Adventures-Mighties-Collectible/dp/B07N9J8VB6/ref=sr_1_6006?qid=1679219509&s=toys&sr=1-6006,4.5,"1,163",₹849,"₹1,299"
Hetkrishi Real Looking Rubber Lizard Toy (Pack of 3) Multicolor,toys & baby products,Toys & Games,https://m.media-amazon.com/images/W/IMAGERENDERING_521856-T2/images/I/512fq4M4j6L._AC_UL320_.jpg,https://www.amazon.in/Hetkrishi-Real-Looking-Rubber-Lizard/dp/B08R931TWV/ref=sr_1_6007?qid=1679219509&s=toys&sr=1-6007,4.0,184,₹107,₹499
Taufa Villa Unicorn Stationery Set for Girls Unicorn Return Gifts for Birthday Parties for Kids Girl Pencil Box with All S...,toys & baby products,Toys & Games,https://m.media-amazon.com/images/W/IMAGERENDERING_521856-T2/images/I/61nBXHaMX9L._AC_UL320_.jpg,https://www.amazon.in/Taufa-Villa-Stationery-Birthday-Stationary/dp/B0BTPV2XJM/ref=sr_1_6008?qid=1679219509&s=toys&sr=1-6008,5.0,1,₹199,₹399
Globular Ready to Attack Pup Buddies Power Petral Hero Rescue Dog Team Mission Toy Badge Ryder Tracker Robot Everest Toy P...,toys & baby products,Toys & Games,https://m.media-amazon.com/images/W/IMAGERENDERING_521856-T2/images/I/61mBiNcwFOL._AC_UL320_.jpg,https://www.amazon.in/Globular-Buddies-Mission-Tracker-Everest/dp/B0BJ71PWJV/ref=sr_1_6009?qid=1679219509&s=toys&sr=1-6009,3.6,21,"₹1,549","₹1,999"
"wolpin 1 Pc Large Capacity Pencil Bag, Pencil Pouch with Zipper Closure Portable Makeup Pouch, PU Case Cute Stationery Bag...",toys & baby products,Toys & Games,https://m.media-amazon.com/images/W/IMAGERENDERING_521856-T2/images/I/617o+g3ML2L._AC_UL320_.jpg,https://www.amazon.in/wolpin-Capacity-Portable-Stationery-Students/dp/B0BS3QC1ZW/ref=sr_1_6010?qid=1679219509&s=toys&sr=1-6010,,,₹189,₹999
"Home Delivered Folding Mini Children Toy Multicolor Binoculars (10 mm, Assorted Colors)",toys & baby products,Toys & Games,https://m.media-amazon.com/images/W/IMAGERENDERING_521856-T2/images/I/410CHfM07gL._AC_UL320_.jpg,https://www.amazon.in/Home-Delivered-Children-Multicolor-Binoculars/dp/B083SBFQBD/ref=sr_1_6011?qid=1679219509&s=toys&sr=1-6011,3.5,43,₹99,₹199
Zest 4 Toyz Musical Baby Crawling Early Learning Plastic Toy with 3D Lights & Sound for Babies (Assorted),toys & baby products,Toys & Games,https://m.media-amazon.com/images/W/IMAGERENDERING_521856-T2/images/I/613wET5+GqL._AC_UL320_.jpg,https://www.amazon.in/Zest-Toyz-Musical-Infant-Assorted/dp/B07WPL7SVC/ref=sr_1_6012?qid=1679219509&s=toys&sr=1-6012,3.7,323,₹479,₹999
Royal Enfield Classic 350 Scale Model- Halcyon Forest Green,toys & baby products,Toys & Games,https://m.media-amazon.com/images/W/IMAGERENDERING_521856-T2/images/I/71qLr9n+9wL._AC_UL320_.jpg,https://www.amazon.in/Royal-Enfield-Plastic-Halcyon-Forest/dp/B09RF3RH6X/ref=sr_1_6013?qid=1679219509&s=toys&sr=1-6013,3.8,17,,"₹1,490"
Giggles - Nico The Giraffe,toys & baby products,Toys & Games,https://m.media-amazon.com/images/W/IMAGERENDERING_521856-T2/images/I/61385WYWg8L._AC_UL320_.jpg,https://www.amazon.in/Giggles-Nico-The-Giraffe-Yellow/dp/B01DW4V64Y/ref=sr_1_6014_mod_primary_new?qid=1679219509&s=toys&sbo=RZvfv%2F%2FHxDF%2BO5021pAnSA%3D%3D&sr=1-6014,4.4,725,₹892,₹999
Cubelelo Drift 6x6 Stickerless Speed Cube Magic Puzzle for Kids & Adults Speedy Stress Buster Brainstorming Cube,toys & baby products,Toys & Games,https://m.media-amazon.com/images/W/IMAGERENDERING_521856-T2/images/I/41cfkJzhl7L._AC_UL320_.jpg,https://www.amazon.in/Cubelelo-Drift-Stickerless-Speed-Puzzle/dp/B09HH5R69B/ref=sr_1_6015?qid=1679219509&s=toys&sr=1-6015,4.2,635,₹999,"₹1,499"
Party Propz Underwater Balloons Birthday Decorations Items For Kids-66Pcswith Marine Animals Starfish Fish Balloon Banner ...,toys & baby products,Toys & Games,https://m.media-amazon.com/images/W/IMAGERENDERING_521856-T2/images/I/714jv1-eJnL._AC_UL320_.jpg,https://www.amazon.in/Party-Propz-Underwater-Decorations-Kids-67Pcswith/dp/B08BTXMXT1/ref=sr_1_6016?qid=1679219509&s=toys&sr=1-6016,4.4,125,₹901,"₹1,199"
Nintods Squeeze Ball - Rattle + Teether + Ball. Ergonomic Ball for Babies and Toddlers. Designed by Doctors,toys & baby products,Toys & Games,https://m.media-amazon.com/images/W/IMAGERENDERING_521856-T2/images/I/61Xy9BgRJ2L._AC_UL320_.jpg,https://www.amazon.in/Nintods-Squeeze-Ball-Ergonomic-Toddlers/dp/B09CV4ZD74/ref=sr_1_6017?qid=1679219509&s=toys&sr=1-6017,3.9,7,"₹1,050","₹1,250"
"PLATONIC HUB Super Soft Combo of 6 Stuffed Toys for Kids, Balloon Teddy, Appu Elephant, Penguin, Unicorn, Pikachu, Rabbit",toys & baby products,Toys & Games,https://m.media-amazon.com/images/W/IMAGERENDERING_521856-T2/images/I/410q9E0SsWL._AC_UL320_.jpg,https://www.amazon.in/PLATONIC-HUB-Stuffed-Balloon-Elephant/dp/B09X1HC2RD/ref=sr_1_6018?qid=1679219509&s=toys&sr=1-6018,3.6,56,₹678,"₹2,499"
"HASTHIP® Kazoo Musical Instrument with 10 Pcs Kazoo Flute Diaphragms, Mini Kazoo for Kids/Adults, Aluminum Alloy Kazoo Flu...",toys & baby products,Toys & Games,https://m.media-amazon.com/images/W/IMAGERENDERING_521856-T2/images/I/61fAJ70SXYL._AC_UL320_.jpg,https://www.amazon.in/HASTHIP%C2%AE-Instrument-Diaphragms-Aluminum-Instruments/dp/B0BRMKXVR9/ref=sr_1_6019?qid=1679219509&s=toys&sr=1-6019,Get,Only 2 left in stock.,₹395,₹599
SDM HANDICRAFT Wooden Square Money Bank| Coin Box | Gullak | Money Bank for Kids & Adults | Wooden Gullak | Saving Boxes,toys & baby products,Toys & Games,https://m.media-amazon.com/images/W/IMAGERENDERING_521856-T2/images/I/71h7tsheteL._AC_UL320_.jpg,https://www.amazon.in/SDM-HANDICRAFT-Wooden-Coin-Box/dp/B0BVM33NX8/ref=sr_1_6020?qid=1679219509&s=toys&sr=1-6020,5.0,1,₹299,₹899
"TOYSM Bus Toy Imported Die-Cast Double Decker Metal Bus 7.5 inch Luxury Bus 4 Wheel with 2 Openable Doors & Light, Music (...",toys & baby products,Toys & Games,https://m.media-amazon.com/images/W/IMAGERENDERING_521856-T2/images/I/51JaH70USuL._AC_UL320_.jpg,https://www.amazon.in/TOYSM-Die-Cast-Double-Decker-Openable/dp/B09GN7QWRS/ref=sr_1_6021?qid=1679219509&s=toys&sr=1-6021,4.2,3,₹944,"₹1,399"
"Rozi Decoration Latex Party Balloons HD Metallic For Birthday/Anniversary/Baby Shower Multicolor, Pack Of 50 Piece",toys & baby products,Toys & Games,https://m.media-amazon.com/images/W/IMAGERENDERING_521856-T2/images/I/51+p789yOVL._AC_UL320_.jpg,https://www.amazon.in/decoration-balloons-metallic-anniversary-hd50-multi/dp/B08FXNG3V9/ref=sr_1_6022?qid=1679219509&s=toys&sr=1-6022,3.8,"2,243",₹189,₹250
"Skillmatics Educational Game - I Can Count, Reusable Activity Mats with 2 Dry Erase Markers, Gifts for Ages 3 to 6",toys & baby products,Toys & Games,https://m.media-amazon.com/images/W/IMAGERENDERING_521856-T2/images/I/81jh983ZUML._AC_UL320_.jpg,https://www.amazon.in/Skillmatics-Reusable-Activity-Educational-Marker/dp/B08WHZNRJ5/ref=sr_1_6023?qid=1679219509&s=toys&sr=1-6023,4.3,335,₹664,₹699
"Toys uncle Diecast Aeroplane Scale Model, 16 cm: (A320 Indigo)",toys & baby products,Toys & Games,https://m.media-amazon.com/images/W/IMAGERENDERING_521856-T2/images/I/31sWMNv90SL._AC_UL320_.jpg,https://www.amazon.in/Toys-Uncle-Diecast-Aeroplane-Scale/dp/B08NCTN2VJ/ref=sr_1_6024?qid=1679219509&s=toys&sr=1-6024,3.9,160,"₹1,499","₹1,999"
Crystal Jupiter Industries Inflatable Vinyl Ball for Children with Inflating Pin (Multicolor),toys & baby products,Toys & Games,https://m.media-amazon.com/images/I/61JMyfP6gYL._AC_UL320_.jpg,https://www.amazon.in/Crystal-Designer-Inflatable-Swimming-Inflating/dp/B07Y9RLLVR/ref=sr_1_6193?qid=1679219512&s=toys&sr=1-6193,4.0,236,₹273,₹999
VEROX Waterproof IP68 Submersible Aquarium Lights LED 16 Colors Remote Controlled Pool Fish Tank Light 3XAAA Battery Opera...,toys & baby products,Toys & Games,https://m.media-amazon.com/images/I/81O8vMcl06L._AC_UL320_.jpg,https://www.amazon.in/VEROX-Waterproof-Submersible-Aquarium-Controlled/dp/B0BFHS4GJ5/ref=sr_1_6194?qid=1679219512&s=toys&sr=1-6194,3.0,18,₹699,"₹1,499"
