name,main_category,sub_category,image,link,ratings,no_of_ratings,discount_price,actual_price
"RATNA'S Picnic Board Family Game Big Fun, Pack of 1, Multicolor",toys & baby products,Toys & Games,https://m.media-amazon.com/images/I/71opwhSalEL._AC_UL320_.jpg,https://www.amazon.in/Ratnas-Picnic-Big-Board-Game/dp/B0759K4D4W/ref=sr_1_1768?qid=1679219452&s=toys&sr=1-1768,4.5,464,₹280,₹415
Toy Creations A V Creation 4-String Kids Guitar | Musical Instrument for Boys Girls | Learning Toy Guitar for Kids | (17 I...,toys & baby products,Toys & Games,https://m.media-amazon.com/images/I/413apY-YY0L._AC_UL320_.jpg,https://www.amazon.in/Toy-Creations-Creation-4-String-Instrument/dp/B0BD92RXDB/ref=sr_1_1769?qid=1679219452&s=toys&sr=1-1769,3.6,33,₹459,"₹1,599"
Panda's Box Mantras Chanting Musical Baby Ganesha Plush Toy for Getting Kids Started on Indian Mythology and Culture | Bes...,toys & baby products,Toys & Games,https://m.media-amazon.com/images/I/81LDnRZrjXL._AC_UL320_.jpg,https://www.amazon.in/Pandas-Box-Chanting-Musical-Ganesha/dp/B09VDD22XD/ref=sr_1_1770?qid=1679219452&s=toys&sr=1-1770,4.3,58,₹999,"₹1,499"
DZert Kids School Bag Soft Plush Backpacks Cartoon Boys Girls Baby (2-5 Years),toys & baby products,Toys & Games,https://m.media-amazon.com/images/I/61OsBhHCYkL._AC_UL320_.jpg,https://www.amazon.in/DZert-Panda-School-Backpacks-Cartoon/dp/B08M6H677Y/ref=sr_1_1771?qid=1679219452&s=toys&sr=1-1771,3.7,"11,137",₹239,₹699
"FIGMENT Dancing Cactus Talking Toy, Cactus Plush Toy, Wriggle & Singing Recording Repeat What You Say Funny Education Toys...",toys & baby products,Toys & Games,https://m.media-amazon.com/images/I/71Cr+OlWx7L._AC_UL320_.jpg,https://www.amazon.in/FIGMENT-Recording-Education-Children-Decorate/dp/B0BTYVYWVC/ref=sr_1_1772?qid=1679219452&s=toys&sr=1-1772,5.0,99,₹699,₹999
"HUG 'n' FEEL SOFT TOYS Teddy Bear 4 feet, Soft Toy, Teddy Bear 4 feet for Girls, Soft Toys for Kids, Birthday Gift for Gir...",toys & baby products,Toys & Games,https://m.media-amazon.com/images/I/61g5n5y1awL._AC_UL320_.jpg,https://www.amazon.in/Extra-Lovable-Huggable-Girlfriend-Birthday/dp/B07CXK7HHZ/ref=sr_1_1773?qid=1679219452&s=toys&sr=1-1773,4.1,"28,065",₹995,"₹1,999"
"SEEDO Remote Control Battery Operated 2 Channel Light Blaster Racing Car with Colorful LED Lights, 1:18 Scale Fast RC Vehi...",toys & baby products,Toys & Games,https://m.media-amazon.com/images/I/81oXP04zqnL._AC_UL320_.jpg,https://www.amazon.in/SEEDO-Control-Battery-Operated-Colorful/dp/B0BBTPTVXW/ref=sr_1_1774?qid=1679219452&s=toys&sr=1-1774,4.5,2,₹337,₹449
D ETERNAL Moyu Mofang Jiaoshi 2x2x2 High Speed Stickerless Magic Cube,toys & baby products,Toys & Games,https://m.media-amazon.com/images/I/51KfntAzKuL._AC_UL320_.jpg,https://www.amazon.in/ETERNAL-Mofang-Jiaoshi-Stickerless-Classroom/dp/B07NCNTSRY/ref=sr_1_1775?qid=1679219452&s=toys&sr=1-1775,4.3,"2,352",₹249,₹799
"Prestige Magic Glass Top Gas Stove GTMC 03, Black, Tri Pin Burners, Manual",toys & baby products,Toys & Games,https://m.media-amazon.com/images/I/71Co5dFWiBL._AC_UL320_.jpg,https://www.amazon.in/Prestige-Magic-Glass-Top-GTMC/dp/B07NCWTK5J/ref=sr_1_1776?qid=1679219452&s=toys&sr=1-1776,3.9,"10,818","₹4,379","₹7,845"
"JoyRide Learn-to-Ride Trike on 3 Wheels with Safety Harness, Non-Slip Pedal,Storage Basket and Removable Parent Handle Green",toys & baby products,Toys & Games,https://m.media-amazon.com/images/W/IMAGERENDERING_521856-T2/images/I/41oKsnv2JQL._AC_UL320_.jpg,https://www.amazon.in/JoyRide-Harness-Non-Slip-Storage-Removable/dp/B08Z43PBNX/ref=sr_1_2521?qid=1679219462&s=toys&sr=1-2521,3.9,"2,323","₹2,326","₹4,299"
"Twizzle 3 In 1 Baby Horse Rider For Kids | Baby Birthday Gift For Baby 1 Year To 5 Year |Horse For Baby , Rocker, Swing - ...",toys & baby products,Toys & Games,https://m.media-amazon.com/images/W/IMAGERENDERING_521856-T2/images/I/81mAKoGiRXL._AC_UL320_.jpg,https://www.amazon.in/Twizzle-Baby-Horse-Rider-Birthday/dp/B09B41KPSK/ref=sr_1_2522?qid=1679219462&s=toys&sr=1-2522,3.9,908,"₹1,899","₹2,499"
"StonKraft 6"" Inches Wooden Labyrinth Board Game Ball in a Maze Puzzle Toys - Indoor Puzzle Game Gifts for Young Adults",toys & baby products,Toys & Games,https://m.media-amazon.com/images/W/IMAGERENDERING_521856-T2/images/I/71T7jVDDciL._AC_UL320_.jpg,https://www.amazon.in/StonKraft-Handcrafted-Wooden-Labyrinth-Puzzle/dp/B07DCSYYH7/ref=sr_1_2523?qid=1679219462&s=toys&sr=1-2523,4.3,609,₹251,"₹1,995"
My Lil Princess Girls' Dress,toys & baby products,Toys & Games,https://m.media-amazon.com/images/W/IMAGERENDERING_521856-T2/images/I/6191IpKc+zL._AC_UL320_.jpg,https://www.amazon.in/My-Lil-Princess-Dresses-Dress_24_5-6/dp/B0B2Q28XQY/ref=sr_1_2524?qid=1679219462&s=toys&sr=1-2524,4.0,627,₹999,"₹3,000"
"PATPAT® Baby Bath Toys, 3Pcs Sensory Learning Toys for Toddlers1-3, Baby Activity Toys, Baby Bathtub Bath Toys, Montessori...",toys & baby products,Toys & Games,https://m.media-amazon.com/images/W/IMAGERENDERING_521856-T2/images/I/61I3iBA8zWL._AC_UL320_.jpg,https://www.amazon.in/Learning-Toddlers1-3-Activity-Montessori-Educational/dp/B0BLBB6GZY/ref=sr_1_2525?qid=1679219462&s=toys&sr=1-2525,3.9,51,₹895,"₹1,259"
Leader Buddy Kids Cycle 14T with Training Wheels (SEMI-Assembled) for Boys and Girls Ideal for Age Group 2-5 Years | Fram...,toys & baby products,Toys & Games,https://m.media-amazon.com/images/W/IMAGERENDERING_521856-T2/images/I/81LhpPSiSPL._AC_UL320_.jpg,https://www.amazon.in/Leader-Plastic-Tubeless-Training-SEMI-Assembled/dp/B08WHDFK5V/ref=sr_1_2526?qid=1679219462&s=toys&sr=1-2526,3.6,89,"₹3,099","₹5,500"
"Webby Big Size Funny Unicorn Stuffed Animal Plush Toy, 100CM, Pink",toys & baby products,Toys & Games,https://m.media-amazon.com/images/W/IMAGERENDERING_521856-T2/images/I/51iI7Kq47xL._AC_UL320_.jpg,https://www.amazon.in/Webby-Funny-Unicorn-Stuffed-Animal/dp/B082GGZHZS/ref=sr_1_2527?qid=1679219462&s=toys&sr=1-2527,4.5,"2,298","₹1,289","₹1,999"
"Dash Monkey 3 in 1 Ride on for Kids, Baby car, Ride on for Kids 2 Years+, Push Car, Musical Ride on car for Kids with Pare...",toys & baby products,Toys & Games,https://m.media-amazon.com/images/W/IMAGERENDERING_521856-T2/images/I/61jrFt+HrzL._AC_UL320_.jpg,https://www.amazon.in/Dash-Musical-Parental-Protective-Capacity/dp/B09XXTBKMH/ref=sr_1_2528?qid=1679219462&s=toys&sr=1-2528,3.5,211,"₹1,799","₹2,240"
"Funskool Games - Travel Strike 4, Classic Board Game, Get 4 in a Row, Disc Dropping Game, Portable Classic Travel Games, 2...",toys & baby products,Toys & Games,https://m.media-amazon.com/images/W/IMAGERENDERING_521856-T2/images/I/71DqEG6ZvxL._AC_UL320_.jpg,https://www.amazon.in/Funskool-Travel-Strike-Strategic-Multicolor/dp/B08N7HYWPH/ref=sr_1_2529?qid=1679219462&s=toys&sr=1-2529,3.9,159,,₹249
Zaveri Pearls,toys & baby products,Toys & Games,https://m.media-amazon.com/images/W/IMAGERENDERING_521856-T2/images/I/61GRakweLgL._AC_UL320_.jpg,https://www.amazon.in/Zaveri-Pearls-Dangler-Earrings-ZPFK7383/dp/B07NJHP3GC/ref=sr_1_2530?qid=1679219462&s=toys&sr=1-2530,3.9,"4,594",₹435,"₹1,997"
"Chocozone Battery Operated 81pcs Rotating Building Blocks with Gears for STEM Learning, Educational Building Blocks Toys f...",toys & baby products,Toys & Games,https://m.media-amazon.com/images/W/IMAGERENDERING_521856-T2/images/I/711zqekH2eL._AC_UL320_.jpg,https://www.amazon.in/Chocozone-Operated-Rotating-Building-Educational/dp/B07VX8WKXK/ref=sr_1_2531?qid=1679219462&s=toys&sr=1-2531,4.0,"1,147",₹599,"₹1,299"
"Vector X Street Soccer Rubber Moulded Football, Size 5",toys & baby products,Toys & Games,https://m.media-amazon.com/images/W/IMAGERENDERING_521856-T2/images/I/71CDEX2y7jL._AC_UL320_.jpg,https://www.amazon.in/Vector-Street-Soccer-Moulded-Football/dp/B01566VTZ2/ref=sr_1_2532?qid=1679219462&s=toys&sr=1-2532,3.9,"4,306",₹419,₹529
Party Propz Welcome Home Baby 6 Pieces Swirls / Welcome Home Baby Party Decoration / Welcome Home Baby Party Props / Welco...,toys & baby products,Toys & Games,https://m.media-amazon.com/images/W/IMAGERENDERING_521856-T2/images/I/81CFzlODVaL._AC_UL320_.jpg,https://www.amazon.in/Party-Propz-Welcome-Swirls-Multicolour/dp/B07BBRDP1N/ref=sr_1_2533?qid=1679219462&s=toys&sr=1-2533,4.0,413,₹219,₹903
Zest 4 Toyz Holi Water Gun High Pressure Pichkari Toy with Back Holding Tank with Holi Combo of 1 Pkt Holi Color & 100 Wat...,toys & baby products,Toys & Games,https://m.media-amazon.com/images/W/IMAGERENDERING_521856-T2/images/I/81nIhZmu3KL._AC_UL320_.jpg,https://www.amazon.in/Zest-Toyz-Pressure-Pichkari-Balloons/dp/B0BTHWRWBR/ref=sr_1_2534?qid=1679219462&s=toys&sr=1-2534,3.7,87,₹664,"₹1,299"
"AQBAH Pencil Pouch for Girls and Boys, 3 Compartment Pen case for Collage Schools, Pouch for Kids with Three Zippers for O...",toys & baby products,Toys & Games,https://m.media-amazon.com/images/W/IMAGERENDERING_521856-T2/images/I/71EnmhtUrVL._AC_UL320_.jpg,https://www.amazon.in/AQBAH-Pouch-Compartment-Multi-Purpose-Blue/dp/B0BNXLV8SF/ref=sr_1_2535?qid=1679219462&s=toys&sr=1-2535,3.9,5,₹175,₹499
Happy Kids Portable Walkie Talkie,toys & baby products,Toys & Games,https://m.media-amazon.com/images/W/IMAGERENDERING_521856-T2/images/I/51wLLQNq2ZL._AC_UL320_.jpg,https://www.amazon.in/Happy-Kids-Portable-Walkie-Talkie/dp/B01LWQAZ5M/ref=sr_1_2536?qid=1679219462&s=toys&sr=1-2536,3.2,817,₹499,₹999
"MEHSHAK 8-Hole Electric Bubbles Gun for Toddlers Toys, New Gatling Bubble Machine Outdoor Toys for Boys and Girls, Multico...",toys & baby products,Toys & Games,https://m.media-amazon.com/images/W/IMAGERENDERING_521856-T2/images/I/71MUiKPFdpL._AC_UL320_.jpg,https://www.amazon.in/MEHSHAK-Electric-Bubbles-Gun-Multicolour/dp/B0BX76B78X/ref=sr_1_2537?qid=1679219462&s=toys&sr=1-2537,3.5,3,₹165,₹699
"FunBlast Building Blocks for Kids, (72 Pieces Blocks) House Building Blocks with Windows, Block Game for Kids (Multicolor)...",toys & baby products,Toys & Games,https://m.media-amazon.com/images/W/IMAGERENDERING_521856-T2/images/I/81rauMDAQ0L._AC_UL320_.jpg,https://www.amazon.in/FunBlast-Building-Blocks-Windows-Multicolor/dp/B0917J45YS/ref=sr_1_2538?qid=1679219462&s=toys&sr=1-2538,4.0,"1,565",₹366,₹999
"Tec Tavakkal® Wave Board, Skate Board 31 x 8 Inch with Carry Bag LED Flash Colourful Lights on Wheels Upto 100 KG Multi Co...",toys & baby products,Toys & Games,https://m.media-amazon.com/images/W/IMAGERENDERING_521856-T2/images/I/51ElmImA3PL._AC_UL320_.jpg,https://www.amazon.in/Tavakkal-Commerce-Colourful-Lights-Assorted/dp/B07LFH6XMF/ref=sr_1_2539?qid=1679219462&s=toys&sr=1-2539,4.1,513,"₹1,594","₹3,000"
"Toyshine Unbreakable Automobile Car Pack of 4 Friction Powered Cars Construction Push and Go Car Tractor, Bulldozer, Cemen...",toys & baby products,Toys & Games,https://m.media-amazon.com/images/W/IMAGERENDERING_521856-T2/images/I/71TexYoyyQL._AC_UL320_.jpg,https://www.amazon.in/Toyshine-Unbreakable-Automobile-Construction-Bulldozer/dp/B0B8VP7F7X/ref=sr_1_2540?qid=1679219462&s=toys&sr=1-2540,4.6,"11,427",₹810,"₹1,499"
"Giggles - Sniffy The Dog , Pull along toy , Head bobs,Tail wags,Encourages Walking , 12 months & above , Infant and Presch...",toys & baby products,Toys & Games,https://m.media-amazon.com/images/W/IMAGERENDERING_521856-T2/images/I/71eQur42tIL._AC_UL320_.jpg,https://www.amazon.in/Giggles-Sniffy-The-Dog/dp/B07PYXCSQV/ref=sr_1_2541?qid=1679219462&s=toys&sr=1-2541,4.0,515,,₹499
EL FIGO Little Soft Feel Smiling Teddy Boy in Printed Dress,toys & baby products,Toys & Games,https://m.media-amazon.com/images/W/IMAGERENDERING_521856-T2/images/I/71rmoqT9JeL._AC_UL320_.jpg,https://www.amazon.in/EL-FIGO-Teddy-Small-Multicolor/dp/B08ZKGC49Q/ref=sr_1_2542?qid=1679219462&s=toys&sr=1-2542,3.9,110,₹255,₹499
BKDT Marketing Classic Tic Tac Toe Toy Game Zero and Cross Game Wooden Tic Tac Toe Game for Kid,toys & baby products,Toys & Games,https://m.media-amazon.com/images/W/IMAGERENDERING_521856-T2/images/I/31oHI+JbvfL._AC_UL320_.jpg,https://www.amazon.in/BKDT-Marketing-Classic-Cross-Wooden/dp/B09FB3Y6HS/ref=sr_1_2543?qid=1679219462&s=toys&sr=1-2543,4.0,194,₹221,₹599
"Party Propz Dinosaur Foil Balloon Set 8pcs for Birthday Parties, Dinosaurs and Jungle Style Parties. Multicolor",toys & baby products,Toys & Games,https://m.media-amazon.com/images/W/IMAGERENDERING_521856-T2/images/I/812smmhBLVL._AC_UL320_.jpg,https://www.amazon.in/Party-Propz-Dinosaur-Birthday-Dinosaurs/dp/B08N63GS5N/ref=sr_1_2544?qid=1679219462&s=toys&sr=1-2544,4.5,135,₹522,"₹1,199"
SILENCIO Silver Appearing Cane Metal Steel Professional Trick Prop Stretchable Extendable Stick Pocket Staff Magic Wand St...,toys & baby products,Toys & Games,https://m.media-amazon.com/images/W/IMAGERENDERING_521856-T1/images/I/41a2WWEMNFL._AC_UL320_.jpg,https://www.amazon.in/SILENCIO-Appearing-Professional-Stretchable-Extendable/dp/B0BXF393M4/ref=sr_1_2569?qid=1679219463&s=toys&sr=1-2569,4.5,2,₹299,₹399
M Cart Track penguin toy music penguin track toy Slide Toys Climb Stairs Toy Railcar | Educational Climbing Stairs Toys wi...,toys & baby products,Toys & Games,https://m.media-amazon.com/images/W/IMAGERENDERING_521856-T1/images/I/61P2EE+XefL._AC_UL320_.jpg,https://www.amazon.in/Cart-Educational-Climbing-Children-included/dp/B0BW3KXJT4/ref=sr_1_2570?qid=1679219463&s=toys&sr=1-2570,4.4,4,₹729,₹999
"Skillofun Elephant Sewing Toy , Multicolour",toys & baby products,Toys & Games,https://m.media-amazon.com/images/W/IMAGERENDERING_521856-T1/images/I/81ViZf4IQOL._AC_UL320_.jpg,https://www.amazon.in/Skillofun-Wooden-Sewing-Elephant-Multi/dp/B009GCTH1Q/ref=sr_1_2571?qid=1679219463&s=toys&sr=1-2571,4.1,"1,391",₹237,₹245
"D ETERNAL Dancing Talking Cactus Toy for Baby Kids Soft Plush Talk Back Toy, Can Sing Record and Repeats What You Say and ...",toys & baby products,Toys & Games,https://m.media-amazon.com/images/W/IMAGERENDERING_521856-T1/images/I/71WRz2DDiDL._AC_UL320_.jpg,https://www.amazon.in/ETERNAL-Dancing-Talking-Cactus-Repeats/dp/B09Z7V7PQ1/ref=sr_1_2572?qid=1679219463&s=toys&sr=1-2572,3.5,17,₹649,"₹1,499"
Royals Kids Birthday Return Gifts (Stationary Set Pack of 12) Multicolor,toys & baby products,Toys & Games,https://m.media-amazon.com/images/W/IMAGERENDERING_521856-T1/images/I/81928bADJIL._AC_UL320_.jpg,https://www.amazon.in/Royals-Birthday-Return-Gifts-Stationary/dp/B0791B7YVC/ref=sr_1_2573?qid=1679219463&s=toys&sr=1-2573,3.8,592,₹399,₹599
Melon transperant Slime streachy Non Toxic for Kids,toys & baby products,Toys & Games,https://m.media-amazon.com/images/W/IMAGERENDERING_521856-T1/images/I/71Os09FbQPL._AC_UL320_.jpg,https://www.amazon.in/Melon-transperant-Slime-streachy-Toxic/dp/B0BNG6Y6VT/ref=sr_1_2574?qid=1679219463&s=toys&sr=1-2574,2.9,16,₹225,₹499
"Festiko® 1/2 Way to One Cake Topper, 6 Months Cake Topper for Baby's Half Year Old Birthday Party, Six Months Old Party De...",toys & baby products,Toys & Games,https://m.media-amazon.com/images/W/IMAGERENDERING_521856-T1/images/I/71mAHJL6+tL._AC_UL320_.jpg,https://www.amazon.in/Festiko%C2%AE1-Topper-Months-Birthday-Decorations/dp/B09K5JPPHC/ref=sr_1_2575?qid=1679219463&s=toys&sr=1-2575,3.7,142,₹199,₹398
Negi Castle Beach Set. Multicolor,toys & baby products,Toys & Games,https://m.media-amazon.com/images/W/IMAGERENDERING_521856-T1/images/I/81I8VZh5y2L._AC_UL320_.jpg,https://www.amazon.in/Negi-Castle-Beach-Set/dp/B00N7K3ABQ/ref=sr_1_2576?qid=1679219463&s=toys&sr=1-2576,4.2,773,₹395,₹440
Cubelelo Drift 3x3 Stickerless Magic Speed Cube Puzzle for Kids & Adults Magic Speedy Stress Buster Brainstorming Puzzle C...,toys & baby products,Toys & Games,https://m.media-amazon.com/images/W/IMAGERENDERING_521856-T1/images/I/518rnJvD3LL._AC_UL320_.jpg,https://www.amazon.in/Cubelelo-Stickerless-Puzzle-Adults-Brainstorming/dp/B0B4S41S6P/ref=sr_1_2577?qid=1679219463&s=toys&sr=1-2577,4.3,"1,361",₹339,₹599
Asian Hobby Crafts Wooden Embroidery Hoop Ring Frame (5 Pieces),toys & baby products,Toys & Games,https://m.media-amazon.com/images/W/IMAGERENDERING_521856-T1/images/I/71X5gtVfPbL._AC_UL320_.jpg,https://www.amazon.in/Asian-Hobby-Crafts-Wooden-Embroidery/dp/B06XXK4C3W/ref=sr_1_2578?qid=1679219463&s=toys&sr=1-2578,4.1,"1,942",₹339,₹500
Swipe Kart® Wave Board Skate Board with Carry Bag | LED Flash Colorful Lights in Wheels |(Variation Color Design) for Outd...,toys & baby products,Toys & Games,https://m.media-amazon.com/images/W/IMAGERENDERING_521856-T1/images/I/71NYMFpzOoL._AC_UL320_.jpg,https://www.amazon.in/PAYTAG%C2%AE-Presents-Ripstick-Illuminating-Capacity/dp/B092D3V9QB/ref=sr_1_2579?qid=1679219463&s=toys&sr=1-2579,4.3,55,"₹1,549","₹2,599"
KIKU Frozen Multi Purpose Movie Character Double Sided Plastic Jumbo Pencil Box with Calculator for Kids (Random Colour an...,toys & baby products,Toys & Games,https://m.media-amazon.com/images/W/IMAGERENDERING_521856-T1/images/I/51McaZVBxbL._AC_UL320_.jpg,https://www.amazon.in/Frozen-Character-Double-Calculator-Purpose/dp/B07P7D5DRD/ref=sr_1_2580?qid=1679219463&s=toys&sr=1-2580,3.9,667,₹492.50,₹899
"Ofsign Space Art Pencil Box with 2 Mesh Pockets, Pencil Case for Girls and Boys, Multipurpose Pencil Pouch for School, Tra...",toys & baby products,Toys & Games,https://m.media-amazon.com/images/W/IMAGERENDERING_521856-T1/images/I/71lH5VCzVuL._AC_UL320_.jpg,https://www.amazon.in/Ofsign-Space-Multipurpose-Stationery-Organizer/dp/B08VJ6YF47/ref=sr_1_2581?qid=1679219463&s=toys&sr=1-2581,4.5,90,₹664,"₹1,880"
Shumee Plush Fabric Clutching Soft Ball with Rattle for Babies (Age 0+) - Sensory Toy| Colorful Textured Developmental Bal...,toys & baby products,Toys & Games,https://m.media-amazon.com/images/W/IMAGERENDERING_521856-T1/images/I/71c7FwkdJJL._AC_UL320_.jpg,https://www.amazon.in/Shumee-Colorful-Fabric-Clutching-Babies/dp/B082Y6NVKP/ref=sr_1_2582?qid=1679219463&s=toys&sr=1-2582,4.4,342,₹803,₹945
"Intex 44669NP Inflatable PVC Hit Me 3D BOP Bags (Shark, Penguin, Tiger)",toys & baby products,Toys & Games,https://m.media-amazon.com/images/W/IMAGERENDERING_521856-T1/images/I/61AGq+4R91L._AC_UL320_.jpg,https://www.amazon.in/Intex-Inflatable-Bags-Color-Vary/dp/B0036QXU48/ref=sr_1_2583?qid=1679219463&s=toys&sr=1-2583,3.3,928,₹320,₹800
Clay Set for Kids Clay with Tools Different Color Clay Toy for Kids Multicolor Clay DIY Ultra Light Modelling Bouncing Cla...,toys & baby products,Toys & Games,https://m.media-amazon.com/images/W/IMAGERENDERING_521856-T1/images/I/41VXWc7b2wL._AC_UL320_.jpg,https://www.amazon.in/Tools-Different-Multicolor-Modelling-Bouncing/dp/B09JZMXVQJ/ref=sr_1_2584_mod_primary_new?qid=1679219463&s=toys&sbo=RZvfv%2F%2FHxDF%2BO5021pAnSA%3D%3D&sr=1-2584,3.2,120,₹290,₹499
"Butterfly EduFields 150+ Pcs Magnetic Alphabets Numbers Shapes Puzzle Toy for Kids 3 4 5 Years, Magnetic Board & Spelling ...",toys & baby products,Toys & Games,https://m.media-amazon.com/images/W/IMAGERENDERING_521856-T1/images/I/81wBvwRLurL._AC_UL320_.jpg,https://www.amazon.in/ButterflyEduFields-Magnetic-Alphabets-Spelling-Educational/dp/B0BCVYJWK2/ref=sr_1_2585?qid=1679219463&s=toys&sr=1-2585,3.8,55,₹799,₹999
BESTIES Big Size Beautiful Looking Super Soft 45cm Stuffed Girl Curly Doll-Polyfill Washable Cuddly Soft Plush Toy-Helps t...,toys & baby products,Toys & Games,https://m.media-amazon.com/images/W/IMAGERENDERING_521856-T1/images/I/71vKyoUH4HL._AC_UL320_.jpg,https://www.amazon.in/Beautiful-Doll-Polyfill-Washable-Toy-Helps-Play-100/dp/B09VLHJV13/ref=sr_1_2586?qid=1679219463&s=toys&sr=1-2586,3.9,34,₹299,"₹1,999"
SOLARA Water Bottle for Kids | Kids Water Bottle for Boys | Sipper Bottle for Kids | Thermosteel Kids Bottle | Stainless S...,toys & baby products,Toys & Games,https://m.media-amazon.com/images/W/IMAGERENDERING_521856-T1/images/I/71Shbqca16L._AC_UL320_.jpg,https://www.amazon.in/SOLARA-Stainless-Insulated-Thermosteel-Fish/dp/B0B2NXGQGD/ref=sr_1_2587?qid=1679219463&s=toys&sr=1-2587,4.5,89,₹999,"₹1,699"
WireScorts® 2pc 4WD Friction Powered Cars for Kids Big Rubber Tires Baby Boys Super Cars Blaze Truck Children Gift Toys Mu...,toys & baby products,Toys & Games,https://m.media-amazon.com/images/W/IMAGERENDERING_521856-T1/images/I/51VHjyxTFVL._AC_UL320_.jpg,https://www.amazon.in/WireScorts%C2%AE-Friction-Powered-Rubber-Children/dp/B09PDX7RZJ/ref=sr_1_2588?qid=1679219463&s=toys&sr=1-2588,4.1,292,₹279,₹999
"Party Propz 13Pcs Rose Gold Rubber Balloons, Star Balloons Combo For Birthday Decoration Items For Kids, Girls , Wife",toys & baby products,Toys & Games,https://m.media-amazon.com/images/W/IMAGERENDERING_521856-T1/images/I/61owPzabY-L._AC_UL320_.jpg,https://www.amazon.in/Party-Propz-Balloons-Birthday-Decoration/dp/B07WHP76HQ/ref=sr_1_2589?qid=1679219463&s=toys&sr=1-2589,4.3,"1,026",₹243,₹931
Rozi Decoration Coco Melon Happy Birthday Theme Party With 10 Pcs Props Multi Color Pack of ( 11 Pcs ),toys & baby products,Toys & Games,https://m.media-amazon.com/images/W/IMAGERENDERING_521856-T1/images/I/61OQDTg2swL._AC_UL320_.jpg,https://www.amazon.in/Rozi-Decoration-Melon-Happy-Birthday/dp/B0BRWNRTPR/ref=sr_1_2590?qid=1679219463&s=toys&sr=1-2590,3.0,2,,₹279
RATNA'S My Colouring MAT for Kids Reusable and Washable. Big MAT for Colouring. MAT Size(40 INCHES X 27 INCHES) (Fairies T...,toys & baby products,Toys & Games,https://m.media-amazon.com/images/W/IMAGERENDERING_521856-T1/images/I/91PiRI8-buS._AC_UL320_.jpg,https://www.amazon.in/RATNAS-Colouring-Reusable-Washable-Colouring/dp/B07VPWTFHF/ref=sr_1_2591?qid=1679219463&s=toys&sr=1-2591,4.1,126,₹349,₹355
"CHAMSWORLD FANCY STORE Spiderboy Superhero Kid's Costume,Fancy Dress Cosplay Carnival Costumes for Children, Birthday Gif...",toys & baby products,Toys & Games,https://m.media-amazon.com/images/W/IMAGERENDERING_521856-T1/images/I/71GmzxJFVHL._AC_UL320_.jpg,https://www.amazon.in/Spiderboy-Superhero-Carnival-Costumes-Halloween/dp/B09L6F412S/ref=sr_1_2592?qid=1679219463&s=toys&sr=1-2592,3.3,28,₹310,₹799
Parteet Cute Multipurpose Coin Earphone Pouch Return Gifts for Kids (Pack of 6),toys & baby products,Toys & Games,https://m.media-amazon.com/images/I/71bD+Is4POL._AC_UL320_.jpg,https://www.amazon.in/Parteet-Multipurpose-Earphone-Birthday-Return/dp/B0843BCDW8/ref=sr_1_3217?qid=1679219471&s=toys&sr=1-3217,3.8,45,₹499,₹900
"Toy Imagine HT-196 Portable Electrical Air Pump, AC 230 Voltage - Color Black",toys & baby products,Toys & Games,https://m.media-amazon.com/images/I/41gneap4CVL._AC_UL320_.jpg,https://www.amazon.in/Toy-Imagine-Electric-Balloon-Operation/dp/B0B5LGN5YH/ref=sr_1_3218?qid=1679219471&s=toys&sr=1-3218,,,₹529,₹999
Sarvda Birthday Return Gifts | Kaleidoscope | Handheld Games | Toys for Kids | Focus Booster | Educational Science Party T...,toys & baby products,Toys & Games,https://m.media-amazon.com/images/I/61VEWVvA+tL._AC_UL320_.jpg,https://www.amazon.in/Sarvda-Birthday-Kaleidoscope-Handheld-Educational/dp/B0BM9TNSY4/ref=sr_1_3219?qid=1679219471&s=toys&sr=1-3219,4.1,81,₹586,"₹1,794"
"Fisher-Price Laugh & Learn So Big Puppy, Large Musical Plush Toy with Smart Stages Learning Content for Toddlers and Presc...",toys & baby products,Toys & Games,https://m.media-amazon.com/images/I/71fQM3ferQL._AC_UL320_.jpg,https://www.amazon.in/Fisher-Price-Laugh-Learn-Puppy/dp/B08HRCY2QG/ref=sr_1_3220?qid=1679219471&s=toys&sr=1-3220,4.6,326,"₹2,749","₹2,999"
Party Propz Birthday photobooth Props 23 pcs - Multicolor,toys & baby products,Toys & Games,https://m.media-amazon.com/images/I/81SHFADT0DL._AC_UL320_.jpg,https://www.amazon.in/Party-Propz-Birthday-Photobooth-Props/dp/B079JWP9NL/ref=sr_1_3221?qid=1679219471&s=toys&sr=1-3221,4.2,139,₹219,₹399
Zest 4 Toyz Musical Mobile Phone Toy Cellphone Telephone Educational Learning Toys with Lights and Sound Toys for Babies K...,toys & baby products,Toys & Games,https://m.media-amazon.com/images/I/61rVZJK-YIL._AC_UL320_.jpg,https://www.amazon.in/cordless-musical-colorful-effects-wonderful/dp/B08BNKH39G/ref=sr_1_3222?qid=1679219471&s=toys&sr=1-3222,3.7,859,₹379,₹999
"Unicorn Birthday Girl Set of Gold Glitter Unicorn Headband and Pink Satin Sash for Girls with eBook Included,Happy Birthda...",toys & baby products,Toys & Games,https://m.media-amazon.com/images/I/71S40tZ6CUL._AC_UL320_.jpg,https://www.amazon.in/Unicorn-Birthday-Girl-Headband-Decorations/dp/B07WD219GR/ref=sr_1_3223?qid=1679219471&s=toys&sr=1-3223,4.0,307,₹296,₹420
"itoys Theme Peppa Pig Kid's Play House Pipe Tent for Kids, Multicolor",toys & baby products,Toys & Games,https://m.media-amazon.com/images/I/81sAf5d8t5L._AC_UL320_.jpg,https://www.amazon.in/itoys-Peppa-Kids-Play-House/dp/B08CNKSDB3/ref=sr_1_3224?qid=1679219471&s=toys&sr=1-3224,4.1,413,₹799,"₹1,999"
Webby Science Slime Putty Toy for Kids-Pack of 12,toys & baby products,Toys & Games,https://m.media-amazon.com/images/I/61oDonVJ1mL._AC_UL320_.jpg,https://www.amazon.in/Webby-Science-Kids-Pack-Multicolor-SLM-12/dp/B09D82L7M8/ref=sr_1_3225?qid=1679219471&s=toys&sr=1-3225,2.9,202,₹271,₹499
"VIVIDA ENTERPRISE Dancing Cactus Talking Toy, Cactus Plush Rechargeable Toy, Wriggle & Singing Recording Repeat What You S...",toys & baby products,Toys & Games,https://m.media-amazon.com/images/I/61XriWjkrhL._AC_UL320_.jpg,https://www.amazon.in/VIVIDA-ENTERPRISE-Rechargeable-Recording-Education/dp/B0BFW43WXZ/ref=sr_1_3226?qid=1679219471&s=toys&sr=1-3226,3.7,138,₹499,₹999
imagimake fleximos wonderland peel & stick window sticker – diy dotz air dry clay art set – for girls and boys 3 years+ (w...,toys & baby products,Toys & Games,https://m.media-amazon.com/images/I/71QpjtnI19S._AC_UL320_.jpg,https://www.amazon.in/Imagimake-Fleximos-Wonderland-Window-Sticker/dp/B08DD23TP6/ref=sr_1_3227?qid=1679219471&s=toys&sr=1-3227,4.0,"1,559",₹449,₹499
