name,main_category,sub_category,image,link,ratings,no_of_ratings,discount_price,actual_price
Toyzone Ben10 Double Barrel Shotgun-58793 | Foam Blaster Double Barrel Gun | Safe and Long Range | Lock & Load Pump Action...,toys & baby products,Toys & Games,https://m.media-amazon.com/images/W/IMAGERENDERING_521856-T1/images/I/61oK16myAuL._AC_UL320_.jpg,https://www.amazon.in/Toyzone-Barrel-Shotgun-58793-Blaster-Boomstick/dp/B09Q35JTZN/ref=sr_1_7172?qid=1679219532&s=toys&sr=1-7172,3.9,160,₹399,₹699
"Mee Mee Easy to Ride Baby Tricycle with Parental Control Handle | Cushioned Seat | Kids Storage Basket | for Kids, Boys, G...",toys & baby products,Toys & Games,https://m.media-amazon.com/images/W/IMAGERENDERING_521856-T1/images/I/61GsDouLiSS._AC_UL320_.jpg,https://www.amazon.in/Mee-Tricycle-Parental-Control-Cushioned/dp/B091Z6BP6J/ref=sr_1_7173?qid=1679219532&s=toys&sr=1-7173,3.6,71,"₹1,959","₹2,799"
"Deoxys Baby Folding Mat Play Foam Crawl Waterproof Portable Kids Baby Toddler Outdoor Use Non Toxic 6x6.5 FUT, Multicolor",toys & baby products,Toys & Games,https://m.media-amazon.com/images/W/IMAGERENDERING_521856-T1/images/I/81MZs+zBV8L._AC_UL320_.jpg,https://www.amazon.in/Deoxys-Folding-Waterproof-Portable-Multicolor/dp/B0BRBC92JP/ref=sr_1_7174?qid=1679219532&s=toys&sr=1-7174,5.0,1,"₹1,489","₹2,999"
RMP Rest Move Prove Carrom Board 32 inch Full Size for Adults Best Glossy Finish for Professionals with 2 Types of Coins W...,toys & baby products,Toys & Games,https://m.media-amazon.com/images/W/IMAGERENDERING_521856-T1/images/I/61Ql5HjABcL._AC_UL320_.jpg,https://www.amazon.in/RMP-Carrom-Adults-Professionals-Striker/dp/B0B36KS68Q/ref=sr_1_7175?qid=1679219532&s=toys&sr=1-7175,4.7,4,"₹1,349","₹2,999"
Baccha Party Rhinestone DIY Diamond Painting Kit for Kids and Adult,toys & baby products,Toys & Games,https://m.media-amazon.com/images/W/IMAGERENDERING_521856-T1/images/I/71yU8EyaEzL._AC_UL320_.jpg,https://www.amazon.in/Baccha-Embroidery-Rhinestone-Painting-Handmade/dp/B07ZBF6C4C/ref=sr_1_7176?qid=1679219532&s=toys&sr=1-7176,3.6,20,₹499,"₹1,299"
"KRASHTIC 300 GSM A4 Ivory Paper Ivory Sheet Set Of 25 Sheet, for Drawing, Painting, Sketching, Art and Craft, Extra smooth...",toys & baby products,Toys & Games,https://m.media-amazon.com/images/W/IMAGERENDERING_521856-T1/images/I/41i62Xcnh0L._AC_UL320_.jpg,https://www.amazon.in/KRASHTIC-Drawing-Painting-Sketching-smooth/dp/B09YRRZKNG/ref=sr_1_7489?qid=1679219538&s=toys&sr=1-7489,3.8,19,₹182,₹999
ANG Birthday Party Return Gifts Stationery Bag Set for Kids Birthday Party Set of 12 (Multi Color),toys & baby products,Toys & Games,https://m.media-amazon.com/images/W/IMAGERENDERING_521856-T1/images/I/81sga9QiJzL._AC_UL320_.jpg,https://www.amazon.in/ANG-Birthday-Party-Return-Stationery/dp/B07CRMZFBV/ref=sr_1_7490?qid=1679219538&s=toys&sr=1-7490,3.7,129,₹772,"₹1,199"
"House of Banter Marvel Spiderman Theme Birthday decoration Pack - 67pc Combo- 60 Multicolor Balloons, 1 Spiderman Foil Bal...",toys & baby products,Toys & Games,https://m.media-amazon.com/images/W/IMAGERENDERING_521856-T1/images/I/919CrDfTUML._AC_UL320_.jpg,https://www.amazon.in/Banter-Marvel-Spiderman-Birthday-decoration/dp/B0BR2KCXFR/ref=sr_1_7491?qid=1679219538&s=toys&sr=1-7491,5.0,2,₹459,"₹1,099"
"Lichee® Learning & Educational Puzzle Board Toy | Alphabet, Number & Patten, Puzzle | Writing and Reading Puzzle Toys for ...",toys & baby products,Toys & Games,https://m.media-amazon.com/images/W/IMAGERENDERING_521856-T1/images/I/919QV63Eu+S._AC_UL320_.jpg,https://www.amazon.in/Lichee%C2%AE-Learning-Educational-Alphabet-Writing/dp/B09CKZ9MXY/ref=sr_1_7492?qid=1679219538&s=toys&sr=1-7492,4.4,248,₹489,₹999
Uprising Store (60 Each x 7 = 420 Fake Note) Playing Indian Currency Fake Note Fake Note Gag Toy,toys & baby products,Toys & Games,https://m.media-amazon.com/images/W/IMAGERENDERING_521856-T1/images/I/71dBd5tQ7yL._AC_UL320_.jpg,https://www.amazon.in/Uprising-Store-Playing-Indian-Currency/dp/B0B3HYP9SS/ref=sr_1_7493?qid=1679219538&s=toys&sr=1-7493,3.3,11,₹257,₹589
LEGO Creator 3in1 Safari Wildlife Tree House 31116 Building Kit (397 Pieces),toys & baby products,Toys & Games,https://m.media-amazon.com/images/W/IMAGERENDERING_521856-T1/images/I/81+SmD0MtSL._AC_UL320_.jpg,https://www.amazon.in/LEGO-Creator-Wildlife-31116-Building/dp/B0B8NXB2Y9/ref=sr_1_7494?qid=1679219538&s=toys&sr=1-7494,4.8,20,"₹3,190.13","₹3,499"
"HK Balloons Smiley Balloon Printed Face Expression Latex Balloon 30 Pcs, Yellow/Emoji Balloon/Smiley Balloon/Birthday Deco...",toys & baby products,Toys & Games,https://m.media-amazon.com/images/W/IMAGERENDERING_521856-T1/images/I/51AGrj3GtJL._AC_UL320_.jpg,https://www.amazon.in/HK-Balloons-Expression-Decoration-Yellow-Emoji-Pack/dp/B0867JCSRM/ref=sr_1_7495?qid=1679219538&s=toys&sr=1-7495,3.7,279,₹189,₹299
"AARK PLANET Cartoon Character ''Peppa Pig'' Foil Balloon (Pink, 16 Inch) - Pack of 5",toys & baby products,Toys & Games,https://m.media-amazon.com/images/W/IMAGERENDERING_521856-T1/images/I/61XAkYuDfCL._AC_UL320_.jpg,https://www.amazon.in/AARK-PLANET-Cartoon-Birthday-Decoration/dp/B07Y5FP2K5/ref=sr_1_7496?qid=1679219538&s=toys&sr=1-7496,4.1,597,₹249,₹899
LEGO Speed Champions 007 Aston Martin DB5 76911 Building Kit (298 Pieces),toys & baby products,Toys & Games,https://m.media-amazon.com/images/W/IMAGERENDERING_521856-T1/images/I/81hWi40-qyL._AC_UL320_.jpg,https://www.amazon.in/LEGO-Champions-Martin-76911-Building/dp/B0B8NTTNC2/ref=sr_1_7497?qid=1679219538&s=toys&sr=1-7497,3.9,21,"₹2,849","₹2,999"
STACKRAID Alphabets Picture and Numbers Play Abacus Learning Kit for Kids (Multi Colour),toys & baby products,Toys & Games,https://m.media-amazon.com/images/W/IMAGERENDERING_521856-T1/images/I/71Bty8hoI3S._AC_UL320_.jpg,https://www.amazon.in/STACKRAID-Alphabets-Picture-Numbers-Learning/dp/B0994CBHMV/ref=sr_1_7498?qid=1679219538&s=toys&sr=1-7498,3.8,26,₹394,₹999
CR18 COLLECTION 2 in 1 Baby Horse Rider | Rocker for Kids 1-3 Years Birthday Gift for Kids/Boys/Girls (Multicolour),toys & baby products,Toys & Games,https://m.media-amazon.com/images/W/IMAGERENDERING_521856-T1/images/I/51IEbQPDoaL._AC_UL320_.jpg,https://www.amazon.in/CR18-COLLECTION-Rocker-Birthday-Multicolour/dp/B0918ND97X/ref=sr_1_7499?qid=1679219538&s=toys&sr=1-7499,3.9,88,₹599,₹999
"Skillofun Wooden Cubes Pattern Box, Multi Color",toys & baby products,Toys & Games,https://m.media-amazon.com/images/W/IMAGERENDERING_521856-T1/images/I/71SSClWfSdL._AC_UL320_.jpg,https://www.amazon.in/Skillofun-Wooden-Cubes-Pattern-Multi/dp/B007OU63NM/ref=sr_1_7500?qid=1679219538&s=toys&sr=1-7500,4.5,174,₹617,₹915
"Bhayani RC Stunt Car, 2.4GHz 4WD Remote Control Gesture Sensor Toy, Double Sided Rotating Off Road Vehicle 360° Flips with...",toys & baby products,Toys & Games,https://m.media-amazon.com/images/W/IMAGERENDERING_521856-T1/images/I/71AEXQ5BnLL._AC_UL320_.jpg,https://www.amazon.in/Bhayani-Control-Gesture-Rotating-Birthday/dp/B0BYJTYVTV/ref=sr_1_7501?qid=1679219538&s=toys&sr=1-7501,,,"₹2,999","₹6,999"
D ETERNAL Cube 2X2 4x4 and Pyraminx Pyramid Triangle Puzzle Cubes Combo Set,toys & baby products,Toys & Games,https://m.media-amazon.com/images/W/IMAGERENDERING_521856-T1/images/I/619PE4gNCSL._AC_UL320_.jpg,https://www.amazon.in/ETERNAL-Pyraminx-Pyramid-Triangle-Puzzle/dp/B07ZCBGCWR/ref=sr_1_7502?qid=1679219538&s=toys&sr=1-7502,4.2,209,₹779,₹999
"MorningVale kritika Toys & Gifts Snakes Toy (28-inch, Multicolor)",toys & baby products,Toys & Games,https://m.media-amazon.com/images/W/IMAGERENDERING_521856-T1/images/I/51q3jnEAxRL._AC_UL320_.jpg,https://www.amazon.in/kritika-Toys-Gifts-Assorted-Colours/dp/B07FSGZNS9/ref=sr_1_7503?qid=1679219538&s=toys&sr=1-7503,3.4,274,₹179,₹299
"R for Rabbit Tiny Toes T30 Ace with EVA Wheels Kids/Baby Tricycle, Cycle for Kids, Tricycle for Kids for 1.5 to 5 Years, B...",toys & baby products,Toys & Games,https://m.media-amazon.com/images/W/IMAGERENDERING_521856-T1/images/I/61SPN66nraL._AC_UL320_.jpg,https://www.amazon.in/Rabbit-Wheels-Tricycle-Storage-Basket/dp/B0BSV76B26/ref=sr_1_7504?qid=1679219538&s=toys&sr=1-7504,4.1,133,"₹4,949","₹6,599"
Yorkker Cake Toppers (Happy Birthday & Happy Anniversary) Golden Acrylic Cake Toppers for Kids Boy's Girls Adult Birthday ...,toys & baby products,Toys & Games,https://m.media-amazon.com/images/W/IMAGERENDERING_521856-T1/images/I/61Flzx8dz5S._AC_UL320_.jpg,https://www.amazon.in/Yorkker-Birthday-Anniversary-Decoration-Supplies/dp/B094WD6FNK/ref=sr_1_7505?qid=1679219538&s=toys&sr=1-7505,4.4,64,₹299,"₹1,500"
"Pinfliers Summer / Tropical Theme Party Pastel Paper Flower Garland, 18 Pieces, White, Pink, Yellow and Grey, 60 inches in...",toys & baby products,Toys & Games,https://m.media-amazon.com/images/W/IMAGERENDERING_521856-T1/images/I/61uMHn+1vHS._AC_UL320_.jpg,https://www.amazon.in/Pinfliers-Flower-Garland-Pieces-Yellow/dp/B0917FW4R5/ref=sr_1_7506?qid=1679219538&s=toys&sr=1-7506,3.9,42,₹535,₹875
THE CURIOUS BRAIN Glass Optical Lab Set (Multicolour),toys & baby products,Toys & Games,https://m.media-amazon.com/images/W/IMAGERENDERING_521856-T1/images/I/51xvTgLNsSL._AC_UL320_.jpg,https://www.amazon.in/CURIOUS-BRAIN-Optical-Lab-Multicolour/dp/B06XG76GF6/ref=sr_1_7507?qid=1679219538&s=toys&sr=1-7507,3.8,556,₹375,₹449
Frank Disney Pixar Cars First Puzzles - A Set of 3 Jigsaw Puzzles for 3 Year Old Kids and Above,toys & baby products,Toys & Games,https://m.media-amazon.com/images/W/IMAGERENDERING_521856-T1/images/I/81eFnFZEB7L._AC_UL320_.jpg,https://www.amazon.in/Frank-Cars-First-Educational-Puzzle/dp/B00TOC6NCO/ref=sr_1_7508?qid=1679219538&s=toys&sr=1-7508,4.2,88,₹150,₹175
Shumee Wooden 3-in-1 Pull-Along Musical Animal Shape Sorting Truck Toy (2 Years+) with Xylophone & Shape Sorter| Encourage...,toys & baby products,Toys & Games,https://m.media-amazon.com/images/W/IMAGERENDERING_521856-T1/images/I/419fp1dq+RL._AC_UL320_.jpg,https://www.amazon.in/Shumee-Wooden-Musical-Animal-Sorting/dp/B00LN30X96/ref=sr_1_7509?qid=1679219538&s=toys&sr=1-7509,4.2,99,"₹1,799","₹1,999"
"Aj Alliance Wooden Colorful Attractive Non Toxic Rattles,Musical Toys,Eco Friendly Toys,Rattles Set for New Born Baby, Inf...",toys & baby products,Toys & Games,https://m.media-amazon.com/images/W/IMAGERENDERING_521856-T1/images/I/61KXGiRUxkL._AC_UL320_.jpg,https://www.amazon.in/Aj-Alliance-Rattles-Toys-Set/dp/B0BR2MM6B6/ref=sr_1_7510?qid=1679219538&s=toys&sr=1-7510,3.8,5,₹355,"₹1,299"
Baby Cloth Book PDSPM Learning Pillow Book Cushion Books Developmental Books for Kids Boys Babies with 2 Languages ​​to Le...,toys & baby products,Toys & Games,https://m.media-amazon.com/images/W/IMAGERENDERING_521856-T1/images/I/81beFMFr25L._AC_UL320_.jpg,https://www.amazon.in/PDSPM-Learning-Cushion-Developmental-Languages/dp/B0BN1YDLRR/ref=sr_1_7511?qid=1679219538&s=toys&sr=1-7511,4.8,8,₹399,"₹1,199"
Hemito 55 Pc Birthday Decoration item Birthday Banner Metallic Pastel Balloons Confetti Chrome Balloons along with Glue Do...,toys & baby products,Toys & Games,https://m.media-amazon.com/images/W/IMAGERENDERING_521856-T1/images/I/71dN2fOqVsL._AC_UL320_.jpg,https://www.amazon.in/Hemito-Birthday-Decoration-Metallic-Decorations/dp/B0BV65BG1B/ref=sr_1_7512?qid=1679219538&s=toys&sr=1-7512,4.0,1,₹284.05,"₹1,299"
Hetkrishi| Toys Magic Small 13.5 cm Fake Knife Digger Daggers Practical Jokes and Prank Trick Toys Gift for Kids and Adult...,toys & baby products,Toys & Games,https://m.media-amazon.com/images/I/419GO7XrHdL._AC_UL320_.jpg,https://www.amazon.in/Hetkrishi-Digger-Daggers-Practical-Adults/dp/B09ZQLQWRV/ref=sr_1_7681?qid=1679219542&s=toys&sr=1-7681,3.2,36,₹118,₹599
SUPER TOY Super Hero Avangers Action Figure Brick Toy for Kids,toys & baby products,Toys & Games,https://m.media-amazon.com/images/I/51-XaSYyTJL._AC_UL320_.jpg,https://www.amazon.in/SUPER-TOY-Avangers-Action-Figure/dp/B09FTG1DGC/ref=sr_1_7682?qid=1679219542&s=toys&sr=1-7682,3.5,40,₹549,₹999
"Shinsei Plastic Cargo Truck, Pack of 1, Orange",toys & baby products,Toys & Games,https://m.media-amazon.com/images/I/818vafAeSQL._AC_UL320_.jpg,https://www.amazon.in/Shinsei-Cargo-Carrier-Toy-Truck/dp/B08B1QFT7C/ref=sr_1_7683?qid=1679219542&s=toys&sr=1-7683,3.8,149,₹359,₹499
"Woodii Heli Watch Remote Controlled Helicopter with Unbreakable Dual Rotating Blades, Helicopter Flying Toy with Watch (Co...",toys & baby products,Toys & Games,https://m.media-amazon.com/images/I/41CPZ2Q-aYL._AC_UL320_.jpg,https://www.amazon.in/Woodii-Controlled-Helicopter-Unbreakable-Rotating/dp/B0BVMLF4RP/ref=sr_1_7684?qid=1679219542&s=toys&sr=1-7684,,,₹798,"₹1,999"
"Toyshine Pack of 5 - Apple, Cactus, Duck, Fat Man, Gamepad - Fidget Popping Sounds Toy, BPA Free Silicone, Push Bubbles To...",toys & baby products,Toys & Games,https://m.media-amazon.com/images/I/71aOxovRwSL._AC_UL320_.jpg,https://www.amazon.in/Toyshine-Pack-Gamepad-Silicone-Reliever/dp/B09FYDWN98/ref=sr_1_7685?qid=1679219542&s=toys&sr=1-7685,4.2,461,₹474,"₹1,999"
SSKR Nutrine Black Board Slate for Kids and Children educational| 20 x 25 Cms | Free Slate Pencils Inside,toys & baby products,Toys & Games,https://m.media-amazon.com/images/I/81-5HYrGkHS._AC_UL320_.jpg,https://www.amazon.in/SSKR-Nutrine-Children-Pencils-Inside/dp/B09BK8C2MQ/ref=sr_1_7686?qid=1679219542&s=toys&sr=1-7686,3.8,106,₹176,₹250
PLUSPOINT Kids Wooden Funny Colourful Stacking Tumbling Building Blocks Board Games Coloring A Complete Game for All Ages...,toys & baby products,Toys & Games,https://m.media-amazon.com/images/I/61q4pdWzbgS._AC_UL320_.jpg,https://www.amazon.in/PLUSPOINT-Wooden-Stacking-Building-Blocks/dp/B09BFSPT34/ref=sr_1_7687?qid=1679219542&s=toys&sr=1-7687,4.1,"1,416",₹449,₹999
"Keshav Creation Round Fruits Shape Decorative Cushion (Multicolour, 12x12 Inches) | Soft Toys | Round Foam | Velvet",toys & baby products,Toys & Games,https://m.media-amazon.com/images/I/811kskzSiGL._AC_UL320_.jpg,https://www.amazon.in/Keshav-Creation-Decorative-Cushion-Multicolour/dp/B0BFK8WHYT/ref=sr_1_7688?qid=1679219542&s=toys&sr=1-7688,4.4,3,₹229,₹499
LUCHILA Spiderman Playboy Special Printed Wood Big Skateboard for Kids (Multi Color ).,toys & baby products,Toys & Games,https://m.media-amazon.com/images/I/31dcuKdixxL._AC_UL320_.jpg,https://www.amazon.in/LUCHILA-Spiderman-Playboy-Special-Skateboard/dp/B09TH7SMSZ/ref=sr_1_7689?qid=1679219542&s=toys&sr=1-7689,3.6,14,,₹599
GeoKraft Educational 12 Inch Political Metal Base STEM Globe with Magnifying Glass for Kids (Blue),toys & baby products,Toys & Games,https://m.media-amazon.com/images/I/71GKv2cd3KL._AC_UL320_.jpg,https://www.amazon.in/GeoKraft-Educational-Political-Laminated-Chrome/dp/B07ZXB2VTQ/ref=sr_1_7690?qid=1679219542&s=toys&sr=1-7690,4.2,"9,128","₹1,299","₹1,600"
HAPPY HUES Kid's Cloud ECart Little Engineer Creative Junior Techno Mechanical Kit Brain Booster for Age 6 Years and Above...,toys & baby products,Toys & Games,https://m.media-amazon.com/images/I/51rH7ZebxbL._AC_UL320_.jpg,https://www.amazon.in/CloudECart-Engineer-Mechanical-Booster-Creative/dp/B08LSC6KXP/ref=sr_1_7691?qid=1679219542&s=toys&sr=1-7691,4.1,39,₹549,₹585
"Festiko®Football Theme Party Supplies - for Game Day, and Football Birthday Party Decorations ,Party Supplies Themed Banner",toys & baby products,Toys & Games,https://m.media-amazon.com/images/I/71uNWYO3+4L._AC_UL320_.jpg,https://www.amazon.in/Festiko%C2%AEFootball-Theme-Party-Supplies-Decorations/dp/B09MM9NMCQ/ref=sr_1_7692?qid=1679219542&s=toys&sr=1-7692,3.9,71,₹199,₹498
"Toyshine Inflatable Hit Me Bop Bag Boxing Wrestling Toy for Kids, Sports Indoor Activity Push Game Kids Toy, Fill with Wat...",toys & baby products,Toys & Games,https://m.media-amazon.com/images/I/61kzDY7czyL._AC_UL320_.jpg,https://www.amazon.in/Toyshine-Inflatable-Boxing-Wrestling-Activity/dp/B0BMB3F3B2/ref=sr_1_7693?qid=1679219542&s=toys&sr=1-7693,3.2,7,₹426,₹999
Biche Fur Handcuff Sets Blind fold Whip for Kids Pretend Toys Games (Black),toys & baby products,Toys & Games,https://m.media-amazon.com/images/I/21qUbqv3IkL._AC_UL320_.jpg,https://www.amazon.in/Biche-Handcuff-Blind-Pretend-Games/dp/B0BF15J1FT/ref=sr_1_7694?qid=1679219542&s=toys&sr=1-7694,2.0,2,₹699,"₹1,295"
Flubble bubble 500 BB Bullets 6 mm Plastic bb Bullets for Toy Gun airshot Gun Toy Gun goli Toy Charra Toy 500 Pieces 6 mm ...,toys & baby products,Toys & Games,https://m.media-amazon.com/images/I/410v2L1RQuL._AC_UL320_.jpg,https://www.amazon.in/Flubble-bubble-Bullets-Plastic-airshot/dp/B0BC92CXGV/ref=sr_1_7695?qid=1679219542&s=toys&sr=1-7695,5.0,2,₹199,₹999
"JoyRide Three Wheel Kick Scooter for Boys and Girls with Adjustable Height,Storage Basket , Foot Break (3 Years-8 Years)",toys & baby products,Toys & Games,https://m.media-amazon.com/images/I/51RhHldCNFL._AC_UL320_.jpg,https://www.amazon.in/JoyRide-Scooter-Adjustable-Storage-Years-8/dp/B07XVQF46Z/ref=sr_1_7696?qid=1679219542&s=toys&sr=1-7696,4.1,"1,053","₹1,919","₹4,199"
"Festiko ® Peppa Pig Happybirthday Theme Party Decoration Swirls with Cutouts for Ceiling, Peppa Pigs Party Favors for Kids...",toys & baby products,Toys & Games,https://m.media-amazon.com/images/I/61uUHGaQ6ZS._AC_UL320_.jpg,https://www.amazon.in/Festiko%C2%AE-Happybirthday-Decoration-Cutouts-Birthday/dp/B096PHJ8BV/ref=sr_1_7697?qid=1679219542&s=toys&sr=1-7697,4.1,142,₹219,₹399
"HUG 'n' FEEL SOFT TOYS Teddy Bear 5 Feet, Soft Toys (5 Feet, Red)",toys & baby products,Toys & Games,https://m.media-amazon.com/images/I/61l7pnsQ8CL._AC_UL320_.jpg,https://www.amazon.in/Extra-Lovable-Huggable-Girlfriend-Birthday/dp/B07CY1P73C/ref=sr_1_7698?qid=1679219542&s=toys&sr=1-7698,4.1,"28,065","₹1,622","₹2,499"
Birthday Popper Rainbow Combo Pack with Paper Goody Bag and Thank You Card (Set of 10; Multi-Colour) as Birthday Return Gi...,toys & baby products,Toys & Games,https://m.media-amazon.com/images/I/71SkjKFkWfL._AC_UL320_.jpg,https://www.amazon.in/Birthday-Popper-Return-Rainbow-Goody/dp/B07K5Y6DLJ/ref=sr_1_7699?qid=1679219542&s=toys&sr=1-7699,4.2,84,"₹1,299","₹1,599"
"stress reliever toys, 3 pack new kawaii original japan lazy cat mochi decompress squishy squeeze cat healing toy mini gift...",toys & baby products,Toys & Games,https://m.media-amazon.com/images/I/61vWmNS-KwL._AC_UL320_.jpg,https://www.amazon.in/Reliever-Original-Decompress-Squishy-Squeeze/dp/B0743DSM67/ref=sr_1_7700?qid=1679219542&s=toys&sr=1-7700,3.1,373,₹249,₹599
"Epyz Solar lamp for Home String Lights 30 LED Decorative Lighting Crystal Water Drop for Garden, Home, Patio, Lawn, Party,...",toys & baby products,Toys & Games,https://m.media-amazon.com/images/I/61VRi2x+A8L._AC_UL320_.jpg,https://www.amazon.in/Epyz-Decorative-Decorations-Waterproof-20FT-Warm/dp/B08KW7TGMT/ref=sr_1_7701?qid=1679219542&s=toys&sr=1-7701,4.0,"1,066",₹875,"₹1,499"
Webby Science Slime Putty Toy for Kids (Pack of 24),toys & baby products,Toys & Games,https://m.media-amazon.com/images/I/61oDonVJ1mL._AC_UL320_.jpg,https://www.amazon.in/Webby-Science-Slime-Putty-Kids/dp/B08V8N6BZR/ref=sr_1_7702?qid=1679219542&s=toys&sr=1-7702,2.9,202,₹449,₹499
"Centy Toys Plastic Farm Tractor, Pack Of 1, Orange; Red",toys & baby products,Toys & Games,https://m.media-amazon.com/images/I/818u5ISxGAL._AC_UL320_.jpg,https://www.amazon.in/Centy-Toys-Classic-Kidsshub-Orange-Red/dp/B01BSOQXBQ/ref=sr_1_7703?qid=1679219542&s=toys&sr=1-7703,3.7,90,₹360,₹450
"Toyshine Pack of 2 Foam Blaster Gun Toy, Safe and Long Range, 20 Bullets- Made in India, Blue",toys & baby products,Toys & Games,https://m.media-amazon.com/images/I/71W1a0hj72L._AC_UL320_.jpg,https://www.amazon.in/Toyshine-Blaster-Range-Bullets-India/dp/B0BLZR5534/ref=sr_1_7704?qid=1679219542&s=toys&sr=1-7704,4.5,5,₹651,"₹1,999"
God Gift Cuddly Soft Gift Cute pikachucartonn Stuffed Soft Plush Toy 25 cm Special Edition OO179,toys & baby products,Toys & Games,https://m.media-amazon.com/images/W/IMAGERENDERING_521856-T1/images/I/41hLUs8+pYL._AC_UL320_.jpg,https://www.amazon.in/God-Gift-pikachucartonn-Stuffed-Special/dp/B09V97RZX4/ref=sr_1_8017?qid=1679219547&s=toys&sr=1-8017,,,₹199,₹999
"HUG 'n' FEEL SOFT TOYS Teddy Bear, Soft Toys, Teddy Bear 3 feet for Girls, Birthday Gift for Girls, Birthday Gift, Boyfrie...",toys & baby products,Toys & Games,https://m.media-amazon.com/images/W/IMAGERENDERING_521856-T1/images/I/61eiZkjYUQL._AC_UL320_.jpg,https://www.amazon.in/HUG-FEEL-SOFT-TOYS-Boyfriend/dp/B09G9W7JJJ/ref=sr_1_8018?qid=1679219547&s=toys&sr=1-8018,4.1,"28,065",₹675,₹899
Little Innocents® Big Size Fibre Filled Stuffed Animal Elephant Baby Pillow with Ball Soft Toy for Baby of Plush Hugging P...,toys & baby products,Toys & Games,https://m.media-amazon.com/images/W/IMAGERENDERING_521856-T1/images/I/61rp7RoZQXL._AC_UL320_.jpg,https://www.amazon.in/Little-Innocents%C2%AE-Stuffed-Elephant-Birthday/dp/B0BQMXBPXZ/ref=sr_1_8019?qid=1679219547&s=toys&sr=1-8019,3.5,2,₹649,"₹1,699"
Zen Sangam Express your Mind Zen Sangam Artists’ - A3 Spiral Mixed Media Art Journal Landscape - 200 GSM - Ultra Smooth Su...,toys & baby products,Toys & Games,https://m.media-amazon.com/images/W/IMAGERENDERING_521856-T1/images/I/71iYiTlemKL._AC_UL320_.jpg,https://www.amazon.in/Zen-Sangam-HardBound-Book-A3-200GSM-50Pages-Cartridge/dp/B08PC47ZYK/ref=sr_1_8020?qid=1679219547&s=toys&sr=1-8020,4.2,248,₹525,₹550
Xinbowen Electric Balloon Pump Machine / Balloon Blower Machine / Metallic Balloon Air Pump/ Bolloon Pump/ Balloon Filling...,toys & baby products,Toys & Games,https://m.media-amazon.com/images/W/IMAGERENDERING_521856-T1/images/I/41QNMbR0x8L._AC_UL320_.jpg,https://www.amazon.in/Xinbowen-Electric-Balloon-Metallic-Electronic/dp/B0BT9KD1PR/ref=sr_1_8021?qid=1679219547&s=toys&sr=1-8021,,,₹840,"₹1,899"
"NARAYANMUNI Relieve Stress Orbit Ball Fingertip Gyroscope Toy, Pinball Gyro Cube,3 + Years Spinning Toys-Peach",toys & baby products,Toys & Games,https://m.media-amazon.com/images/W/IMAGERENDERING_521856-T1/images/I/41g-Zz1Ro-L._AC_UL320_.jpg,https://www.amazon.in/NARAYANMUNI-Fingertip-Gyroscope-Spinning-Toys-Peach/dp/B09SL1WR8L/ref=sr_1_8022?qid=1679219547&s=toys&sr=1-8022,3.0,68,₹249,₹399
"Atpata Funky Fruit Theme Foil Balloons, multicolour, large (Foil-Fruits6pcs)",toys & baby products,Toys & Games,https://m.media-amazon.com/images/W/IMAGERENDERING_521856-T1/images/I/61+-m38KwHL._AC_UL320_.jpg,https://www.amazon.in/Atpata-Funky-Balloons-multicolour-Foil-Fruits6pcs/dp/B08Z5CP2WP/ref=sr_1_8023?qid=1679219547&s=toys&sr=1-8023,4.3,63,₹330,₹390
"Shuban Art Supplies for Kids Deluxe Kids Art Set for Drawing Painting and More with Portable Art Box, Coloring Supplies Ar...",toys & baby products,Toys & Games,https://m.media-amazon.com/images/W/IMAGERENDERING_521856-T1/images/I/71l-ragS6fL._AC_UL320_.jpg,https://www.amazon.in/Shuban-Supplies-Painting-Portable-Christmas/dp/B09SLN3RB7/ref=sr_1_8024?qid=1679219547&s=toys&sr=1-8024,3.5,57,₹999,"₹1,499"
"ToyKraft Educational Toys for 2 Year Old Boy Girl, Puzzle Baby Toys , Jigsaw Puzzles, Puzzles Toddler Toys for 2 Year, My ...",toys & baby products,Toys & Games,https://m.media-amazon.com/images/W/IMAGERENDERING_521856-T1/images/I/61YTONFix2L._AC_UL320_.jpg,https://www.amazon.in/Toykraft-Baby-Puzzle-Kiddo-Toys/dp/B00E7LKXGO/ref=sr_1_8025?qid=1679219547&s=toys&sr=1-8025,4.2,788,,₹249
"Party Propz Birthday Decoration For Girls - 50 Items Combo Kit - Rose Gold Foil Balloon, Metallic and Chrome Balloon, Pink...",toys & baby products,Toys & Games,https://m.media-amazon.com/images/W/IMAGERENDERING_521856-T1/images/I/71WKX+7-eVS._AC_UL320_.jpg,https://www.amazon.in/Party-Propz-Birthday-Decoration-Girls/dp/B091TP6VXH/ref=sr_1_8026?qid=1679219547&s=toys&sr=1-8026,4.3,"7,362",₹565,₹999
Party Assets Printed Cocomelon Character Theme Balloon for Decoration Kids Birthday Party Balloon Balloon Bouquet (coco-5),toys & baby products,Toys & Games,https://m.media-amazon.com/images/W/IMAGERENDERING_521856-T1/images/I/61kWy41KN-L._AC_UL320_.jpg,https://www.amazon.in/Party-Assets-Cocomelon-Character-Decoration/dp/B0BT9BMV78/ref=sr_1_8027?qid=1679219547&s=toys&sr=1-8027,5.0,1,₹379,"₹1,299"
"Pinkfong Baby Shark Plush Singing Plush Toy 8 Inch Mommy Shark for The Kids of 1 Year and Above, White, (BS60002)",toys & baby products,Toys & Games,https://m.media-amazon.com/images/W/IMAGERENDERING_521856-T1/images/I/51doeiVKQsL._AC_UL320_.jpg,https://www.amazon.in/Pinkfong-Baby-Shark-Singing-BS60002/dp/B09MFX8B9B/ref=sr_1_8028?qid=1679219547&s=toys&sr=1-8028,4.1,137,₹680.96,₹999
"Aashiya trades Kids Makeup Kit for Girls, Kids Play Washable Makeup Set Girl Gifts for 3/4/5/6/7year",toys & baby products,Toys & Games,https://m.media-amazon.com/images/W/IMAGERENDERING_521856-T1/images/I/71xESAzCYoL._AC_UL320_.jpg,https://www.amazon.in/Aashiya-trades-Makeup-Girls-Washable/dp/B0944B4W94/ref=sr_1_8029?qid=1679219547&s=toys&sr=1-8029,3.2,58,₹180,₹799
"Ouija Board Wooden with Planchette and Oracle Card Stand, Divination and Metaphysical Wood Talking Spirit Board Game for R...",toys & baby products,Toys & Games,https://m.media-amazon.com/images/W/IMAGERENDERING_521856-T1/images/I/71QQGoP7MwL._AC_UL320_.jpg,https://www.amazon.in/Planchette-Divination-Metaphysical-Revealing-Mystical/dp/B0BQZGFNQQ/ref=sr_1_8030?qid=1679219547&s=toys&sr=1-8030,3.9,13,₹799,"₹1,599"
"SPOCCO 13""X 13"" (Open) Wooden Chess Set for Kids and Adults- Folding Chess Board Wood Pawns XD16",toys & baby products,Toys & Games,https://m.media-amazon.com/images/W/IMAGERENDERING_521856-T1/images/I/71tmWA9lVJL._AC_UL320_.jpg,https://www.amazon.in/SPOCCO-Wooden-Chess-Adults-Folding/dp/B09BG2Z22L/ref=sr_1_8031?qid=1679219547&s=toys&sr=1-8031,,,₹599,"₹2,199"
HappyKids Gaming - Fortnite Grand Battles,toys & baby products,Toys & Games,https://m.media-amazon.com/images/I/81nFnBevF8L._AC_UL320_.png,https://www.amazon.in/HappyKids-Gaming-Fortnite-Grand-Battles/dp/B0BSLQVQBN/ref=sr_1_8032?qid=1679219547&s=toys&sr=1-8032,3.6,30,,
